"results_author","results_date","results_des","results_img","results_title","results_url"
"史情研习社","4天前","第二个就是千年不倒的乐山大佛,每逢灾难大事,都会闭眼“流泪”,这究竟是怎么回事呢? 01自挖双目 乐山大佛头顶后方,有一个海师洞,据说海通和尚曾在这里居住过,洞门口能看到海通禅师坐像。 坐像下方,刻有一排大字“自目可剜,佛财难...","https://dss0.baidu.com/6ONWsjip0QIZ8tyhnq/it/u=1631013806,140187841&fm=30&app=106&size=f242,162&n=0&g=0n&f=JPEG?s=80AA45FB8A0202CEDA95C4300300C052&sec=1618987767&t=ff8f7fb054c27cca43054b2e20687936","千年不倒的乐山大佛,为什么每逢灾难大事,就会闭眼“流泪”?","https://baijiahao.baidu.com/s?id=1697166690846227134&wfr=spider&for=pc"
"网易","4天前","再次提及,里面称“根据巴巴万加神婆的预测,2020年是改变世界的一年,不过在2021年也不会给人喘息的机会。三个“巨人”将会联合起来,但是会有一条巨龙影响世界,困难的时刻还是要来临,人们的信仰要分裂,2021年世界或许还要面临一些灾难等”...","https://dss1.bdstatic.com/6OF1bjeh1BF3odCf/it/u=2677752809,1564638417&fm=217&app=2&size=f242,162&n=0&g=0n&f=JPEG?s=DEB22DC4506324BC009864A30300F012&sec=1618987767&t=abd283a73c76fa911433b483181a915d","巴巴万加预言2021,到底有什么灾难?为何说“巨龙”影响世界?","https://www.163.com/dy/article/G7NMU78K0534HPNF.html"
"湖南频道","4天前","4月16日上午,湖南省召开2021年全省地质灾害防治工作电视电话会议。会议在湖南省政府电视电话会议室设主会场,全省各市州、县市区政府设分会场。会议总结了全省2020年地质灾害防治工作情况,安排部署2021年全省地质灾害防治工作任务。湖南省副省...","NoPicture","湖南2021地质灾害防治工作会议|把“防”作为主攻方向","http://hn.rednet.cn/content/2021/04/16/9193244.html"
"网易新闻","4天前","中国是气象灾害严重的国家,主要气象灾害有洪涝、干旱、寒潮、梅雨、台风、沙尘暴等 。 洪涝是中国频繁发生的自然灾害,对社会经济正常发展和人民生命财产安全构成严重威胁。它多出现在降水比较集中的夏、秋季,是中国东部平原地区的多发灾害之...","NoPicture","多气象灾害","http://dy.163.com/article/G7N2ALKE0534HFB9.html"
"常德发布","4天前","1959年至1961年,常德地区遭受了严重的自然灾害,三年中,水、旱、虫、风灾相继发生。1959年6月,临澧、石门两县连降暴雨,导致山洪暴发。1961年,全地区蝗虫和螟虫危害面积达122.7万亩。专署一方面发动群众人工治虫,另一方面请求上级派出飞...","https://cambrian-images.cdn.bcebos.com/f4cd36100490c05a3a5a541d90e3a2da_1599491838730970.jpeg@w_100,h_100","【党史上的常德】应对三年自然灾害","https://baijiahao.baidu.com/s?id=1697167716280428506&wfr=spider&for=pc"
"蚌埠市人民政府","4天前","【自然灾害类】遭遇洪水的自救措施 发布时间:2021-04-16 11:39 来源: 五河县双忠庙镇政府 浏览量:6 【字体:大 中 小】 打印 1、洪水到来时,来不及转移的人员,要就近迅速向山坡、高地、楼房、避洪台等地转移,或者立即爬...","NoPicture","【自然灾害类】遭遇洪水的自救措施","http://www.bengbu.gov.cn/public/25551/48255201.html"
"星沙时报","4天前","地质灾害防治是“生命工程”。但由于当前雨水天气增多,降雨集中,因降雨引发的地质灾害风险较大。特别是一些地方切坡建房修路、蓄水造库、城市开发等工程活动更容易诱发地质灾害。 为此,长沙县自然资源局将切实加强领导、全面落实防灾责任,扎...","https://cambrian-images.cdn.bcebos.com/f8de7f5f32453ffd155a4e3a831b4bcd_1629767261579929.jpeg@w_100,h_100","地质灾害猛如虎 预防知识要牢记","https://baijiahao.baidu.com/s?id=1697161662935146806&wfr=spider&for=pc"
"澎湃新闻","2020年7月9日","近日,接连发生两起塔吊倒塌事故造成8死1伤,值得大家警惕。 据安徽省应急管理厅网站消息,7月5日17时许,淮南市凤台县凤凰湖三角地带标准化厂房建设项目施工过程中发生塔吊倒塌事故,造成5人受伤,先后经抢救无效死亡。 ","https://dss1.bdstatic.com/6OF1bjeh1BF3odCf/it/u=2491275673,3909703410&fm=217&app=92&size=f242,162&n=0&g=0n&f=JPEG?s=4950C412170A6149547C09DD000050B2&sec=1618987769&t=17b467c46cf747a04dda4ff3605d9b9e","塔吊倒塌,8死1伤!","http://www.thepaper.cn/newsDetail_forward_8192904"
"潇湘晨报","2020年7月8日","张丽告诉记者,去年8月9日下午6点左右,她将自己的小轿车停放在了正在建设的管城区金岱街道办事处(原为南曹乡)姚庄安置区旁边,当她在8月10日上午9点左右去开车时发现,轿车旁边的一堵围墙倒塌了,砖块砸在了她的车上,令其车辆受损非常...","https://dss0.bdstatic.com/6Ox1bjeh1BF3odCf/it/u=4168749052,191626098&fm=173&app=49&size=f242,162&n=0&g=0n&f=JPEG?s=34832FF75A113ECE5CA48D0C03000043&sec=1618987769&t=5389fdd3115da7d6cd84744721bd6c8f","女子爱车停路边被倒塌围墙砸坏,想去法院起诉却被要求得先找到“墙...","https://baijiahao.baidu.com/s?id=1671632943243456027&wfr=spider&for=pc"
"腾讯网","2020年7月6日","1.据安徽省应急管理厅网站消息,7月5日17时许,淮南市凤台县凤凰湖三角地带标准化厂房建设项目施工过程中发生塔吊倒塌事故,造成5人受伤,先后经抢救无效死亡。 2.据钟祥新闻网消息,7月4日下午14时50分左右,湖北钟祥市承天壹号院B区施...","https://dss1.bdstatic.com/6OF1bjeh1BF3odCf/it/u=1284132677,3376527744&fm=217&app=92&size=f242,162&n=0&g=0n&f=PNG?s=0111CC323F0A6149507C09D90300C0B2&sec=1618987769&t=dcd01e209e76c7d3948acae6560cecc2","突发!8死1伤!塔吊倒塌!安徽淮南、湖北钟祥接连发生","https://new.qq.com/omn/20200706/20200706A0BZD400.html"
"中国新闻网","2020年7月6日","(刘浩)安徽省应急管理厅6日消息:该省淮南市凤台县一建筑工地塔吊倒塌,造成5人死亡。消息称,7月5日17时许,淮南市凤台县凤凰湖三角地带标准化厂房建设项目施工过程中发生塔吊倒塌事故,造成5人受伤,先后经抢救无效死亡。","https://dss0.bdstatic.com/6Ox1bjeh1BF3odCf/it/u=4017895075,3036194923&fm=217&app=92&size=f242,162&n=0&g=0n&f=JPEG?s=4050CC3A1FCA6149507C09D90000C0B2&sec=1618987769&t=7b196841129b369618e6c8ea41ac46f1","安徽淮南凤台一建筑工地塔吊倒塌 造成5人死亡","https://www.chinanews.com/sh/2020/07-06/9230483.shtml"
"澎湃新闻","2020年7月3日","4月19日,广东深圳一在建工地塔吊安装调式塔吊垂直度时、拆掉塔吊四个支撑腿中的两个支撑腿的全部6个螺丝,塔吊吊钩上吊着2个塔吊标准节,塔吊臂上走车到司机远端,造成塔吊基础连接处力矩增大,塔吊整体失稳倒塌,2死3伤。 ","https://dss1.bdstatic.com/6OF1bjeh1BF3odCf/it/u=1880550327,447533953&fm=217&app=92&size=f242,162&n=0&g=0n&f=JPEG?s=AF4A4D814D058ACE00AD7C8903007081&sec=1618987769&t=e829e97e436420c2958bc043def73228","安徽一大桥工程龙门架突然倒塌致2死1伤!现场发生了什么?","http://www.thepaper.cn/newsDetail_forward_8098701"
"潇湘晨报","2020年7月2日","抢修现场7月2日晚,景宁普降大雨,景庆公路毛垟至沙湾段多处大树倒塌,拦住道路。毛垟乡党员干部冒雨疏通毛垟乡10余位党员干部组成的应急队伍立即赶赴现场,冒雨疏通抢修。抢修现场截至7月2日夜22时30分,已抢通4处道路,疏理小面积塌方6...","https://dss2.bdstatic.com/6Ot1bjeh1BF3odCf/it/u=1590929318,2410367700&fm=173&app=49&size=f242,162&n=0&g=0n&f=JPEG?s=BE120CCBCE739BDC72FC8C0C0300F043&sec=1618987769&t=37dde16d2cb870470e1d26bcbc9bb68e","大树倒塌拦路 景宁毛垟乡党员干部连夜抢修","https://baijiahao.baidu.com/s?id=1671121627804131302&wfr=spider&for=pc"
"红星新闻","2020年6月23日","↑事发现场红星新闻记者在网络上查询发现,在2016年,攀枝花东区密地桥也发生过围墙倒塌事故。据攀枝花当地媒体报道,2016年7月27日8时20分左右,攀枝花东区密地桥北1路公交车站发生一起人为导致围墙倒塌事故,两名正在公交车站候车的市民...","https://dss1.bdstatic.com/6OF1bjeh1BF3odCf/it/u=1591414695,3046372208&fm=173&app=49&size=f242,162&n=0&g=0n&f=JPEG?s=922261A5445239C63AAD19890300A090&sec=1618987769&t=9111512ec21bec03f90bbd70a2145a9a","四川攀枝花一停车场围墙倒塌 官方称正在调查,人员伤亡暂不明","https://baijiahao.baidu.com/s?id=1670118732212132129&wfr=spider&for=pc"
"馋茶壹胃","2020年6月23日","其实对于这个问题,很多人都说水泥的使用寿命仅有50年,50年之后用水泥建造的房屋都会出现一系列的问题,最严重的就是倒塌了。 而我们知道现在买房子的话一般都是70年的产权,如果住了50年之后就倒塌了,那么剩下的20年该怎么办呢?其实...","https://dss1.bdstatic.com/6OF1bjeh1BF3odCf/it/u=2579612133,2999135918&fm=173&app=49&size=f242,162&n=0&g=0n&f=JPEG?s=B9A5CB140E61020FE6B2ECD5030060AB&sec=1618987769&t=611b58bebfab7c96390f77268ee67e67","水泥的寿命仅有50年?过期之后房子就会倒塌吗?70年产权怎么办?","https://baijiahao.baidu.com/s?id=1670250555074929213&wfr=spider&for=pc"
"建筑行业搬砖员","2020年6月22日","总结全国各地常年不断的塔吊倒塌事故原因,从大的方面看不外乎两个:一是塔吊安装与拆卸方面的问题,我们在安装前、安拆过程、使用过程等都有严格的要求;二是使用方面的问题,因为塔吊容易发生超载、无防护措施、信号不明、斜吊等原因,高频...","https://dss1.bdstatic.com/6OF1bjeh1BF3odCf/it/u=3429473820,582415956&fm=173&app=49&size=f242,162&n=0&g=0n&f=JPEG?s=A5D06A234C146EDE040801B203005092&sec=1618987769&t=c683eef2fe6ad4ccd17dee3834e76097","突发!6月19日!吉林长春一在建工地塔吊倒塌事故,幸无人员伤亡","https://baijiahao.baidu.com/s?id=1670186618902794571&wfr=spider&for=pc"
"中国网","2020年6月21日","事发后,吉安县人民政府新闻办发布的消息称,6月20日11时19分许,吉安县文天祥公园北侧游步长廊发生倒塌。吉安县公安、消防救援、城管、医务人员第一时间赶到现场处置。目前事故造成一人死亡,一人受伤。事故原因正在调查中。 ","https://dss0.bdstatic.com/6Ox1bjeh1BF3odCf/it/u=645385488,1352163742&fm=217&app=92&size=f242,162&n=0&g=0n&f=JPEG?s=F9A20FD1DC9B16C67694B49403001093&sec=1618987769&t=ca1e93ae464f15b32009fc44fd39ed87","江西文天祥公园凉亭发生坍塌 事故造成1死1伤","http://henan.china.com.cn/travel/2020-06/21/content_41193335.htm"
"中国网","2020年6月21日","事发后,吉安县人民政府新闻办发布的消息称,6月20日11时19分许,吉安县文天祥公园北侧游步长廊发生倒塌。吉安县公安、消防救援、城管、医务人员第一时间赶到现场处置。目前事故造成一人死亡,一人受伤。事故原因正在调查中。 ","https://dss0.bdstatic.com/6Ox1bjeh1BF3odCf/it/u=645385488,1352163742&fm=217&app=92&size=f242,162&n=0&g=0n&f=JPEG?s=F9A20FD1DC9B16C67694B49403001093&sec=1618987770&t=70fe7cd8a5dedcccf82dd2f6ac320994","江西文天祥公园凉亭发生坍塌 事故造成1死1伤","http://henan.china.com.cn/travel/2020-06/21/content_41193335.htm"
"潇湘晨报","2020年6月20日","6月20日上午11时19分许吉安县天祥公园北侧游步长廓发生倒塌目前事故造成一人死亡,一人受伤救援人员清理现场6月20日上午11时19分接到报警:吉安县天祥公园北侧游步长廓发生倒塌。吉安县公安、消防救援、城管、医院人员第一时间赶到现场。","https://dss1.bdstatic.com/6OF1bjeh1BF3odCf/it/u=4172412264,3188023436&fm=173&app=49&size=f242,162&n=0&g=0n&f=JPEG?s=F5820FF14AA882C65835740D0300E0D0&sec=1618987770&t=87e0c43018f57cf416c94669a1523582","突发!江西一公园内发生倒塌事故!1死1伤","https://baijiahao.baidu.com/s?id=1670030750143620913&wfr=spider&for=pc"
"腾讯网","2020年6月20日","“哥伦布”们的倒塌,依稀还能看到“萨达姆”倒塌的影子。 作者|朱国顺 在美国小城里士满,一座“哥伦布”雕像被涂鸦、焚烧之后,扔进了冰冷的湖中,装饰精致的一张纸牌留在了“哥伦布”沉湖处:“种族主义,你不会被怀念的”。 ","https://dss0.bdstatic.com/6Ox1bjeh1BF3odCf/it/u=1212805640,2718919836&fm=217&app=92&size=f242,162&n=0&g=0n&f=JPEG?s=543A73DACC30019EC1B1E418030090D3&sec=1618987770&t=ee2af439b6d9e5ddd256316b1f81d52b","论“哥伦布”的倒塌","https://new.qq.com/rain/a/20200620A0B9VR00"
"追尾的星星","2020年6月17日","但其实,有时即使是最安全和最坚固的桥也会发生倒塌,所以今天小编和大家探讨的话题是四座大桥的坍塌事件。 南方澳跨港大桥 一、台湾大桥 台湾大桥,也是台湾宜兰南方澳跨港大桥,它是一座长一百四十米,宽十五米,使用高强度低合金钢和一...","https://dss2.bdstatic.com/6Ot1bjeh1BF3odCf/it/u=4101174572,3998200383&fm=173&app=49&size=f242,162&n=0&g=0n&f=JPEG?s=38345D91B21A23C6C6153C0C0300E0C1&sec=1618987770&t=f35dfeadeeb832ac05f1b24786e28d4e","四座大桥的坍塌事件,场面触目惊心","https://baijiahao.baidu.com/s?id=1669708360035502206&wfr=spider&for=pc"
"瑞巴笔评车","2020年6月14日","位于浙江温岭大溪,发生一槽罐车爆炸事故,造成多间民房倒塌,多辆汽车着火,有人员伤亡,消防救援队更是彻夜救援。 视频里一个类似车头的东西飞出去,不知道是车头还是别的小汽车被炸飞,太吓人了! 浙江温岭槽罐车爆炸。 液化石油气比空气重...","https://dss2.bdstatic.com/6Ot1bjeh1BF3odCf/it/u=3247200323,2469873848&fm=173&app=49&size=f242,162&n=0&g=0n&f=JPEG?s=5A383BC7D6630AAE6010A82D0300F047&sec=1618987770&t=8ea671e9bf246f1f6c218026cddc7b66","浙江发生一爆炸事故,位于温岭大溪,汽车着火民房倒塌,让人深思","https://baijiahao.baidu.com/s?id=1669445493236601259&wfr=spider&for=pc"
"央视网新闻","2020年6月11日","受连日持续暴雨影响,广西融水镇出现汛情。该镇一家六口刚刚撤离自家房屋,房子就在眼前轰然倒塌,这一幕刚好被视频记录下来,惊险一幕让人揪心。 据南国今报报道,房屋户主称,就在他们一家6口离开房屋10多分钟后,这栋楼就被洪水冲垮了。","https://dss0.bdstatic.com/6Ox1bjeh1BF3odCf/it/u=2343316465,955481557&fm=173&app=49&size=f242,162&n=0&g=0n&f=JPEG?s=F7C7BC44A945675FC48C18780300C050&sec=1618987770&t=06c08248ed7187b450c048e04196a83c","广西一家六口刚撤离,眼见自家房屋倒塌在洪水里","https://baijiahao.baidu.com/s?id=1669168045196765437&wfr=spider&for=pc"
"北青网","2020年6月11日","6月7日晚,河南省新乡卫辉市发生一起围栏倒塌事故,4名儿童在玩耍时,被小区外的围栏压砸,其中一名10岁女童因伤势过重,经抢救无效死亡。 据了解,事故发生在保障性住房石庄小区外围栏处,被砸身亡的女童系该小区二期一商户的女儿。卫辉市...","https://dss1.bdstatic.com/6OF1bjeh1BF3odCf/it/u=3215663843,3293379213&fm=217&app=92&size=f242,162&n=0&g=0n&f=JPEG?s=10B377910813CACE7C95E40D03007041&sec=1618987770&t=0b7f886e5fc16279b4fb572541f74bf5","小区围栏倒塌,4名儿童1死3伤,事发小区曾多次遭投诉","http://news.ynet.com/2020/06/11/2653384t70.html"
"澎湃新闻","2020年6月10日","截至6月9日14时,南方洪涝灾害造成广西、贵州、广东、江西、湖南、福建等11省(区、市)262.7万人次受灾,22.8万人次紧急转移安置;1300余间房屋倒塌;农作物受灾面积145.9千公顷;直接经济损失40.4亿元。 ","https://dss0.bdstatic.com/6Ox1bjeh1BF3odCf/it/u=885941444,3691858196&fm=217&app=92&size=f242,162&n=0&g=0n&f=JPEG?s=BA9215C11A60B44712ED98880300E081&sec=1618987770&t=b500c19da42fa04fcaf440402cf38bfd","南方暴雨已致1300余间房屋倒塌,22.8万人次紧急转移","http://www.thepaper.cn/newsDetail_forward_7784831"
"小试牛叨","2020年6月9日","6月9日上午9:30分许,位于武昌和平大道的长江中心项目在建工地的一台履带吊进行地连墙钢筋笼吊装过程中倒塌,钢筋笼掉落,造成两人受伤,两台车受损。伤者成功救出,已送往医院救治,无生命危险。市区相关部门已到达现场应急处置。事故原因正在...","https://dss0.bdstatic.com/6Ox1bjeh1BF3odCf/it/u=4208809708,3980480182&fm=173&app=49&size=f242,162&n=0&g=0n&f=JPEG?s=9AB46A855E73F0CE0421C087030010C2&sec=1618987770&t=f3380a84a7425e4d0afb7688439f0c47","武汉武昌区和平大道一工地塔吊倒塌,有人被困车内,多人受伤","https://baijiahao.baidu.com/s?id=1669028049614914494&wfr=spider&for=pc"
"澎湃新闻","2020年6月9日","6月9日,湖北武汉。9时许,武昌和平大道与秦园路路口发生塔吊倒塌事故,现场视频显示有车受损和人员受伤。据了解,事发地系华夏幸福长江中心项目工地。警方现已介入。2020-06-09 10:38 来源:澎湃新闻  80 收藏 跟踪: 塔吊倒塌 澎湃...","NoPicture","武汉和平大道一工地吊车倒塌,有人被困车内","http://www.thepaper.cn/newsDetail_forward_7765456"
"气象小秘书","5天前","市气象局集成气象、消防、应急、国土、水文以及水务等多部门数据,自主研发了“包头气象灾害防御联动系统”。该系统以降低全市气象灾害风险,提升气象防灾减灾能力为目标,可满足包头市气象信息化、现代化、智能化、科学化、合理化和经济化的...","https://cambrian-images.cdn.bcebos.com/b604caf6d9c89aba9ecfca597d6f0e25_1666454311203170.jpeg@w_100,h_100","气象灾害防御联动系统研发成功","https://baijiahao.baidu.com/s?id=1697094244626822795&wfr=spider&for=pc"
"网易","5天前","自然灾害、事故灾害和公共卫生事件频发,导致人民群众的生命财产安全和社会经济的有序发展受到严重威胁。科学有效地进行城市灾害风险管理工作,提高城市系统面对不确定性因素的抵抗、响应、适应与恢复能力十分重要。在防灾形势严峻的背景下,亟须...","https://dss2.bdstatic.com/6Ot1bjeh1BF3odCf/it/u=3098397713,4187819481&fm=217&app=2&size=f242,162&n=0&g=0n&f=JPEG?s=0518E03319AFE0CA5AD505DA0100C0B1&sec=1618987773&t=eeb097eab41c48a52f5260c271c2db95","期刊精粹 | 人工智能技术在城市灾害风险管理中的应用与探索「2021...","https://www.163.com/dy/article/G7KB7OMG0541FKUM.html"
"地震三点通","5天前","普查强调综合减灾能力评估和综合灾害风险评估区划,充分体现从应对单一灾种向综合减灾转变的思路。普查的重要工作之一是对全国、省、市、县进行不同尺度的风险评估,同时基于风险评估结果开展风险区划和防治区划的制定,这将为从减少灾害损失向...","https://dss0.baidu.com/6ONWsjip0QIZ8tyhnq/it/u=839898444,140099517&fm=30&app=106&size=f242,162&n=0&g=0n&f=JPEG?s=1D90CD17175E45C854C020DA0300D032&sec=1618987773&t=4433440878f510d37cac3b4680e36956","城市与减灾 | 第一次全国自然灾害综合风险普查总体技术体系解读","https://baijiahao.baidu.com/s?id=1697071887496093310&wfr=spider&for=pc"
"星沙时报","5天前","星沙时报讯(通讯员 王斯杰 记者 李生辉)4月13日,长沙县召开2021年度地质灾害防治工作部署会议,总结2020年地质灾害防治工作,重点对2021年主汛期地质灾害防治工作进行安排部署。副县长喻名团参加会议。 2020年以来,全县共投入地质灾害应急处置...","https://cambrian-images.cdn.bcebos.com/f8de7f5f32453ffd155a4e3a831b4bcd_1629767261579929.jpeg@w_100,h_100","推进地质灾害防治工作有序开展","https://baijiahao.baidu.com/s?id=1697070996847089203&wfr=spider&for=pc"
"国际在线","5天前","据中国天气网消息,北京市气象局4月15日8时启动重大气象灾害(大风)Ⅳ级应急响应。 预计今天(15日)白天,北京多云转沙尘,下午有分散性小阵雨,局地伴有弱雷电,南风三四级转北风五级左右,阵风八九级,最高气温23℃;夜间沙尘转晴,北风三四...","https://dss2.baidu.com/6ONYsjip0QIZ8tyhnq/it/u=2677184570,140094716&fm=30&app=106&size=f242,162&n=0&g=0n&f=JPEG?s=C090CD3A155865C81A7591DB030090B3&sec=1618987773&t=8770e7f0cdda1a62b6e9098af20bd532","北京启动重大气象灾害(大风)Ⅳ级应急响应","https://baijiahao.baidu.com/s?id=1697066731991237388&wfr=spider&for=pc"
"温州日报瓯网","5天前","近日,市水利局联合市防汛防台抗旱指挥部办公室印发《关于开展山洪灾害防御示范村创建的通知》,吹响山洪灾害防御示范村创建“号角”。根据各地防御形势,我市决定在鹿城区、龙湾区、瓯海区、乐清市、瑞安市、永嘉县、文成县、平阳县、泰顺...","NoPicture","山洪灾害防御示范村创建启动","http://www.wzrb.com.cn/5/article1067946show.html"
"看看丶中国","5天前","旅行中若有灾难 去一个安全的地方 如遇龙卷风警告,建议您进入建筑物内部底层。如果发生了地震,要躲到坚固的物体内,直到摇晃停止为止。假如是火山爆发,请保持冷静,通过电视、电台或网络听取有关当局的指示。假如你在火山喷发区,但不会...","https://dss1.baidu.com/6ONXsjip0QIZ8tyhnq/it/u=1582775761,140039315&fm=30&app=106&size=f242,162&n=0&g=0n&f=JPEG?s=B91236D0DA897B4F312B19C1030030B8&sec=1618987773&t=0fa527902406513c45be5a607fdfc6af","圣文森特的火山爆发:如果您出门在外遭受自然灾害,该怎么办?","https://baijiahao.baidu.com/s?id=1697007257501268979&wfr=spider&for=pc"
"向阳而生的多米","6天前","2021年4月13日,日本政府作出了重要决定:向海洋排放核废水。 这一决定,让世界一片哗然。 十年前,日本遭受了毁灭性的“3.11”地震灾害。这场地震不仅引发了海啸,还导致了福岛第一核电站发生核泄漏。 十年后,在3月11日那天,日本在...","https://dss0.baidu.com/6ONWsjip0QIZ8tyhnq/it/u=2692690049,140183642&fm=30&app=106&size=f242,162&n=0&g=0n&f=JPEG?s=350197575E537DCE5895D8F103006011&sec=1618987773&t=71b92bcfd499fb8a1f8b686cf53e80de","日本决然向海洋排放核废水:一场巨大的灾难正向我们袭来","https://baijiahao.baidu.com/s?id=1697016532697275810&wfr=spider&for=pc"
"笔尖文化日记","6天前","唐朝统治者高度重视灾前预防及灾后的赈灾等各项事宜,在面对自然灾害之时,他的制度十分健全。据《旧唐书》等史料记载,唐朝统治者的赈灾方式十分多样。 有作物种子赈济、实物赈济和有偿赈贷等。同时还有抚恤、赦免等多种手段。唐朝花大量...","https://dss1.baidu.com/6ONXsjip0QIZ8tyhnq/it/u=3481986464,140048321&fm=30&app=106&size=f242,162&n=0&g=0n&f=JPEG?s=D2983EC55AB2C5CE4239B9290300705B&sec=1618987773&t=57197a90b189832ad4a274073f71351f","唐朝的赈灾措施:自然灾害时有发生,古代政府如何对待?","https://baijiahao.baidu.com/s?id=1696992462501563628&wfr=spider&for=pc"
"气象小秘书","6天前","随后,调研组赴六安市裕安区丁集镇西河村实地查看灾害风险隐患信息报送工作情况,与区、镇、村三级灾害信息员及有关负责同志进行了深入交流,了解工作开展情况,分析存在的问题,听取相关意见建议。 调研组对我省灾害风险隐患信息报送工作给予...","https://cambrian-images.cdn.bcebos.com/b604caf6d9c89aba9ecfca597d6f0e25_1666454311203170.jpeg@w_100,h_100","应急管理部来我省调研灾害风险隐患信息报送工作","https://baijiahao.baidu.com/s?id=1697018350945656252&wfr=spider&for=pc"
"闪电新闻","6天前","齐鲁网·闪电新闻4月14日讯 近日,潍坊市应急管理局、市减灾委员会办公室会同市自然资源和规划局、市交通局、市水利局、市农业农村局、市海渔局、市气象局等部门,对全市2021年二季度自然灾害风险形势进行了会商研判,形成了《2021年二...","https://cambrian-images.cdn.bcebos.com/79e803544cdc399d372e61d3c03795a5_1572613303150243.jpeg@w_100,h_100","潍坊2021年第二季度全市自然灾害风险形势如何 快来看这份分析报告","https://baijiahao.baidu.com/s?id=1697012497496319878&wfr=spider&for=pc"
"网易新闻","6天前","除了肆虐全球的新冠疫情,极端天气导致的各种灾害也给世界造成了巨大损失。澳洲丛林大火、亚非超级蝗灾、南极高温破表、北极甲烷爆发……遗憾的是,在气候危机面前,人类仿佛集体犯了拖延症。 但有一个事实需要明确:仅仅是几摄氏度的气温变化...","https://dss2.bdstatic.com/6Ot1bjeh1BF3odCf/it/u=1839309242,946501494&fm=217&app=2&size=f242,162&n=0&g=0n&f=JPEG?s=D7AEB444CD4155570736EC520300D09F&sec=1618987776&t=f5bf21a1472bb24b2752c5c1285440a5","比尔·盖茨发出警示:下一次灾难,将是疫情的5倍","https://3g.163.com/dy/article/G7I5V04N05521F9A.html"
"民族时报","6天前","灾害文化是文化的一个重要类型。云南大学西南环境史研究所所长周琼以及她所带领的团队深入田野调查,从灾害文化的视角去重新审视云南世居少数民族与自然互动的关系,深入分析各少数民族传统生产生活方式及其与自然环境之间的相互关联,以进一步探讨...","https://dss2.baidu.com/6ONYsjip0QIZ8tyhnq/it/u=1359528069,140025230&fm=30&app=106&size=f242,162&n=0&g=0n&f=JPEG?s=E584EBB0CA72F7ED96951800030070D0&sec=1618987776&t=d1a65e8c0038d76dd275fa9c10e85e31","解读《云南世居少数民族传统灾害文化纪实丛书》的秘密","https://baijiahao.baidu.com/s?id=1696992129559805062&wfr=spider&for=pc"
