"results_author","results_date","results_des","results_img","results_title","results_url"
"弋说历史","2020年2月5日","但是,雷峰塔的倒塌,并没有斩断人们对“雷峰夕照”以及“白娘子传奇”的美好情愫,因此关于重建雷峰塔的呼声从来就没有停止过。在上世纪的九十年代末,政府决定要重建雷峰塔。 由于当时的考古技术相对比较落后,因此没有尽快采取挖掘。在雷峰塔...","https://dss0.bdstatic.com/6Ox1bjeh1BF3odCf/it/u=621474667,3522696751&fm=173&app=49&size=f242,162&n=0&g=0n&f=JPEG?s=B45B17D0DE39218620A0BD410300B0E8&sec=1618987784&t=dd85a5186f741dc26be7b6a93324b40a","雷峰塔倒塌77年后,专家在塔下发现一间密室,千年奥秘被揭开","https://baijiahao.baidu.com/s?id=1657663142512116842&wfr=spider&for=pc"
"经济日报","2020年1月20日","印度尼西亚搜救官员20日说,印尼明古鲁省考尔县19日发生一起吊桥倒塌事故,已致9人死亡,另有一人失踪。印尼明古鲁省搜救局负责人马利克接受新华社记者电话采访时说,事故发生于19日15时,当时桥上共有约30人,桥梁突然倒塌后不少人坠落并...","https://cambrian-images.cdn.bcebos.com/3ec9d53f292de87274c1572c2d44ddc6_1570801610198511.jpeg@w_100,h_100","印尼一吊桥倒塌致9人死亡","https://baijiahao.baidu.com/s?id=1656244812339112630&wfr=spider&for=pc"
"搜狐网","2020年1月9日","的南通市经济技术开发区年产10万吨冲砂油漆钢构件扩产至年产20万吨冲砂油漆钢构件和2980吨不锈钢及有色金属管件产品项目:冲砂油漆车间、油漆仓库、综合仓库建设项目工程工地,10名工人正在冲砂车间B砌筑外墙,轴线外脚手架局部突然倒塌。","NoPicture","江苏省住建厅通报:半月内连续发生三起坍塌事故,致三死二伤","https://www.sohu.com/a/365676522_683111"
"安环链","2019年12月29日","在2号塔机顶升作业时发生失稳倒塌事故,造成2人死亡、1人受伤,事故原因正在调查中。 建设单位:四川通汇房地产开发有限公司 监理单位:四川省四维高建工程监理咨询有限公司 施工单位:四川通汇建筑工程有限公司...","https://dss0.bdstatic.com/6Ox1bjeh1BF3odCf/it/u=2972572405,3676857557&fm=173&app=49&size=f242,162&n=0&g=0n&f=JPEG?s=42B115C7C01103CE3459FC0E03006091&sec=1618987784&t=e8ab3be8a40e7ffcc346cf8973bdbc3e","四川简阳一在建工地塔吊顶升时发生倒塌,已造成2死1伤!年终岁尾,请...","https://baijiahao.baidu.com/s?id=1654187597986771443&wfr=spider&for=pc"
"全景网","2019年12月19日","400亿""帝国""轰然倒塌,260亿""辽宁首富""彻底凉了 曾经的400亿“白马股”,彻底凉了! 两年前遭做空机构狙击,曾在盘中上演离奇崩盘的辉山乳业(06863.HK),最终被联交所取消上市地位。 12月18日晚间,港交所发布公告称,由12月23日上午9...","https://dss0.bdstatic.com/6Ox1bjeh1BF3odCf/it/u=808209428,1376497078&fm=217&app=92&size=f242,162&n=0&g=0n&f=JPEG?s=0CAA7C32512ED4EC4265C0D9000080B1&sec=1618987784&t=a9d65776befc2b282d154917d99a7241","强制退市!400亿""帝国""轰然倒塌,260亿""辽宁首富""彻底凉了","http://www.p5w.net/kuaixun/201912/t20191219_2364412.htm"
"新浪财经","2019年12月19日","【航拍海南陵水违建别墅拆除:201栋别墅倒塌后形成巨大废墟】12月17日,海南陵水县委宣传部消息称,从12月14日开始,相关部门对“国茂·清水湾”的201栋别墅及2栋在建高层住宅楼进行拆除。现场视频显示,有多辆挖掘机作业,机器轰鸣,多栋别墅...","https://dss0.bdstatic.com/6Ox1bjeh1BF3odCf/it/u=1420957603,2167480806&fm=173&app=25&size=f242,162&n=0&g=0n&f=JPEG?s=DA9276891802F0CA5C3D0CDB03008036&sec=1618987784&t=a206287803392d1489abc0106e1d4f46","航拍|海南陵水拆除国茂清水湾别墅:倒塌后成巨大废墟","https://baijiahao.baidu.com/s?id=1653302346184434699&wfr=spider&for=pc"
"四川新闻网","2019年12月16日","“浪迹情感”PUA大厦唰一下走红 轰一声倒塌 最近的北大女生自杀事件,让一个叫“浪迹情感”的平台火了一把,却又很快遭到封杀。“浪迹情感”创始人王环宇,受到关注。 2014年9月30日,湖南卫视真人秀节目《我们约会吧》现场,初见时留灯...","NoPicture","“浪迹情感”PUA大厦唰一下走红 轰一声倒塌","http://scnews.newssc.org/system/20191216/001017184.html"
"新华网客户端","2019年12月7日","12月6日,在肯尼亚内罗毕,救援人员在楼房倒塌事故现场展开工作。 新华社发(弗雷德·穆通摄) 新华社内罗毕12月7日电(记者白林 杨臻)肯尼亚首都内罗毕6日发生一起居民楼倒塌事件,造成5人死亡,20多人受伤。 ","https://dss0.bdstatic.com/6Ox1bjeh1BF3odCf/it/u=970538146,3203682772&fm=217&app=92&size=f242,162&n=0&g=0n&f=JPEG?s=8280C5A0445233F55C2C58320300B051&sec=1618987785&t=d150f345a7f2702aeb487823e4c7f920","肯尼亚首都发生楼房倒塌事件造成5人死亡","http://www.xinhuanet.com/world/2019-12/07/c_1125320444.htm"
"搜狐网","2019年12月12日","据中新网海宁12月3日17时19分报道,浙江省海宁市许村镇荡湾工业园区发生一起因海宁市一印染公司污水厌氧罐倒塌,压垮附近两家企业的相关车间引发事故。 据钱江晚报消息,截至目前共造成9人死亡,另有4名重伤员在医院救治。至12月4日凌晨3...","https://dss1.bdstatic.com/6OF1bjeh1BF3odCf/it/u=765685214,3229636832&fm=217&app=92&size=f242,162&n=0&g=0n&f=JPEG?s=6CB422D55C1275CE4E9DCCC4030060B3&sec=1618987785&t=89e20dbcdae70e532375cdaecac764d9","浙江海宁市污水罐体倒塌事故发生,制造企业该如何反思?","https://www.sohu.com/a/358282504_120244785"
"新浪财经","2019年12月6日","昔日“明星”网贷平台,轰然倒塌…上海市公安局浦东分局昨天发布通报,麦子金服的运营主体上海麦子资产管理有限公司因涉嫌非法吸收公众存款,已于2019年11月23日被立案侦查,公司15名高管被抓。麦子金服全称为上海麦子资产管理有限公司,创立于...","https://dss0.baidu.com/6ONWsjip0QIZ8tyhnq/it/u=203779071,3380485865&fm=173&app=49&size=f242,162&n=0&g=0n&f=JPEG?s=1026DE140678A3C25C257C850300E080&sec=1618987785&t=2880af4f792b0f84fdc7fc63030919ce","15名高管被抓 昔日“明星”网贷平台麦子金服轰然倒塌","https://baijiahao.baidu.com/s?id=1652126210622912660&wfr=spider&for=pc"
"新浪财经","2019年12月5日","据悉,震发后,唐山市丰南区立即启动应急响应措施,组织各乡镇、村摸排受灾情况,丰南区应急管理等部门赴现场进行认真核查,目前尚无房屋倒塌及人员伤亡情况,生产生活秩序正常,社情稳定。应急管理部消防救援局官方微博@中国消防,经向河北、天津...","https://dss0.baidu.com/6ONWsjip0QIZ8tyhnq/it/u=4097925066,2909544944&fm=173&app=49&size=f242,162&n=0&g=0n&f=JPEG?s=A24AFA1749037D435C54CD53030020F3&sec=1618987785&t=8904b386d73769c1a93da7b74b54960c","唐山发生4.5级地震,尚无房屋倒塌人员伤亡情况,京津有震感","https://baijiahao.baidu.com/s?id=1652051922103320273&wfr=spider&for=pc"
"环球网","2019年12月5日","据中国消防官方微博消息,经向河北、天津消防救援总队了解,河北唐山丰南区有轻微震感,天津静海区、蓟州区、滨海新区震感明显,尚未接到人员伤亡和房屋倒塌的报告。 消息指出,河北、天津总队前突力量正在赶赴震中查看灾情,相关地区消防救援支队...","https://dss1.bdstatic.com/6OF1bjeh1BF3odCf/it/u=2333877536,2732223466&fm=217&app=92&size=f242,162&n=0&g=0n&f=JPEG?s=E052789A1F9445CAC24831D2030050B2&sec=1618987785&t=109ada7a3e559c49da98d0f6b56c19e4","河北唐山地震:尚未接到人员伤亡和房屋倒塌报告","https://china.huanqiu.com/article/9CaKrnKo9Tw"
"新浪财经","2019年12月5日","海宁污水罐体倒塌事故已致9人死亡,工人表示“设备不坏,从不停工” 这位工人说,厂里没有停工的日子,连检查检修设备的时间也没有,只有在设备坏了的时候停工维修。 ▲12月3日,海宁市龙洲印染有限责任公司出现污水罐体坍塌险情。截至4 日...","https://dss0.baidu.com/6ONWsjip0QIZ8tyhnq/it/u=429381327,4249833507&fm=173&app=49&size=f242,162&n=0&g=0n&f=JPEG?s=F8F705C45433BBD60E10D11F030080C1&sec=1618987785&t=7bef29fb8da2f4d34382bc9208379204","海宁污水罐倒塌事故9人死亡 工人:设备不坏 从不停工","https://baijiahao.baidu.com/s?id=1652040915695273168&wfr=spider&for=pc"
"中国青年网","2019年12月5日","12月4日,海宁倒塌的污水罐残体覆盖河道。3日17时19分,浙江省海宁市许村镇荡湾工业园区海宁市龙洲印染有限责任公司污水厌氧罐倒塌,造成人员被困。据海宁市政府新闻发布会最新通报,截至目前,该事故共造成9人死亡,另有4名重伤员送医救治...","https://dss1.bdstatic.com/6OF1bjeh1BF3odCf/it/u=1780397208,1923000189&fm=173&app=49&size=f242,162&n=0&g=0n&f=JPEG?s=BEB4488144D3D7DA4C107D000100E090&sec=1618987785&t=4c8080d8994dbb232ac18d081262e842","航拍浙江海宁污水罐体倒塌事故现场","https://baijiahao.baidu.com/s?id=1652013810365182034&wfr=spider&for=pc"
"新浪财经","2019年12月4日","2019年12月3日17时28分,浙江嘉兴市消防救援支队海宁大队接到报警称:海宁市许村镇龙洲印染有限责任公司货架堆垛发生倒塌,有人员被困。浙江嘉兴市消防救援支队第一时间调集4个执勤中队16车84名消防指战员、5个专职消防队共5车30名专职消防...","https://dss0.bdstatic.com/6Ox1bjeh1BF3odCf/it/u=1154824918,322148155&fm=173&app=49&size=f242,162&n=0&g=0n&f=JPEG?s=629B1FC704D30DD600C1F00A0300E0C3&sec=1618987785&t=a40d15087b3eefb29453e7403fc97b56","9死4重伤!浙江海宁污水罐体坍塌,涉事公司曾多次被处罚","https://baijiahao.baidu.com/s?id=1651968511521949854&wfr=spider&for=pc"
"搜狐网","2019年12月3日","今天(12月3日)晚上20:00左右,西安人的朋友圈被这样一则消息刷屏。 被疯狂传播的视频 ↓↓↓ 视频△ 据网友称,天桥附近的一栋大楼发生倒塌,场面非常吓人。 刚刚,896记者从@西安网警巡查执法 了解到: ...","https://dss2.bdstatic.com/6Ot1bjeh1BF3odCf/it/u=2075848253,3613806399&fm=217&app=92&size=f242,162&n=0&g=0n&f=JPEG?s=4888E41A1D5A44C8186D344B0300C0B1&sec=1618987785&t=78e4f5b8b9fa719e5e8cc449e3f04577","刚刚疯传:西安一天桥倒塌?官方回应","https://www.sohu.com/a/358194172_632210"
"君清瞭望台","2019年12月1日","距离911恐袭事件已过去18年,但在10月中旬,美国新奥尔良的一座18层大楼却突然轰然倒塌,3人当场丧命。彼时正在一旁的游客看着吓人一幕,惊呼道“911恐袭再现了”。但事后调查发现,事故本身其实是大楼施工材料不过关,引发了断裂倒塌事故。令人...","https://dss2.bdstatic.com/6Ot1bjeh1BF3odCf/it/u=3859859411,572569278&fm=173&app=49&size=f242,162&n=0&g=0n&f=JPEG?s=96B25E85723E479C968884D5030040A3&sec=1618987785&t=84031dc3844c76a6ac05240b61bc2639","“911恐袭”再现?美国一座18层大楼突然轰然倒塌,3人当场丧命","https://baijiahao.baidu.com/s?id=1651710426202601308&wfr=spider&for=pc"
"气象小秘书","4月5日","楚天都市报极目新闻讯(记者黄忠 通讯员史登华 李伟)昨日,极目新闻记者从湖北省减灾委员会办公室获悉,经专题会商研判认为:今年4月与常年同期相比,气温总体偏高、波动大,降水时空分布不均,需重点做好水旱灾害、森林火灾、地质灾害等自然灾...","https://cambrian-images.cdn.bcebos.com/b604caf6d9c89aba9ecfca597d6f0e25_1666454311203170.jpeg@w_100,h_100","4月湖北省预计气象灾害多样多发 须做好水旱灾害、森林火灾、地质...","https://baijiahao.baidu.com/s?id=1696176279199774777&wfr=spider&for=pc"
"中国天气网","4月4日","山区特别需要防范地质灾害的发生 但在云南西部和北部,降雨依然偏少 自2月中旬以来,云南北部的一些地方 降水量仅有2.2毫米 其中,昆明0.7毫米、曲靖0毫米、玉溪0毫米 均为历史同期降水量最少 目前在云南西部和北部已经出现了 重度气象...","https://dss2.baidu.com/6ONYsjip0QIZ8tyhnq/it/u=1433658569,139205834&fm=30&app=106&size=f242,162&n=0&g=0n&f=JPEG?s=12717884981AA8CE3F03401B0300D09A&sec=1618987789&t=9bf52e866cc5a2c16fbc3cdfdd4fdbeb","下周天气 | 暴雨+强对流来袭!这里更要警惕地质灾害","https://baijiahao.baidu.com/s?id=1696112311659141122&wfr=spider&for=pc"
"3DMGAME","4月4日","多次爆料《战地6》消息的Tom Henderson又表示,《战地6》地图将会出现自然灾害,这些灾害也会对环境造成破坏。虽然这个消息还没有被证实,但这个传闻确实在《战地》系列的可能性范围之内。 《战地》系列的很多作品中都有很好的破坏机制,比如...","https://dss2.baidu.com/6ONYsjip0QIZ8tyhnq/it/u=115874454,139185028&fm=30&app=106&size=f242,162&n=0&g=0n&f=JPEG?s=D6A5B14418338BCA42993091030070CA&sec=1618987789&t=21b958cc847ca3107738101a8beda9e0","传《战地6》带有自然灾害系统 还能造成伤害","https://baijiahao.baidu.com/s?id=1696089809008422092&wfr=spider&for=pc"
"气象小秘书","4月4日","2日上午,由市水利局主办、市闽江下游河道管护中心承办的2021年福州市水旱灾害防御演练在闽江南港北岸橘园洲防洪堤举行。 市水利局相关负责人表示,本次演练进一步强化了福州市水旱灾害综合防御工作能力,检验了部门间上下联动、协同作战水平...","https://dss0.baidu.com/6ONWsjip0QIZ8tyhnq/it/u=4072281164,139172784&fm=30&app=106&size=f242,162&n=0&g=0n&f=JPEG?s=95B35897426024BED4953DA00300E012&sec=1618987789&t=1e3fb550f20da2f49350a69a01ef783e","福州市举行水旱灾害防御演练","https://baijiahao.baidu.com/s?id=1696076698932852183&wfr=spider&for=pc"
"腾讯网","4月2日","近日,山西省政府发布《山西省2021年度地质灾害防治方案》,我省全境均为地质灾害易发区,预测2021年我省地质灾害数量较2020年偏多,其中,2021年春季崩塌、滑坡地质灾害数量与2020年持平,夏秋季崩塌、滑坡地质灾害数量较2020年偏多。若在人口...","NoPicture","今年山西地质灾害预测较去年偏多,速看重点防治区","https://xw.qq.com/cmsid/20210402A09LDI00"
"腾讯网","4月2日","【导语】:4月1日,县委书记王廷洪,县委副书记、政府代县长张鹏耀就城区地质灾害防治工作进行调研,并召开专题会议,研讨解决方案。县领导田文军、杨剑、张瑞春、宋小泉、郭登文、杨保荣一同调研。自然资源、交运等相关部门负责人也参加了调研...","https://dss2.bdstatic.com/6Ot1bjeh1BF3odCf/it/u=3291637490,694666400&fm=217&app=2&size=f242,162&n=0&g=0n&f=JPEG?s=F21770840F203719544B479C0300508E&sec=1618987789&t=f4c2fa918a286294ddf02952382c8812","石楼:王廷洪 张鹏耀调研地质灾害防治工作","https://new.qq.com/omn/20210402/20210402A042W800.html"
"腾讯网","4月1日","切尔诺贝利核电站的泄漏难道不是“超级灾难”的最好写照吗?仔细想想,现在地球上各个国家掌握的核武器足以炸毁地球10次以上了,所以“超级灾难”确实一直都悬在人类的头上不曾移开过。 刘慈欣所说的“超级灾难”并非是天马行空的想象,...","https://dss1.bdstatic.com/6OF1bjeh1BF3odCf/it/u=2798916983,3015207685&fm=217&app=2&size=f242,162&n=0&g=0n&f=PNG?s=9729D0010E22461156A4FD520300D0B1&sec=1618987789&t=aa7e36d97f461b222049d7c803fbb9e6","刘慈欣:超级灾难早晚会来,不知道是啥形式,但最好提前做好准备","https://new.qq.com/omn/20210401/20210401A0D40500.html"
"东方财富网","4月1日","美国一个行业组织的一项新研究发现,因为供应商变得更加集中在不同的地区,全球半导体供应链越来越容易受到自然灾害和地缘政治干扰的影响。报告发现,如果中国台湾在一年内无法制造芯片,全球电子产业将损失近5000亿美元的收入:“全球电子供应链将...","NoPicture","新研究:全球半导体供应链越来越容易受到自然灾害和地缘政治干扰的...","http://finance.eastmoney.com/a/202104011869191794.html"
"央广网","3月21日","湖北日报讯 (记者张卫华、曾莉、通讯员赵树祥、李伟)“通过组织开展普查,摸清全省自然灾害风险隐患底数,查明重点地区抗灾能力,客观认识全省和各地区自然灾害综合风险水平,为各级人民政府有效开展自然灾害防治工作、切实保障经济社会可持续发展提供...","NoPicture","湖北绘制灾害综合防治“一张图”","http://www.cnr.cn/hubei/yw/20210321/t20210321_525441693.shtml"
"环京津网","3月11日","在馆长理查德·哈尔伯施塔特眼里,交流馆的意义在于,让年青一代增强防灾意识,勿忘灾害,学会防灾救灾。 55岁的哈尔伯施塔特是英国人,在日本生活了28年。他在这里负责向参观者讲解东日本大地震及海啸的相关情况。 “10年前,东日本大地震发生...","https://cambrian-images.cdn.bcebos.com/15eece1011d1fd3b260feaa1546e7c17_1610575987752554.jpeg@w_100,h_100","让年青一代勿忘灾害 学会防灾救灾","https://baijiahao.baidu.com/s?id=1693926836563062753&wfr=spider&for=pc"
"澎湃在线","3月10日","聚焦重要城镇、重大工程、国防设施和战略工程安全保障需求,加强气候变化与人类活动作用下高山区重大灾害成灾致灾机理与防治关键核心技术的研究,建立贯通“感知识别、评估预测、监测预警、防控治理、应急救援”全过程的灾害风险防控与工程安全防护...","https://dss1.baidu.com/6ONXsjip0QIZ8tyhnq/it/u=2993964148,526333632&fm=173&app=49&size=f242,162&n=0&g=0n&f=JPEG?s=FE7009C5455337C24EE848AF0300D082&sec=1618987791&t=dcf597f365cc81d58fd5d37a92c62853","全国人大代表崔鹏:​加强高山区灾害风险防控 保障重大工程与...","https://baijiahao.baidu.com/s?id=1693840439301817016&wfr=spider&for=pc"
"川观新闻SCOL","3月9日","“当前和今后一个时期,应进一步统筹发展和安全,强化四川地震灾害防御体系建设,”全国政协十三届四川会议上,住川全国政协委员在联名提案中发出呼吁。 这份题为《关于进一步统筹发展和安全,强化四川地震灾害防御体系建设的提案》指出,四川是我国...","https://cambrian-images.cdn.bcebos.com/9f0531c5111f23df273eeabdb8560a39_1572886762720818.jpeg@w_100,h_100","我们的十四五 ▏住川全国政协委员联名呼吁:强化四川地震灾害防御...","https://baijiahao.baidu.com/s?id=1693756382415193194&wfr=spider&for=pc"
"潇湘晨报","3月9日","3月8日,记者从省应急厅获悉,贵州运用大数据与自然灾害综合风险普查工作深度融合的创新做法,得到国务院普查办的高度赞扬,并在全国普查工作培训会上进行演示交流。 在近日召开的贵州省第一次全国自然灾害综合风险普查试点工作情况汇报会上,省...","https://dss1.baidu.com/6ONXsjip0QIZ8tyhnq/it/u=3099721933,2775483431&fm=173&app=49&size=f242,162&n=0&g=0n&f=JPEG?s=E71215891EBB1E883684D9B60300C0A3&sec=1618987791&t=686049325787a010f73097ac3d2ceacc","贵州:将大数据与自然灾害综合风险普查深度融合","https://baijiahao.baidu.com/s?id=1693728708816217848&wfr=spider&for=pc"
"西安发布","3月5日","3月5日3时28分(北京时间),新西兰克马德克群岛海域(29.56°S,177.11°W)发生8.1级地震,震源深度为20.0千米(震级修订)。自然资源部海啸预警中心根据最新监测分析结果,此次地震已经引发海啸,但不会对我国沿岸造成灾害性影响。 来源:...","https://cambrian-images.cdn.bcebos.com/ae3585d4cdd0d8c7cbbee49292767774_1563805377226566.jpeg@w_100,h_100","自然资源部:新西兰地震引发海啸 不会对我国沿岸造成灾害性影响","https://baijiahao.baidu.com/s?id=1693394553395911732&wfr=spider&for=pc"
"潇湘晨报","3月5日","3月5日3时28分(北京时间),新西兰克马德克群岛海域(29.56°S,177.11°W)发生8.1级地震,震源深度为20.0千米(震级修订)。 自然资源部海啸预警中心根据最新监测分析结果,此次地震已经引发海啸,但不会对我国沿岸造成灾害性影响。 延伸...","https://cambrian-images.cdn.bcebos.com/a51d142ac7625feda1002f0c739ae255_1606863438588053.jpeg@w_100,h_100","自然资源部:新西兰地震已引发海啸,不会对我国沿岸造成灾害性影响","https://baijiahao.baidu.com/s?id=1693398498068283807&wfr=spider&for=pc"
"人民日报","3月5日","2021年3月5日3时28分(北京时间),新西兰克马德克群岛海域(29.56°S,177.11°W)发生8.1级地震,震源深度为20.0千米(震级修订)。自然资源部海啸预警中心根据最新监测分析结果,此次地震已经引发海啸,但不会对我国沿岸造成灾害性影响。","https://cambrian-images.cdn.bcebos.com/53864a5e77b735000396c815760f7b4c_1593743208952652.jpeg@w_100,h_100","新西兰地震修订为8.1级,自然资源部:海啸不会对我国沿岸造成灾害性...","https://baijiahao.baidu.com/s?id=1693375753663225977&wfr=spider&for=pc"
"浙江日报","3月5日","2021年3月5日3时28分(北京时间),新西兰克马德克群岛海域(29.56°S,177.11°W)发生8.1级地震,震源深度为20.0千米(震级修订)。自然资源部海啸预警中心根据最新监测分析结果,此次地震已经引发海啸,但不会对我国沿岸造成灾害性影响。","https://cambrian-images.cdn.bcebos.com/d1b2758400815594d8e5ff8f35b4c1ee_1579841768127742.jpeg@w_100,h_100","更新丨新西兰地震修订为8.1级 不会对我国沿岸造成灾害性影响","https://baijiahao.baidu.com/s?id=1693344685885277995&wfr=spider&for=pc"
"潇湘晨报","3月4日","3月1日,水利部召开了水旱灾害防御工作视频会议,李国英部长出席会议并讲话,我厅王殿武厅长做《科学研判,精准调度,全力抗旱促发展》交流发言。魏山忠副部长主持。 李国英部长指出,要从政治高度准确把握新阶段水旱灾害防御工作的新要求,准确把...","https://cambrian-images.cdn.bcebos.com/a51d142ac7625feda1002f0c739ae255_1606863438588053.jpeg@w_100,h_100","水利部召开全国水旱灾害防御工作会议我省交流发言","https://baijiahao.baidu.com/s?id=1693285621153997932&wfr=spider&for=pc"
"北京日报客户端","3月3日","因此,田春艳建议,“十四五”期间将把城市道路塌陷灾害的预防和治理的基础研究设置为行业重大研究课题。 除进行上述研究外,当务之急还要查清底数,收集已发生灾害的各项数据,建立完整、动态的道路塌陷灾害数据库,并向研究者开放,为道路塌陷...","https://cambrian-images.cdn.bcebos.com/814a110b34d52c106f9ba99c5d415478_1601149438053974.jpeg@w_100,h_100","田春艳代表:建议提高城市道路塌陷灾害防治能力","https://baijiahao.baidu.com/s?id=1693223976851646935&wfr=spider&for=pc"
"央视新闻","3月3日","3月3日,记者从四川省自然资源厅获悉,《关于扎实做好2021年汛前地质灾害防治工作的通知》已于近日印发,《通知》要求,要重点把握地质灾害防治面临的新形势、新任务、新挑战,更好地统筹发展与安全,突出重点地区、重点工程、重点人群,坚持早...","https://cambrian-images.cdn.bcebos.com/ef4948097f1be4874073c2dab1e058bb_1570168240515616.jpeg@w_100,h_100","推进地质灾害防治工作 2021年四川将这样做","https://baijiahao.baidu.com/s?id=1693198564250864189&wfr=spider&for=pc"
"环京津网","2019年8月28日","北京时间13点16分更新:深圳罗湖一公寓楼发生沉降倾斜 暂无人员伤亡记者从当地居民处了解到,这是一栋6层的待拆迁楼房,事发前有居民居住,但是楼房出现异响后已经提前撤离。事发后楼体内出现煤气泄漏。目前,当地应急管理部门,包括消防部门...","https://dss0.bdstatic.com/6Ox1bjeh1BF3odCf/it/u=1240935796,4038604204&fm=173&app=49&size=f242,162&n=0&g=0n&f=JPEG?s=FCF61CC04AA0351F0BA408A20300C012&sec=1618987792&t=5f0387101efea7dc79582c0ece9ca07e","深圳一栋楼房倾斜倒塌 当地消防已赶赴现场","https://baijiahao.baidu.com/s?id=1643106411244161439&wfr=spider&for=pc"
"搜狐网","2019年8月28日","这个跟地基土软弱相近,在房屋建造前若勘察时过高地估计地基土的承载力或设计时漏算荷载,都会导致基底应力过高,引起地基失稳而使房屋倾斜甚至倒塌。 05 设计建造不当 房屋重心与基底形态经常会出现很大偏离的情况,当设计建筑时房屋的厨房...","https://dss0.bdstatic.com/6Ox1bjeh1BF3odCf/it/u=1041791294,1851366657&fm=217&app=92&size=f242,162&n=0&g=0n&f=JPEG?s=A5224DB31B7A92C80601F0040300C0C0&sec=1618987792&t=2b4a7983ba8571bc3c97dcc43fe83d71","突发!又一处居民楼倾斜坍塌事故发生!","https://www.sohu.com/a/337293057_99950625"
"life身边事","2019年8月28日","记者从管城回族区安全生产委员会办公室获悉,8月28日上午9时30分左右,未来路与凤凰路西南角中国建筑第七工程局有限公司承建的中博集团(原杨庄村)中博片区城中村改造项目B地块项目工程发生一起塔吊倒塌事故,事故初步原因查明,系施工总承包...","https://dss2.bdstatic.com/6Ot1bjeh1BF3odCf/it/u=2502382697,3719965868&fm=173&app=49&size=f242,162&n=0&g=0n&f=PNG?s=F103F01A18648A88899B35D6030080A8&sec=1618987792&t=f7e6411c99fcc430d8400fd51e38d795","郑州一工地塔吊倒塌已致3死1伤 法人代表被控制","https://baijiahao.baidu.com/s?id=1643101481618103564&wfr=spider&for=pc"
