"results_author","results_date","results_des","results_img","results_title","results_url"
"潇湘晨报","昨天09:34","4月17日,市委常委、常务副市长潘海燕赴吉县调研地质灾害防治、森林防火及城乡房屋安全隐患排查整治工作。市政府办公室、市应急管理局、市规划和自然资源局相关负责人,吉县县委、县政府负责人参加调研。 在侯家沟地质灾害治理点,潘海燕实地...","https://cambrian-images.cdn.bcebos.com/a51d142ac7625feda1002f0c739ae255_1606863438588053.jpeg@w_100,h_100","潘海燕在吉县调研地质灾害防治等工作","https://baijiahao.baidu.com/s?id=1697431096417633810&wfr=spider&for=pc"
"红网","昨天09:29","红网时刻湘西4月19日讯(通讯员 吴正龙)汛期来临,为严防地质灾害安全事故的发生,掌握境内地质灾害隐患点和地质灾害易发地段的实际情况,近日,凤凰县水打田乡组织乡应急办、村负责人对全乡地质灾害隐患点进行现场巡查。 巡查组一行先后来到红...","https://dss1.baidu.com/6ONXsjip0QIZ8tyhnq/it/u=3729835112,140433671&fm=30&app=106&size=f242,162&n=0&g=0n&f=JPEG?s=CB360EC1D853E9CE1BB01D210300F0D3&sec=1618986335&t=9dd744b9b0d96f1419449580aead2cba","凤凰:水打田乡开展地质灾害点巡查","https://baijiahao.baidu.com/s?id=1697430687845639803&wfr=spider&for=pc"
"腾讯网","昨天09:13","宁波市于4月15日入汛。气象部门最新发布汛期气候趋势预测,今年汛期降水量接近常年,北多南少分布,梅雨量比常年略偏多,高温日数比常年略偏多,影响宁波市的台风个数接近常年略偏多,局地强对流灾害较重。 ","https://dss2.bdstatic.com/6Ot1bjeh1BF3odCf/it/u=2094899356,3148012511&fm=217&app=2&size=f242,162&n=0&g=0n&f=JPEG?s=F5B60F742632762D4C8F115C030080BA&sec=1618986335&t=8120a63b5ceee4f07a1d78feaac73543","宁波今年汛期降水量接近常年,入梅时间或略偏早","https://xw.qq.com/cmsid/20210419A01T0200"
"红网","昨天09:05","红网时刻4月16日讯(通讯员 雷海波 谢兰雄)4月16日,嘉禾县自然资源局会同技术单位及时处置当地一起突发地质灾害事件,因该局处理及时、措施得当,未造成人员伤亡。 据悉,嘉禾县在4月15日夜晚受连续强降雨侵蚀影响,该县武警中队附近突发山...","https://cambrian-images.cdn.bcebos.com/d400fe19b97213bee8a175348c25c88f_1566248435989082.jpeg@w_100,h_100","嘉禾县自然资源局快速处置一起突发地质灾害","https://baijiahao.baidu.com/s?id=1697428931490090695&wfr=spider&for=pc"
"网易新闻","昨天08:43","4月18日,市自然资源局相关负责人走进兰州电视台《落实进行时》栏目直播间,就我市地质灾害防治、自然资源开发利用、国土空间规划、生态修复、耕地保护等工作方面与大家进行沟通交流。 我市将配建地质灾害避险安置房 在当天的节目中,地质...","NoPicture","我市将配建地质灾害避险安置房 市自然资源局做客《落实进行时》","http://dy.163.com/article/G7UDLO1P0534J2WD.html"
"二三里资讯甘孜","昨天08:34","成都市应急管理局相关负责人透露,未来成都将建设自然灾害预警平台和“一张图”决策支持系统,提升预警信息发布的覆盖面、精准度和实效性。“其中将新建、改造地震监测预警台站46个,地震预警终端将覆盖人员密集场所及重点区域,实现地震监测预警...","https://dss1.baidu.com/6ONXsjip0QIZ8tyhnq/it/u=1779189987,140430203&fm=30&app=106&size=f242,162&n=0&g=0n&f=JPEG?s=C197C7324656EE201ADA69530200F0B9&sec=1618986335&t=c5e9c0b754e02dce0d336f7693948d89","成都:做强“城市大脑” 做细“神经末梢”","https://baijiahao.baidu.com/s?id=1697426958347643105&wfr=spider&for=pc"
"网易新闻","昨天08:30","湘潭在线4月19日讯(湘潭日报社全媒体记者 杨阳 通讯员 李大超)4月16日,全省地质灾害防治工作电视电话会议召开后,湘潭市副市长向敏率自然资源、应急管理等部门奔赴岳塘区五里堆社区冯家浸、龚家浸地质灾害隐患点督导地灾防治工作。 ","NoPicture","湘潭市领导督查地质灾害防治","http://dy.163.com/article/G7UCU1G40530QK9D.html"
"网易新闻","昨天08:30","湘潭在线4月19日讯(湘潭日报社全媒体记者 杨阳 通讯员 李大超)4月16日,全省地质灾害防治工作电视电话会议召开后,湘潭市副市长向敏率自然资源、应急管理等部门奔赴岳塘区五里堆社区冯家浸、龚家浸地质灾害隐患点督导地灾防治工作。 ","NoPicture","湘潭市领导督查地质灾害防治","http://dy.163.com/article/G7UCU1G40530QK9D.html"
"网易","昨天02:22","为认真贯彻落实省委、省政府及州委、州政府关于加强地质灾害防范工作的要求,切实强化地质灾害防灾减灾体系建设,提高乡镇基层地质灾害识灾、防灾、避灾、救灾能力和监测人员监测预警速报能力。按照省、州自然资源管理部门安排部署,阿坝州自然资...","https://dss0.bdstatic.com/6Ox1bjeh1BF3odCf/it/u=288642821,124397508&fm=217&app=2&size=f242,162&n=0&g=0n&f=JPEG?s=CA82438F0C0B24CC0E2930B30300E082&sec=1618986344&t=5406712d13ffd32c54f2887f45c20909","切实贯彻落实地质灾害防治知识宣传 加强地质灾害防治知识培训","https://www.163.com/dy/article/G7TNTFBK05431RK3.html"
"网易","前天23:46","即时起,预计未来24小时,香洲区拱北街道、吉大街道、狮山街道、梅华街道,斗门区莲洲镇、乾务镇、白蕉镇、井岸镇,金湾区三灶镇、红旗镇、南水镇等地部分区域有灾害风险,预警等级为4级(蓝色)。 ","https://dss0.bdstatic.com/6Ox1bjeh1BF3odCf/it/u=2644740204,1071697745&fm=217&app=2&size=f242,162&n=0&g=0n&f=JPEG?s=4BA43C621AF143A16F5CB0CD0000E0E3&sec=1618986344&t=603b801d46f572f48bc7a94755a73467","刚刚,超17级台风王“舒力基”诞生!珠海下周气温将冲破……","https://www.163.com/dy/article/G7TEVTUI0534ILQF.html"
"腾讯网","None","河北日报讯(记者宋平)从省政府新闻办3月23日召开的世界气象日河北主题活动新闻发布会上获悉,今年以来截至3月21日,全省天气气候总体呈现气温明显偏高、波动起伏大,雨雪过程频繁、降水异常偏多,大风、沙尘、大雾等灾害性天气频发、极端性突...","NoPicture","今年以来河北天气气候呈现灾害性天气频发等特点","http://new.qq.com/omn/ENT20190/20210324A00JG300.html"
"腾讯网","前天22:10","4月18日,全桂寿、钟畅姿率队检查我市防汛备汛和防地质灾害工作,并对照值班表现场致电抽查人员值班值守情况。李鸿荣 摄 全桂寿、钟畅姿来到旺村水利枢纽、长洲水利枢纽,检查枢纽设备运行和防汛备汛工作,向工作人员询问值班值守制度落实情况,...","https://dss2.bdstatic.com/6Ot1bjeh1BF3odCf/it/u=3926906204,2827951084&fm=217&app=2&size=f242,162&n=0&g=0n&f=GIF?s=14A746B61CD119C832BB79BC0300C018&sec=1618986344&t=3f2ab454b41d8544fea92efb63413505","现场致电抽查!全桂寿钟畅姿检查防汛备汛防地质灾害工作及开展巡河...","http://new.qq.com/omn/ENT20190/20210418A09M3200.html"
"澎湃新闻","前天21:40","为进一步提升队伍战勤保障综合应急救援遂行保障能力,实地检验战勤保障实战水平,4月13日至4月14日,景德镇市消防救援支队开展了地震灾害实战拉动演练,战勤保障科圆满完成了地震灾害实战演练后勤保障工作。 ","https://dss0.bdstatic.com/6Ox1bjeh1BF3odCf/it/u=510237554,1700604589&fm=217&app=2&size=f242,162&n=0&g=0n&f=JPEG?s=6EC068941A110BD0261560F70300A062&sec=1618986344&t=e892f8513d9fcf50aa5dfb36eb21a6f3","景德镇市消防救援支队圆满完成地震灾害实战演练后勤保障工作","http://www.thepaper.cn/newsDetail_forward_12269000"
"腾讯网","前天21:38","临近预报、预警 同时也要注意防范强降雨 可能引发的城市内涝 山洪、泥石流等灾害 总之一句话 ▽ (来源:河南气象、河南日报、中国气象、中国天气网) 沐林|编辑 河南经济报新媒体中心│出品","https://dss0.bdstatic.com/6Ox1bjeh1BF3odCf/it/u=3785744109,1105471803&fm=217&app=2&size=f242,162&n=0&g=0n&f=GIF?s=3210C42209465ACA82D881DE00001031&sec=1618986344&t=662b8a9d689b78baef71326f3591d33a","25°C雨 雨雨 大雨暴雨……河南下周天气……","https://new.qq.com/omn/20210418/20210418A09B3900.html"
"腾讯网","前天21:34","这种阴晴不定的天气里 外套、雨伞、雨鞋都备好 该穿就穿该脱就脱 此外,小编温馨提醒 要密切留意气象部门发布的 临近预报、预警 同时也要注意防范强降雨 可能引发的城市内涝 山洪、泥石流等灾害 总之一句话▽...","https://dss0.bdstatic.com/6Ox1bjeh1BF3odCf/it/u=3785744109,1105471803&fm=217&app=2&size=f242,162&n=0&g=0n&f=GIF?s=3210C42209465ACA82D881DE00001031&sec=1618986344&t=662b8a9d689b78baef71326f3591d33a","26°C雨 雨雨 阵雨中雨…山西下周天气太刺激了!","https://new.qq.com/omn/20210418/20210418A09A4F00.html"
"姿话不语","前天21:06","在人类现实生活中总会碰到很多自然灾害,而火山爆发是其中的一种。火山爆发还有地震,都是因为地球内部地壳的变动,每次火山爆发都会给周围人类社会带来巨大的损失。不过我们经常见到的火山爆发,给人类带来的损失都比较有限,往往主要是影响到火山...","https://dss0.baidu.com/6ONWsjip0QIZ8tyhnq/it/u=1434912466,140389851&fm=30&app=106&size=f242,162&n=0&g=0n&f=JPEG?s=25D6836EC4146A77254E79B803009014&sec=1618986344&t=c9c64d1a3038f03528508c8964b28852","从坦博拉火山大爆发说起,浅谈人类与大自然灾害之间的斗争","https://baijiahao.baidu.com/s?id=1697383641213159680&wfr=spider&for=pc"
"网易","前天20:56","6、七里河岘口子地质灾害避险安置点项目 近日,七里河区委将该安置项目的最新进度及有关情况答复如下: 截至目前,A区主体全部完成,外保温完成95%,地下室正在做安装工程和剩余二次装修工作。B区正在进行主体结构建设。在保证质量和安全的前提...","https://dss0.bdstatic.com/6Ox1bjeh1BF3odCf/it/u=2019183976,3369360011&fm=217&app=2&size=f242,162&n=0&g=0n&f=JPEG?s=8033CD301BFCD5EB1EF480DA010080B3&sec=1618986344&t=44a6b698b5354470f14fe2ac9a00ca5e","兰州这些小区的房产证办理和棚户区改造的最新消息来了!","https://www.163.com/dy/article/G7T57R5Q0534VALD.html"
"气象小秘书","前天18:54","据气象预测,4月16晚-17日清晨,宝鸡陇县、千阳县、麟游县、太白县以及凤翔区、岐山县、扶风县北部地面降温,可能发生霜冻。对此,市委、市政府高度重视,市县农业农村部门积极应对,成功防御了低温霜冻,最大程度减轻了灾害对果业生产的影响。","https://dss0.baidu.com/6ONWsjip0QIZ8tyhnq/it/u=2344568870,140382105&fm=30&app=106&size=f242,162&n=0&g=0n&f=JPEG?s=F246D10CEE546FCC3AB075D3030050BC&sec=1618986346&t=fe6ab5acf85b753c605ae972ec0301ba","抓早动快 宝鸡霜冻灾害防御有成效","https://baijiahao.baidu.com/s?id=1697375315125194195&wfr=spider&for=pc"
"腾讯网","前天18:23","这样的预测不是谣言,因为从当前气候的发展趋势来看,我们频繁地使用各种各样的科技,已经是令我们的生态环境遭到了严重的破坏,各种极端的自然灾害和气候也开始频繁的出现,不说别的,就光说2020年,全年的平均气温就创下了历史记录。 ","https://dss0.bdstatic.com/6Ox1bjeh1BF3odCf/it/u=4031965127,2843242622&fm=217&app=2&size=f242,162&n=0&g=0n&f=PNG?s=D45239C4101235D64E79E1170300D0CB&sec=1618986346&t=abc4456339a4f56401a2b5efaeb9c8ec","霍金到底预言了什么?中国不复存在?最近的灾难就在2023年?","https://new.qq.com/rain/a/20210418A078V200"
"网易","前天18:07","广西全省降雨 暴雨、雷暴大风相伴 谨防山体滑坡等灾害 今晚桂东南还有较强降雨,局部有暴雨并伴有雷暴大风等强对流天气,明天起广西的降雨逐渐东移并减弱,但还是要注意防范局地强降雨可能会引起的山体滑坡,道路坍塌等次生灾害。","NoPicture","广西全省降雨 暴雨、雷暴大风相伴 谨防山体滑坡等灾害","https://www.163.com/news/article/G7SRJVRQ00019K82.html"
"趣观天下","前天18:01","随着镇防指指挥长汤庆一声令下,标志着矮寨镇2021年度汛期应急演练正式拉开帷幕。 4月16日,矮寨镇在大兴社区德茹地质灾害点举行防汛应急演练,模拟受连续降雨和强降雨诱发,德茹村地灾隐患点山体滑坡后缘裂缝突然加大,前缘局部发生小滑塌...","https://dss1.baidu.com/6ONXsjip0QIZ8tyhnq/it/u=3759104865,140383697&fm=30&app=106&size=f242,162&n=0&g=0n&f=JPEG?s=B3820CEB54530FD80828A53003000053&sec=1618986346&t=25b2501afbcaf305ea1ec1ae1aa3fb55","吉首市矮寨镇:开展辖区地质灾害点应急演练","https://baijiahao.baidu.com/s?id=1697377025804696455&wfr=spider&for=pc"
"腾讯网","前天18:01","山洪、泥石流等灾害 总之一句话▽ 4月17日 “五一”假期首日火车票 率先通过 互联网和电话方式 开始销售 根据放假安排 今年“五一”假期 放假时间为 5月1日至5日,共5天 为了方便旅客购票 ...","https://dss0.bdstatic.com/6Ox1bjeh1BF3odCf/it/u=3785744109,1105471803&fm=217&app=2&size=f242,162&n=0&g=0n&f=GIF?s=3210C42209465ACA82D881DE00001031&sec=1618986346&t=6b207b9f983feaf5d75364eeca81ebbc","雨雨雨 大雨暴雨…邓州下周的天气太刺激了!","https://new.qq.com/omn/20210418/20210418A070RV00.html"
"网易","前天17:39","昨天,受强降雨云团影响,我市多地出现大到暴雨的强降水。预计,17日到19日我市有中到大雨局部暴雨降水,20日降雨减弱。需注意防御强降水及其引发的灾害,并抓住有利时机做好科学蓄水。 据监测,4月16日08时至14时,我市南部出现大雨到...","https://dss2.bdstatic.com/6Ot1bjeh1BF3odCf/it/u=1936831863,3914367117&fm=217&app=2&size=f242,162&n=0&g=0n&f=JPEG?s=B8C2722356705F9E5B1CA0DB0100C0B1&sec=1618986346&t=2aacc33d0895a0e119cc297dd134693c","提醒!今起3天仍有明显降水,注意防御强降水及其引发的灾害","https://www.163.com/dy/article/G7SQ02KK05371T55.html"
"腾讯网","前天17:39","汛期期间,强降雨集中,往往产生暴雨洪涝灾害,同时强降雨也特别容易引发山洪、泥石流等次生灾害;如果区域降水偏少,持续高温,也会导致干旱。总之,汛期期间特别需要引起注意。 这里我们重点说一下暴雨。 ","https://dss2.bdstatic.com/6Ot1bjeh1BF3odCf/it/u=144334301,144525373&fm=217&app=2&size=f242,162&n=0&g=0n&f=GIF?s=1DA6ED1719D07DEF684550CB0200E030&sec=1618986346&t=eddf0a2fc588d4df2b655270612b7ffb","科普丨汛期到了!这些防汛小知识,新兴人快收好!","https://new.qq.com/omn/20210418/20210418A06PHC00.html"
"网易","前天17:08","“组织演练的目的是让大家一定要有这个意识,要警觉起来。”4月15日,南方电网云南曲靖师宗供电局2021年地震灾害应急演练如期举行,该供电局党委书记、总经理陆兵能说道。 此次应急演练预案根据南方电网公司应急预案编制指引(试行)要求及曲靖...","https://dss0.bdstatic.com/6Ox1bjeh1BF3odCf/it/u=4161045358,1574208457&fm=217&app=2&size=f242,162&n=0&g=0n&f=JPEG?s=A88660955C4358C800AD5056030040B3&sec=1618986346&t=a4c0d297661b95469e14faca0478fae2","师宗供电局开展地震灾害应急演练","https://www.163.com/dy/article/G7SO6VFP0545984B.html"
"腾讯网","前天16:27","2021年最新统计,全市共有地质灾害点306处,共威胁2538户9595人(其中省级地质灾害点51处,共威胁1499户6051人,见下图表格);高陡边坡点1733处,共威胁4742户18344人。地质灾害隐患点(包含地质灾害点和高陡边坡点)主要分布在华安、平和、南...","https://dss0.bdstatic.com/6Ox1bjeh1BF3odCf/it/u=2359337439,2162684257&fm=217&app=2&size=f242,162&n=0&g=0n&f=GIF?s=19A2CA5D14D29A6554A5900C0300E041&sec=1618986346&t=14513c89454a23fabf501f05c63dced9","警惕!汛期已至,九峰有10个高风险灾点!","https://new.qq.com/omn/20210418/20210418A05S9Q00.html"
"潇湘晨报","前天13:13","近日,贵港市自然资源局召开2021年汛期地质灾害防治工作会议,对地质灾害预警预报自动监测设备管理系统进行培训,就汛期地质灾害防治工作进行部署。市自然资源局党组成员、总规划师黄俊霖做动员讲话和工作部署。 会议指出,根据气象部门预测,2021年...","https://dss2.baidu.com/6ONYsjip0QIZ8tyhnq/it/u=3740049604,140362267&fm=30&app=106&size=f242,162&n=0&g=0n&f=JPEG?s=49024A964CC318CE3698F18203003081&sec=1618986346&t=6b9f56ce9671fcecbe0734233b112f7e","贵港市自然资源局召开2021年汛期地质灾害防治工作会议","https://baijiahao.baidu.com/s?id=1697354025790194935&wfr=spider&for=pc"
"腾讯网","前天22:21","据地震台网:2021-04-18 22:11:00台湾花莲县附近(自动)(121.51,23.94)发生5.2级地震,初估震中烈度约7度,距福建省所在地325公里,影响烈度约2度,微有感-个特别敏感……","https://dss0.bdstatic.com/6Ox1bjeh1BF3odCf/it/u=4123639881,3959474247&fm=217&app=2&size=f242,162&n=0&g=0n&f=JPG?s=E5A4F45C12F1A47D5E4219810300E08A&sec=1618986348&t=6e0bd367669407c54de35ce2e29bd09f","刚刚!地震了","https://new.qq.com/omn/20210418/20210418A09PAK00.html"
"网易","前天22:20","台湾花莲县附近发生5.2级左右地震   据中国地震台网自动测定,4月18日22时11分在台湾花莲县附近发生5.2级左右地震,震中位于北纬23.94度,东经121.51度,最终结果以正式速报为准。","https://dss0.bdstatic.com/6Ox1bjeh1BF3odCf/it/u=2757794481,464263195&fm=217&app=2&size=f242,162&n=0&g=0n&f=JPEG?s=4EE09654D935E7CCC48C8C42030060BB&sec=1618986348&t=3c5b00f4515c683c2a98f605e4269568","台湾花莲县附近发生5.2级左右地震","https://www.163.com/dy/article/G7TA10NB05148OGG.html"
"腾讯网","前天22:18","据中国地震台网自动测定:2021年4月18日22时11分在台湾花莲县(北纬23.94度,东经121.51度)发生5.2级左右地震,最终结果以正式速报为准。震中地图震中地形来源:中国地震台网","https://dss0.bdstatic.com/6Ox1bjeh1BF3odCf/it/u=3976222687,827489620&fm=217&app=2&size=f242,162&n=0&g=0n&f=JPG?s=B5F25B36C193646506CE89C80200F0BF&sec=1618986348&t=b11abed5207a28c0b32a4c4fa014e56b","台湾花莲县附近发生5.2级左右地震","https://new.qq.com/omn/20210418/20210418A09O9Q00.html"
"腾讯网","前天22:15","台湾花莲县附近发生5.2级左右地震 04/18 22:15 据中国地震台网自动测定,4月18日22时11分在台湾花莲县附近发生5.2级左右地震,震中位于北纬23.94度,东经121.51度,最终结果以正式速报为准。","https://dss2.bdstatic.com/6Ot1bjeh1BF3odCf/it/u=2211068665,263007176&fm=217&app=2&size=f242,162&n=0&g=0n&f=JPG?s=B1927F3251134E6D4E5AA1C30200F0BB&sec=1618986348&t=5b312d376dbba236a5c114c274498708","台湾花莲县附近发生5.2级左右地震","https://new.qq.com/omn/20210418/20210418A09NGL00.html"
"环球科学猫","前天22:10","又震了!根据地震监测网数据显示,在北京时间4月18日,位于日本本州东岸近海发生5.3级地震,震源深度50千米,咦?前段时间不是说有人担心日本大地震吗? 这次虽然地震的强度不大,但是也不小,所以大家又想到了“日本近海惊现2只大王乌贼尸...","https://dss1.baidu.com/6ONXsjip0QIZ8tyhnq/it/u=2712293306,140393594&fm=30&app=106&size=f242,162&n=0&g=0n&f=JPEG?s=48108D1A591E70CC4CE5B5C60300E0B0&sec=1618986348&t=7111c002a5a382c7d38d7829d91303bc","又震了!日本5.3级地震与核试验、核废水有关系?","https://baijiahao.baidu.com/s?id=1697387668159207444&wfr=spider&for=pc"
"澎湃新闻","前天20:09","速报参数:据中国地震台网正式测定,4月18日11时35分在云南大理州洱源县发生3.3级地震,震源深度9千米,震中位于北纬26.14度,东经100.01度。 基础背景 震中地形:震中5公里范围内平均海拔约2147米。 ","NoPicture","云南大理突发地震!","http://www.thepaper.cn/newsDetail_forward_12277452"
"纵观历史2020","前天18:56","在汶川地震中,有一位士兵叫王肃满,他在地震发生后第一时间跟随部队来到就灾难现场,在救灾的过程中,王肃满为救人,大喊旁边的总理,请他让路。王肃满在救灾时争分夺秒,拯救了许多生命,现如今他过得如何呢? 默默付出的王肃满 2008年的中国...","https://dss0.baidu.com/6ONWsjip0QIZ8tyhnq/it/u=1600272515,140382221&fm=30&app=106&size=f242,162&n=0&g=0n&f=JPEG?s=84E2DE07C22226AE36B42CB203008090&sec=1618986348&t=efb9d54bfd870625e25044abe4986ecc","汶川地震中,士兵王肃满为救人大喊“让路”,他后来如何?","https://baijiahao.baidu.com/s?id=1697365466903506001&wfr=spider&for=pc"
"网易","前天18:29","河北唐山4.3级地震 此次地震造成震中当地震感强烈 天津、北京等地亦有震感 中国地震台网正式测定: 4月16日16时6分 在河北唐山市滦州市 (北纬39.75度,东经118.71度) 发生4.3级地震 震源深度9千米 ...","https://dss2.bdstatic.com/6Ot1bjeh1BF3odCf/it/u=2629968686,1773072818&fm=217&app=2&size=f242,162&n=0&g=0n&f=JPEG?s=8FD0ED120F4845491A71E0DB0000D0B3&sec=1618986348&t=39037aace614b78dd10ef9a758788fb3","「996 & 突发」刚刚,唐山地震","https://www.163.com/dy/article/G7SSQ5UO05373SKY.html"
"华元宠物","前天17:30","据统计,地震中的幸存者,有70%都是由搜救犬发现的!在这过程中,它们经常会被瓦砾划伤,但它们没有停下脚步! 搜救犬往往会因为高强度的搜救和训练,而导致自身寿命缩短,08年的搜救犬中已经仅存冰洁一只。它身上的累累伤痕,都是它救人的...","https://dss1.baidu.com/6ONXsjip0QIZ8tyhnq/it/u=1665181952,140197805&fm=30&app=106&size=f242,162&n=0&g=0n&f=JPEG?s=3C24C3155803C2C844A539440100A0B0&sec=1618986348&t=026f06cd982c9275ce3cda5297479d93","08年地震,20年疫情,它们从未缺席,王一博带你了解它们的故事","https://baijiahao.baidu.com/s?id=1697176992950747382&wfr=spider&for=pc"
"腾讯网","3天前","救灾指挥部地质灾害 防范应对准备工作 4月14至15日,由应急管理部地震地质司二级巡视员张黎明带队的国务院抗震救灾指挥部工作组,赴拉萨城关区、尼木县进行检查。西藏自治区应急管理厅巩同梁副厅长,拉萨市应急管理局米玛次仁书记,拉萨市消防救...","https://dss2.bdstatic.com/6Ot1bjeh1BF3odCf/it/u=2150439536,448568521&fm=217&app=2&size=f242,162&n=0&g=0n&f=JPEG?s=F894619848031ACC1E0C119303007080&sec=1618986356&t=03d2bdd9ae981dc0f6ea2e02e57734cd","拉萨市迎检国务院抗震救灾指挥部地质灾害防范应对准备工作","https://new.qq.com/omn/20210417/20210417A0353A00.html"
"邯郸之窗","3天前","昆明地质灾害治理常用的种植技术 液压喷播施工,前用于护坡的主要植物材料有多花木兰、香花槐、紫穗槐、地锦、荆条、沙地柏、柠条、柽柳、垂叶榕等乔木种及亚乔木种,长春藤、藤本月季、爬墙虎、紫藤、扶芳藤等藤本植物;火棘、胡枝子、木...","https://dss1.bdstatic.com/6OF1bjeh1BF3odCf/it/u=2643084304,3407848204&fm=217&app=2&size=f242,162&n=0&g=0n&f=JPEG?s=A08FB758D235278EAC587B040300E0C4&sec=1618986356&t=51cef3a7c8270c464ae6a8c0ebd5ace3","昆明地质灾害治理常用的种植技术","http://www.hdzc.net/qyxw/47168866.html"
"腾讯网","4天前","山洪和地质灾害 请注意防范 ! 省气象台今日最新发布的 天气预报资料显示 4月18日至20日 我省将普降小到中雨 局部有中雪出现 根据省气象台今日最新发布的天气预报,今天到4月18日白天,甘肃大部主要是以多云或晴天为主,甘肃的下一场...","https://dss2.bdstatic.com/6Ot1bjeh1BF3odCf/it/u=837249314,2272964339&fm=217&app=2&size=f242,162&n=0&g=0n&f=JPEG?s=1534C73496E5491B97005848030030B9&sec=1618986356&t=69cb63264106b6f5a129328056348d45","甘肃一市发布黄色预警!大面积降雨将到来,甘肃接下来的天气……","http://new.qq.com/omn/ENT20190/20210416A0CPVH00.html"
"网易新闻","4天前","4月15日,广东省防总宣布,全省进入汛期,各地各部门全面进入临战状态。 汛期到来,滑坡、崩塌等灾害高发,面对突发的地质灾害和险情,如何高效有序做好突发地质灾害应急工作,从而避免或最大限度降低灾害造成的损失? 应急演练活动现场。受访...","NoPicture","汛期到来,如何应对突发地质灾害?河源这场实战演练告诉你","http://dy.163.com/article/G7O4K16M055004XG.html"
"气象小秘书","4天前","4月16日上午,安化县奎溪镇在白羊社区白茅溪地质灾害点开展地质灾害应急预案演练。随着一阵阵敲锣声和紧急口哨声,地质灾害隐患点区域的男女老少在民兵的协助下立即从家里跑出来,进行安全有序撤离。 近日,接上级地质灾害气象等级预报,奎溪...","https://dss1.baidu.com/6ONXsjip0QIZ8tyhnq/it/u=3096406443,140229085&fm=30&app=106&size=f242,162&n=0&g=0n&f=JPEG?s=5EB62EC50EB68EC84238349303003081&sec=1618986356&t=3c2126e6d116cd5413700d833d3c1dbd","安化县奎溪镇:开展地质灾害应急演练 筑牢防灾减灾救灾防线","https://baijiahao.baidu.com/s?id=1697210998553475368&wfr=spider&for=pc"
"新华网客户端","4天前","地方各级政府要严格落实主体责任,国家防总要发挥好牵头抓总作用、加强统筹协调,相关部门各尽其责、发挥专业优势,各方面形成合力,有效防范重大水旱、台风等灾害,全力保障人民群众生命财产安全。 国务委员、国家防汛抗旱总指挥部总指挥王勇4...","NoPicture","深入开展风险隐患排查整改 防范水旱台风灾害","http://www.xinhuanet.com/mrdx/2021-04/16/c_139885491.htm"
