"results_author","results_date","results_des","results_img","results_title","results_url"
"潇湘晨报","4月7日","风雹灾害形势分析 结合历年天气情况,4月份本市风雹灾害发生风险较低,但仍需重点关注强风对城市运行、建设施工、农作物生产等领域影响,可能造成人员伤亡和经济损失。 洪涝灾害形势分析 4月份,本市降水量虽较常年同期偏多,但由强降雨造成中...","https://dss1.baidu.com/6ONXsjip0QIZ8tyhnq/it/u=3948646287,139403595&fm=30&app=106&size=f242,162&n=0&g=0n&f=JPEG?s=7218402201BA36290E73AA9403003087&sec=1618986371&t=5f8ae035b82d474bfb034a2cc46a7a20","4月份安全风险提示和自然灾害风险形势分析报告","https://baijiahao.baidu.com/s?id=1696324491247319286&wfr=spider&for=pc"
"中国政府网","4月6日","新华社北京4月6日电 国家主席习近平4月6日就印尼发生山洪和泥石流灾害向印尼总统佐科致慰问电。 习近平在慰问电中表示,惊悉印尼发生山洪和泥石流灾害,造成重大人员伤亡。我谨代表中国政府和中国人民,并以我个人的名义,对遇难者表示深切的...","NoPicture","习近平就印度尼西亚发生山洪和泥石流灾害向印尼总统佐科致慰问电","http://www.gov.cn/xinwen/2021-04/06/content_5598031.htm"
"潇湘晨报","4月7日","风雹灾害形势分析 结合历年天气情况,4月份本市风雹灾害发生风险较低,但仍需重点关注强风对城市运行、建设施工、农作物生产等领域影响,可能造成人员伤亡和经济损失。 洪涝灾害形势分析 4月份,本市降水量虽较常年同期偏多,但由强降雨造成中...","https://dss1.baidu.com/6ONXsjip0QIZ8tyhnq/it/u=3948646287,139403595&fm=30&app=106&size=f242,162&n=0&g=0n&f=JPEG?s=7218402201BA36290E73AA9403003087&sec=1618986374&t=4a8fe53b550c3c0ec09e905e8c251b82","4月份安全风险提示和自然灾害风险形势分析报告","https://baijiahao.baidu.com/s?id=1696324491247319286&wfr=spider&for=pc"
"中国政府网","4月6日","新华社北京4月6日电 国家主席习近平4月6日就印尼发生山洪和泥石流灾害向印尼总统佐科致慰问电。 习近平在慰问电中表示,惊悉印尼发生山洪和泥石流灾害,造成重大人员伤亡。我谨代表中国政府和中国人民,并以我个人的名义,对遇难者表示深切的...","NoPicture","习近平就印度尼西亚发生山洪和泥石流灾害向印尼总统佐科致慰问电","http://www.gov.cn/xinwen/2021-04/06/content_5598031.htm"
"中国新闻网","4月6日","距灾害点最近的洪瓦路安全检查值班点。 刘忠俊 摄 中新网四川洪雅4月6日电 (记者 刘忠俊)4月6日上午,四川洪雅县赵河村“高位远程崩滑灾害”现场下起了雨,同时起了大雾,能见度差,但现场相关处置工作仍在有序开展。 4月5日,洪雅...","https://dss1.baidu.com/6ONXsjip0QIZ8tyhnq/it/u=255849113,139363661&fm=30&app=106&size=f242,162&n=0&g=0n&f=JPEG?s=9BA09D091A6A0A9E9C19558D03003080&sec=1618986374&t=41b2a0ed703fa35a3e1e8812e3417fe8","四川洪雅县“高位远程崩滑灾害”:村民回忆惊魂一刻","https://baijiahao.baidu.com/s?id=1696281637160683586&wfr=spider&for=pc"
"中国气象局","4月6日","根据今年汛期整体气候趋势预测,我国气候年景为一般到偏差级别,旱涝并重,区域性、阶段性旱涝灾害明显,极端天气气候事件偏多,主要多雨区在我国北方;全国大部分地区气温偏高;全年登陆我国的台风个数偏多。 去年,让人印象最深刻的极端天气莫...","NoPicture","国家气候中心发布汛期气候趋势预测结果 区域性阶段性旱涝灾害明显","http://www.cma.gov.cn/2011wmhd/2011wzbft/2011wftzb/202104/t20210406_574820.html"
"东北网","4月6日","省气象局生态与农业气象中心农业气象专家闫平说,根据前期农业气象条件、封冻前土壤墒情及2021年度气候趋势,预计2021年我省整体气候环境利于农业生产。影响农业生产的主要灾害为春季东部和北部局地内涝、西南部阶段性干旱;夏季阶段性低温、局地...","https://dss0.baidu.com/6ONWsjip0QIZ8tyhnq/it/u=173114600,139331414&fm=30&app=106&size=f242,162&n=0&g=0n&f=JPEG?s=CCB40FD0425949CEF810EC51030040F3&sec=1618986374&t=c4170a415d641ec9b6e843504e2eed39","趋利避害才能确保稳产高产 农业经营者规避气象灾害有门道","https://baijiahao.baidu.com/s?id=1696247143680117682&wfr=spider&for=pc"
"历史哆咪哆","4月6日","元朝末年,受到自然灾害的影响,整个中原地区都出现了粮食减产的现象,元朝政府难以维持收支平衡,便只能加大农民的负担,增加税收,以增加必不可少的财政收入,维持基本的社会秩序。 但是农民没有了足够的粮食,自己吃饱饭都成问题,又哪有能力缴...","https://dss1.baidu.com/6ONXsjip0QIZ8tyhnq/it/u=1965402136,139304423&fm=30&app=106&size=f242,162&n=0&g=0n&f=JPEG?s=3DB173914B73C9CE0A81156F03003070&sec=1618986374&t=f85b08b197d06b4a60026b51f1f435e6","明朝初期,百废待兴,自然灾害无法避免,朱元璋是如何应对的?","https://baijiahao.baidu.com/s?id=1696188768442329901&wfr=spider&for=pc"
"天津日报","4月6日","印尼灾害连发 70人失踪。印尼国家抗灾署发言人拉迪提亚·贾迪5日举行线上新闻发布会说,洪灾已影响到东努沙登加拉省11个县市。洪灾还造成至少15人受伤、2600人受灾。 印度尼西亚官员5日说,伦巴塔岛一座火山4日暴雨后发生火山泥流,造成...","https://dss2.bdstatic.com/6Ot1bjeh1BF3odCf/it/u=1176711955,4044353638&fm=217&app=2&size=f242,162&n=0&g=0n&f=JPEG?s=3FC2F917415F71CA48DD1CCA010050B0&sec=1618986374&t=e646e577c90dbb726d733616089a5815","每日新报数字报刊平台-灾难","http://epaper.tianjinwe.com/mrxb/html/2021-04/06/content_19044_4275683.htm"
"生活晨报","4月5日","近日,省政府办公厅印发《山西省2021年度地质灾害防治方案》,共划定晋西黄土高原等4个地质灾害重点防治区。 01.晋西黄土高原崩塌、滑坡地质灾害重点防治区 该区行政范围 包括忻州市河曲、保德,吕梁市柳林、石楼,临汾市永和、大宁、吉县的全...","https://dss2.baidu.com/6ONYsjip0QIZ8tyhnq/it/u=3041921344,139272715&fm=30&app=106&size=f242,162&n=0&g=0n&f=JPEG?s=18D3895C0D8908CC053AAE8B0300A09F&sec=1618986374&t=6a0f475cdf19ff84d067a10bf50c8528","山西划定4个地质灾害重点防治区","https://baijiahao.baidu.com/s?id=1696184138906731250&wfr=spider&for=pc"
"法制视界","4月5日","并将伴有短时强降水等强对流天气 尤其对于云南东南部来说 降水最强的时段会出现在4日夜间到5日白天 部分地区将会有暴雨或大暴雨 这次降水过程具有一定的极端性 山区特别需要防范地质灾害的发生 但在云南西部和北部,降雨依然偏少 自2月...","https://dss0.baidu.com/6ONWsjip0QIZ8tyhnq/it/u=3809991668,139248704&fm=30&app=106&size=f242,162&n=0&g=0n&f=JPEG?s=10517884981AA9CE3F03501B0300D09A&sec=1618986374&t=53d901741eb7b147546a2e9f25fcc346","本周天气:暴雨+强对流来袭!这里更要警惕地质灾害","https://baijiahao.baidu.com/s?id=1696157929030431557&wfr=spider&for=pc"
"气象小秘书","4月5日","楚天都市报极目新闻讯(记者黄忠 通讯员史登华 李伟)昨日,极目新闻记者从湖北省减灾委员会办公室获悉,经专题会商研判认为:今年4月与常年同期相比,气温总体偏高、波动大,降水时空分布不均,需重点做好水旱灾害、森林火灾、地质灾害等自然灾...","https://cambrian-images.cdn.bcebos.com/b604caf6d9c89aba9ecfca597d6f0e25_1666454311203170.jpeg@w_100,h_100","4月湖北省预计气象灾害多样多发 须做好水旱灾害、森林火灾、地质...","https://baijiahao.baidu.com/s?id=1696176279199774777&wfr=spider&for=pc"
"综投网","7天前","中国地震台网正式测定:04月13日17时07分在云南红河州石屏县(北纬23.84度,东经102.38度)发生3.3级地震,震源深度10千米。文末附地震概念股。","https://dss1.bdstatic.com/6OF1bjeh1BF3odCf/it/u=306231557,2224379194&fm=217&app=2&size=f242,162&n=0&g=0n&f=PNG?s=F92C3C72159A61CA0C69C0DE0300E0B2&sec=1618986376&t=7b9e007eb394dc0f7ca924d83e720d75","今天地震最新消息 刚刚什么地方地震了?(附股)","http://www.zt5.com/gp/redian/522056.html"
"澎湃新闻","7天前","2021年4月14日是玉树地震11周年。震后,中建西南院承担了玉树红旗小学的设计任务,为玉树的灾后重建工作贡献出力量。 “新校园,会有的!新家园,会有的!” 2010年青海玉树特大地震发生后的第一时间,中国建筑玉树灾后重建前线指挥部成立。","https://dss0.bdstatic.com/6Ox1bjeh1BF3odCf/it/u=2082875122,4167471666&fm=217&app=2&size=f242,162&n=0&g=0n&f=GIF?s=588035726FEF53070A54B1C90000F0B1&sec=1618986376&t=723944dfa215dd7befd35a469f519985","作品| 纪念玉树地震11周年——玉树红旗小学灾后重建故事","http://www.thepaper.cn/newsDetail_forward_12192653"
"潇湘晨报","7天前","地震是一种自然现象,地球上每年要发生地震500多万次,其中只有5万多次人们能感觉得到,也不是所有的地震都能造成破坏。 那么,为什么会发生地震?地震有哪几种类型?我们该怎样面对地震?下面向大家简单介绍一下。 地震有哪几种类型 天然地震...","https://dss0.baidu.com/6ONWsjip0QIZ8tyhnq/it/u=4262989676,139945899&fm=30&app=106&size=f242,162&n=0&g=0n&f=JPEG?s=1FF34E814E238AC654356D1803003082&sec=1618986376&t=9547afcedfc58a07fb70a020c6f59677","为什么会发生地震?地震有哪几种类型?我们该怎样面对地震?","https://baijiahao.baidu.com/s?id=1696906921415871822&wfr=spider&for=pc"
"爆品会圈","7天前","2008年在中国的历史上也是黑暗的一年,这一年的5月,四川汶川发生了巨大的灾难,地震就如同无情的死神,将整个四川大地尽数吞噬。一个个家庭的破碎,一幕幕生命的逝去,让我们永远的铭记了这一年。 只要有人突然提及这场地震,大家心中还是会...","https://dss2.baidu.com/6ONYsjip0QIZ8tyhnq/it/u=3683164058,139972159&fm=30&app=106&size=f242,162&n=0&g=0n&f=JPEG?s=F601BA0B08707282729D0CC70300E0B3&sec=1618986376&t=b00b94fe45c9fa151a638aea00ca0fbc","“范跑跑”汶川地震中丢下学生第一个逃跑,如今不思悔改前途尽毁","https://baijiahao.baidu.com/s?id=1696894677229632444&wfr=spider&for=pc"
"悟空科学","7天前","不过,大家都说可能是与核废水有关,甚至说真的可能是生物异常——是大地震的前兆,不过,站在科学的角度来讲。确实生物的异常情况与地震没多大关系。是否与核废水有关这个也只能暂且放下,毕竟没有任何的科学分析结果,然而日本又发生了一次...","https://dss0.baidu.com/6ONWsjip0QIZ8tyhnq/it/u=3843880870,139929153&fm=30&app=106&size=f242,162&n=0&g=0n&f=JPEG?s=B00220F86267834F046961880300F082&sec=1618986376&t=259f4ea878ddeb3997732630f23c660a","日本出现大规模地震,3天已发生300多次,真的是大地震的前兆?","https://baijiahao.baidu.com/s?id=1696888960102422131&wfr=spider&for=pc"
"中国小康网","7天前","汶川特大地震灾后重建结束后,当地政府迅速将重心转移到脱贫攻坚上来,2011年启动第一轮特困村建设,充分借鉴抗震救灾和灾后重建“集中力量办大事”等经验,投入巨资解决全县基础设施难题,2019年实现脱贫摘帽,截至2020年,全县累计减贫9809户...","https://dss0.baidu.com/6ONWsjip0QIZ8tyhnq/it/u=1199253992,139926624&fm=30&app=106&size=f242,162&n=0&g=0n&f=JPEG?s=B08A26F99AB3C0CE12B1A10B0300A0C0&sec=1618986376&t=3e3f17186fe659e5b10e48aea81f6c37","陪伴·大爱·信念——汶川特大地震灾后恢复重建的精神力量","https://baijiahao.baidu.com/s?id=1696886246121572593&wfr=spider&for=pc"
"文言史记","8天前","不过我们也要理解的是,老师也是人,也是一个活生生的生命体,在灾难面前,他们第一时间想到的也是自己的生命,就比如那位在汶川地震时,丢下学生独自逃跑的范美忠老师,那大家知道他现在过得怎么样了吗? 汶川大地震是我国历史上又一次的重大...","https://dss2.baidu.com/6ONYsjip0QIZ8tyhnq/it/u=1420854064,139861618&fm=30&app=106&size=f242,162&n=0&g=0n&f=JPEG?s=66A224E516337184162DD87A03008011&sec=1618986376&t=5c1788d68d614313159395097b6a93d6","汶川地震时,范美忠丢下学生独自逃跑,如今他过得怎么样?","https://baijiahao.baidu.com/s?id=1696816452498055013&wfr=spider&for=pc"
"湘湘带你看社会","8天前","如果地震时在路上该如何保护自己? 发生地震时,如果在行驶的地铁中,应当牢牢抓住拉手、柱子及座位等,下蹲身体,同时保护好头部;如果在行驶的车辆中,驾驶员应立即打开双跳灯,避开十字路口靠边停车,待震动结束后下车寻找安全地带躲避。 【来...","https://dss1.baidu.com/6ONXsjip0QIZ8tyhnq/it/u=2800144538,139857970&fm=30&app=106&size=f242,162&n=0&g=0n&f=JPEG?s=6880EC12C53444230A54D4DB020050A3&sec=1618986376&t=fdfc6614c6ef2732ade28df27e49bb6c","如果地震时在路上该如何保护自己?","https://baijiahao.baidu.com/s?id=1696812430025531563&wfr=spider&for=pc"
"腾讯网","8天前","本次地震数据源自:广东地震台官网 一、本次地震基础参数 小编从广东省地震局官网获悉,经广东省地震局测定:2021年4月11日晚上9点21分18秒。广东省梅州市五华县发生了M1.2级地震。本次地震震源深度6公里。震中位于经度116.02,纬度23...","https://dss1.bdstatic.com/6OF1bjeh1BF3odCf/it/u=2058842984,1465449912&fm=217&app=2&size=f242,162&n=0&g=0n&f=PNG?s=A532E536151F75CE1864D8DA0300F0B1&sec=1618986376&t=4a8f58df0a830cd72879773bff056a69","突发!广东梅州发生地震!","http://new.qq.com/omn/ENT20190/20210412A0476U00.html"
"大洋网","8天前","四川自贡市贡井区发生3.1级地震,震源深度10千米 @中国地震台网速报消息,中国地震台网正式测定:04月12日08时18分在四川自贡市贡井区(北纬29.42度,东经104.53度)发生3.1级地震,震源深度10千米。","https://dss2.bdstatic.com/6Ot1bjeh1BF3odCf/it/u=15666000,2512187683&fm=217&app=2&size=f242,162&n=0&g=0n&f=JPEG?s=B1767C324903D1475A5814CA0200E032&sec=1618986376&t=a44e7185d53f56219983ae20cdd6e732","四川自贡市贡井区发生3.1级地震,震源深度10千米","https://news.dayoo.com/society/202104/12/140000_53869553.htm"
"红网","3月10日","红网时刻常德3月10日讯(通讯员 沈辉兵)3月9日上午,石门县2021年度地质灾害防治工作会议在石门县自然资源局六楼会议室召开,省自然资源厅地勘处四级调研员叶庆华、省自然资源事务中心高级工程师邓波、市自然资源和规划局总规划师向进、地勘...","https://dss2.baidu.com/6ONYsjip0QIZ8tyhnq/it/u=2154585908,3726698055&fm=173&app=49&size=f242,162&n=0&g=0n&f=JPEG?s=4A8009C55149314D04A448B303007042&sec=1618986381&t=1974c75d6c91b33852a26cc12c4a218a","石门县召开2021年地质灾害防治工作会议","https://baijiahao.baidu.com/s?id=1693836990160245953&wfr=spider&for=pc"
"澎湃在线","3月10日","聚焦重要城镇、重大工程、国防设施和战略工程安全保障需求,加强气候变化与人类活动作用下高山区重大灾害成灾致灾机理与防治关键核心技术的研究,建立贯通“感知识别、评估预测、监测预警、防控治理、应急救援”全过程的灾害风险防控与工程安全防护...","https://dss1.baidu.com/6ONXsjip0QIZ8tyhnq/it/u=2993964148,526333632&fm=173&app=49&size=f242,162&n=0&g=0n&f=JPEG?s=FE7009C5455337C24EE848AF0300D082&sec=1618986381&t=7e9d4568af95709b955b9debfec5c23c","全国人大代表崔鹏:​加强高山区灾害风险防控 保障重大工程与...","https://baijiahao.baidu.com/s?id=1693840439301817016&wfr=spider&for=pc"
"川观新闻SCOL","3月9日","“当前和今后一个时期,应进一步统筹发展和安全,强化四川地震灾害防御体系建设,”全国政协十三届四川会议上,住川全国政协委员在联名提案中发出呼吁。 这份题为《关于进一步统筹发展和安全,强化四川地震灾害防御体系建设的提案》指出,四川是我国...","https://cambrian-images.cdn.bcebos.com/9f0531c5111f23df273eeabdb8560a39_1572886762720818.jpeg@w_100,h_100","我们的十四五 ▏住川全国政协委员联名呼吁:强化四川地震灾害防御...","https://baijiahao.baidu.com/s?id=1693756382415193194&wfr=spider&for=pc"
"潇湘晨报","3月9日","3月8日,记者从省应急厅获悉,贵州运用大数据与自然灾害综合风险普查工作深度融合的创新做法,得到国务院普查办的高度赞扬,并在全国普查工作培训会上进行演示交流。 在近日召开的贵州省第一次全国自然灾害综合风险普查试点工作情况汇报会上,省...","https://dss1.baidu.com/6ONXsjip0QIZ8tyhnq/it/u=3099721933,2775483431&fm=173&app=49&size=f242,162&n=0&g=0n&f=JPEG?s=E71215891EBB1E883684D9B60300C0A3&sec=1618986381&t=3d458c429fe9cde23b9eeda787474371","贵州:将大数据与自然灾害综合风险普查深度融合","https://baijiahao.baidu.com/s?id=1693728708816217848&wfr=spider&for=pc"
"西安发布","3月5日","3月5日3时28分(北京时间),新西兰克马德克群岛海域(29.56°S,177.11°W)发生8.1级地震,震源深度为20.0千米(震级修订)。自然资源部海啸预警中心根据最新监测分析结果,此次地震已经引发海啸,但不会对我国沿岸造成灾害性影响。 来源:...","https://cambrian-images.cdn.bcebos.com/ae3585d4cdd0d8c7cbbee49292767774_1563805377226566.jpeg@w_100,h_100","自然资源部:新西兰地震引发海啸 不会对我国沿岸造成灾害性影响","https://baijiahao.baidu.com/s?id=1693394553395911732&wfr=spider&for=pc"
"潇湘晨报","3月5日","3月5日3时28分(北京时间),新西兰克马德克群岛海域(29.56°S,177.11°W)发生8.1级地震,震源深度为20.0千米(震级修订)。 自然资源部海啸预警中心根据最新监测分析结果,此次地震已经引发海啸,但不会对我国沿岸造成灾害性影响。 延伸...","https://cambrian-images.cdn.bcebos.com/a51d142ac7625feda1002f0c739ae255_1606863438588053.jpeg@w_100,h_100","自然资源部:新西兰地震已引发海啸,不会对我国沿岸造成灾害性影响","https://baijiahao.baidu.com/s?id=1693398498068283807&wfr=spider&for=pc"
"人民日报","3月5日","2021年3月5日3时28分(北京时间),新西兰克马德克群岛海域(29.56°S,177.11°W)发生8.1级地震,震源深度为20.0千米(震级修订)。自然资源部海啸预警中心根据最新监测分析结果,此次地震已经引发海啸,但不会对我国沿岸造成灾害性影响。","https://cambrian-images.cdn.bcebos.com/53864a5e77b735000396c815760f7b4c_1593743208952652.jpeg@w_100,h_100","新西兰地震修订为8.1级,自然资源部:海啸不会对我国沿岸造成灾害性...","https://baijiahao.baidu.com/s?id=1693375753663225977&wfr=spider&for=pc"
"浙江日报","3月5日","2021年3月5日3时28分(北京时间),新西兰克马德克群岛海域(29.56°S,177.11°W)发生8.1级地震,震源深度为20.0千米(震级修订)。自然资源部海啸预警中心根据最新监测分析结果,此次地震已经引发海啸,但不会对我国沿岸造成灾害性影响。","https://cambrian-images.cdn.bcebos.com/d1b2758400815594d8e5ff8f35b4c1ee_1579841768127742.jpeg@w_100,h_100","更新丨新西兰地震修订为8.1级 不会对我国沿岸造成灾害性影响","https://baijiahao.baidu.com/s?id=1693344685885277995&wfr=spider&for=pc"
"潇湘晨报","3月4日","3月1日,水利部召开了水旱灾害防御工作视频会议,李国英部长出席会议并讲话,我厅王殿武厅长做《科学研判,精准调度,全力抗旱促发展》交流发言。魏山忠副部长主持。 李国英部长指出,要从政治高度准确把握新阶段水旱灾害防御工作的新要求,准确把...","https://cambrian-images.cdn.bcebos.com/a51d142ac7625feda1002f0c739ae255_1606863438588053.jpeg@w_100,h_100","水利部召开全国水旱灾害防御工作会议我省交流发言","https://baijiahao.baidu.com/s?id=1693285621153997932&wfr=spider&for=pc"
"北京日报客户端","3月3日","因此,田春艳建议,“十四五”期间将把城市道路塌陷灾害的预防和治理的基础研究设置为行业重大研究课题。 除进行上述研究外,当务之急还要查清底数,收集已发生灾害的各项数据,建立完整、动态的道路塌陷灾害数据库,并向研究者开放,为道路塌陷...","https://cambrian-images.cdn.bcebos.com/814a110b34d52c106f9ba99c5d415478_1601149438053974.jpeg@w_100,h_100","田春艳代表:建议提高城市道路塌陷灾害防治能力","https://baijiahao.baidu.com/s?id=1693223976851646935&wfr=spider&for=pc"
"潇湘晨报","3月3日","3月2日,广西第一次全国自然灾害综合风险普查领导小组办公室组织召开全区自然灾害综合风险普查工作推进视频会。自治区承担具体普查任务的10个部门业务处室负责人、自治区财政厅业务处室负责人、自治区、市、县(区、市)三级普查办全体人员参...","https://cambrian-images.cdn.bcebos.com/a51d142ac7625feda1002f0c739ae255_1606863438588053.jpeg@w_100,h_100","广西:全力推进自然灾害综合风险普查工作","https://baijiahao.baidu.com/s?id=1693197352569631048&wfr=spider&for=pc"
"封面新闻","3月2日","3月2日,封面新闻记者从应急管理部获悉,近日,应急管理部会同水利部、农业农村部、气象局等部门对2月份全国自然灾害情况进行了会商分析。 据介绍,2月自然灾害以干旱、低温冷冻和雪灾为主,风雹、洪涝和地质灾害、森林草原火灾、地震灾害等...","https://cambrian-images.cdn.bcebos.com/7d15a50cee51b0a96e00a85cfabbb513_1577667706397024.jpeg@w_100,h_100","应急管理部:2月全国自然灾害致113.2万人次受灾 以干旱、低温冷冻...","https://baijiahao.baidu.com/s?id=1693116010275536849&wfr=spider&for=pc"
"潇湘晨报","3月2日","请广大市民选择正规公园景区游玩,不要前往野山等未开发的景点,避开绝壁、险石等地质灾害易发区域,游玩前应关注景区防疫工作安排,提前做好预约,合理规划出行路线,注意穿着舒适、轻便的衣服和运动鞋,备好干粮、水和通讯设备等必需品,确保...","https://cambrian-images.cdn.bcebos.com/a51d142ac7625feda1002f0c739ae255_1606863438588053.jpeg@w_100,h_100","3月份自然灾害和生产安全事故风险提示","https://baijiahao.baidu.com/s?id=1693118013385924880&wfr=spider&for=pc"
"闽南网龙岩","3月2日","得州危机暴露了美国式的混乱局面,美国民众遭遇灾难时,没有得到可靠的电力保障,美国政客们对此也毫不关心,连年增加军费,只关注子弹、炸弹,而不愿投入到民生、医疗等领域,正如我们所见,这就是美国根本无力保护自己民众的原因。 部分消息参考...","https://cambrian-images.cdn.bcebos.com/f149053e9e570c603c71ca0d3bb9edc8_1591737693679007.jpeg@w_100,h_100","百姓水深火热,政客毫不关心,得州灾害暴露出美国多个问题","https://baijiahao.baidu.com/s?id=1693099407481175657&wfr=spider&for=pc"
"潇湘晨报","3月2日","2月份以来,省普查办贯彻落实国务院普查办的要求,发挥统筹协调作用,加快推进普查试点工作,积极筹划全面普查的各项准备工作。 一是加快推进普查方案的编制工作。2月3日,省普查办组织召开《安徽省第一次全国自然灾害综合风险普查总体方案》专家...","https://cambrian-images.cdn.bcebos.com/a51d142ac7625feda1002f0c739ae255_1606863438588053.jpeg@w_100,h_100","省普查办通报自然灾害综合风险普查工作进展情况(之六)","https://baijiahao.baidu.com/s?id=1693098367917454949&wfr=spider&for=pc"
"天眼新闻","3月2日","但在上个月,因严重的暴风雪灾害面临巨大的费用亏空。2021年2月中旬,异常寒冷的天气摧毁了得州近一半的发电厂,致使430万人连续几日停电停暖,水管破裂,导致众多家庭和企业蒙受损失。在此期间,布拉索斯电力合作公司和其他供电商,被要求以...","https://cambrian-images.cdn.bcebos.com/cfe018ff76999138fb6b52babc721297_1618362010206479.jpeg@w_100,h_100","美国得州最大电力公司申请破产:暴风雪灾害导致欠18亿美元债务","https://baijiahao.baidu.com/s?id=1693080994074920702&wfr=spider&for=pc"
"新华社","3月1日","新华社北京3月1日电(记者刘诗平)水利部部长李国英1日强调,做好2021年水旱灾害防御工作,要强化预报、预警、预演、预案措施,依法科学精细调度水工程,强化科技引领,狠抓责任落实,坚决做到防患于未然。 李国英是在水利部水旱灾害防御工作视频会...","https://cambrian-images.cdn.bcebos.com/0adaa3b9ae82034d4cbd913b354610a3_1582378850174815.jpeg@w_100,h_100","水利部部长:防患未然!做好2021年水旱灾害防御","https://baijiahao.baidu.com/s?id=1693043807440192265&wfr=spider&for=pc"
"红帽影探","2月27日","事后经过统计,这场地震达到了9.1级,遇难人数达到了27593人,是日本乃至人类历史上颇为惨烈的自然灾害。 此次地震引发的海啸也波及到了中国,北京时间2011年3月11日下午,在中国多地都下发了海啸蓝色预警。 如果在官方下达的海啸预警之后第...","https://cambrian-images.cdn.bcebos.com/ac36570c63ca4e57dfd584e242682106_1618070309503809.jpeg@w_100,h_100","日本最惨灾害:9.1级地震引发巨大海啸,致27593人遇难,纪录片","https://baijiahao.baidu.com/s?id=1692720518902877513&wfr=spider&for=pc"
