"results_author","results_date","results_des","results_img","results_title","results_url"
"大洋网","2020年10月22日","四川绵阳市北川县发生4.7级地震 中国地震台网正式测定:10月22日11时03分在四川绵阳市北川县(北纬31.83度,东经104.18度)发生4.7级地震,震源深度20千米。","https://dss1.bdstatic.com/6OF1bjeh1BF3odCf/it/u=594623075,3999246504&fm=217&app=92&size=f242,162&n=0&g=0n&f=JPEG?s=4DA43C7241136067107910CA000070B2&sec=1618986435&t=4f3c2b4550c7ef14a55a21ae637b3dcf","四川绵阳市北川县发生4.7级地震","https://news.dayoo.com/society/202010/22/140000_53616076.htm?from=groupmessage"
"中国政府网","2019年5月8日","新华社北京5月8日电(记者 刘诗平)记者8日从水利部了解到,山洪灾害依然是我国汛期造成人员伤亡的主要灾种,水利部近日专题部署2019年山洪灾害防御工作,要求各地从强化监测预警等八个方面做好今年的山洪灾害防御。 水利部副部长叶建春在近日...","NoPicture","水利部:八方面做好2019年山洪灾害防御","http://www.gov.cn/xinwen/2019-05/08/content_5389688.htm"
"广元市人民政府","2019年4月30日","各地对已排查出的地质灾害隐患点,要开展全面深入的调查,按照群测群防体系结构落实地质灾害防治责任单位与责任人,明确各地质灾害隐患点的监测责任单位与责任人,发放防灾工作明白卡。 广元市群测群防体系结构:  (四)加强宣传培训和应急演练...","https://dss2.bdstatic.com/6Ot1bjeh1BF3odCf/it/u=972986656,1452447128&fm=217&app=92&size=f242,162&n=0&g=0n&f=PNG?s=4B243B625DB6B5AB4335550A0300A091&sec=1618986438&t=9c702374c95bc82a131493f335502404","广元市人民政府办公室关于印发《广元市2019年度地质灾害防治方案...","http://www.cngy.gov.cn/govop/show/20190430164702-24450-00-000.html"
"中国气象局","2019年4月29日","中国气象报记者谢盼报道 近日,由河北冀云气象技术服务有限责任公司自主研发的“城市气象灾害智能监测站”入选中国气象局《2019年度省级观测装备与保障技术成果推广目录》。这项在观测装备方面取得的新技术成果,具有推广价值。 “城市气象灾害...","NoPicture","“城市气象灾害智能监测站”将在全国推广","http://www.cma.gov.cn/2011xwzx/2011xqxkj/2011xkjdt/201904/t20190429_523410.html"
"湖北省人民政府门户网站","2019年4月27日","4月26日,副省长万勇主持召开全省水旱灾害防御工作视频会议,强调要提前谋划、积极防范,全力打好水旱灾害防御攻坚战。 万勇指出,水旱灾害防御事关百姓民生,事关社会稳定,事关发展大局。根据气象部门预测分析,今年我省气候情况总体偏差,水旱...","NoPicture","万勇要求全力打好水旱灾害防御攻坚战","http://www.hubei.gov.cn/zwgk/hbyw/hbywqb/201904/t20190427_1390998.shtml"
"中国政府网","2019年4月25日","王勇指出,我国面临的自然灾害形势复杂严峻,做好应急管理和自然灾害防治工作责任重大。要认真落实党中央、国务院决策部署,按照“两个坚持、三个转变”的总体要求,加强组织领导,狠抓责任落实,强化协调联动,深化改革创新,加快构建中国特色高效...","NoPicture","王勇:全面加强自然灾害防治工作 防范化解重大自然灾害风险","http://www.gov.cn/guowuyuan/2019-04/25/content_5386346.htm"
"中国政府网","2019年4月21日","本期培训是地方应急管理厅(局)挂牌成立后应急管理部组织的第一期全国灾害信息员师资培训,来自浙江、福建、湖北、湖南、广东、广西、海南、重庆、贵州、陕西10个省(区、市)共200名学员参训。培训班由应急管理部救灾和物资保障司主办,国家...","NoPicture","应急管理部2019年全国灾害信息员师资培训班举行","http://www.gov.cn/xinwen/2019-04/21/content_5384895.htm"
"中国新闻网","2019年4月19日","巴黎警方对这场灾难调查的初步结论为非人为火灾,排除了纵火及与恐怖主义相关的可能动机。与巴黎圣母院大火造成的“不幸中的万幸”般的结果相比,去年巴西国家博物馆发生的火灾,就远没有这么“温和”了。","https://dss2.bdstatic.com/6Ot1bjeh1BF3odCf/it/u=2644733150,4064881801&fm=217&app=92&size=f242,162&n=0&g=0n&f=JPEG?s=9030E83742367F8C4CA9ECC60300E020&sec=1618986438&t=287fa9a2d2ae908165252ec32f9c0d3e","天灾、意外、人为、战乱 珍贵文物古迹面临太多灾难","https://www.chinanews.com/gn/2019/04-19/8813626.shtml"
"中国气象局","2019年4月10日","中国气象报通讯员陈城 记者李傲报道 近期,湖北省气象局与长江航务管理局联合完成长江航道湖北段自动气象站选址工作。据悉,双方将在长江航道重点港口、事故多发地段和灾害性天气频发区域共17个站址布设自动气象观测站,进一步提高长江航道...","NoPicture","长江航道灾害多发区将新设17个观测站","http://www.cma.gov.cn/2011xwzx/2011xqxxw/2011xqxyw/201904/t20190410_520023.html"
"中国政府网","2019年4月9日","党的十九大报告中明确提出要“加强地质灾害防治”。2018年10月,习近平总书记主持召开中央财经委员会第三次会议,专门研究提高我国自然灾害防治能力问题,提出加强自然灾害防治关系国计民生,建立高效科学的自然灾害防治体系,提高全社会自然灾害防...","NoPicture","自然资源部办公厅关于做好2019年地质灾害防治工作的通知","http://www.gov.cn/xinwen/2019-04/09/content_5380947.htm"
"中国政府网","2019年4月9日","国务院同意建立由应急部、发展改革委、财政部共同牵头的自然灾害防治工作部际联席会议制度。联席会议不刻制印章,不正式行文,请按照国务院有关文件精神认真组织开展工作。 附件:自然灾害防治工作部际联席会议制度 国务院办公厅  2019年3月29日...","NoPicture","国务院办公厅关于同意建立自然灾害防治工作部际联席会议制度的函","http://www.gov.cn/zhengce/content/2019-04/09/content_5380703.htm"
"广州日报","2020年1月6日","广州日报讯 (全媒体记者陈治家)据中国地震台网正式测定,昨日6时55分在珠海市万山海域发生3.5级地震,震源深度12千米,震中位于北纬22.07度,东经113.85度,距海岸线最近约30公里。地震发生后,珠海未收到人员伤亡和衍生的次生灾害发生报告...","https://cambrian-images.cdn.bcebos.com/5242633ac0491ede9e92dbdab955042c_1574612761312138.jpeg@w_100,h_100","昨晨珠海发生3.5级地震","https://baijiahao.baidu.com/s?id=1654920303996478087&wfr=spider&for=pc"
"信息时报","2020年1月6日","据中国地震台网正式测定:1月5日6时55分,在珠海市香洲区海域发生3.5级地震,震源深度12千米,震中位于北纬22.07度,东经113.85度,距海岸线最近约30公里。附近村镇:本次地震周边10公里内的村庄有竹洲头、南排、桂海村、大沙坪、地龙...","https://dss0.bdstatic.com/6Ox1bjeh1BF3odCf/it/u=102569065,3777054894&fm=173&app=49&size=f242,162&n=0&g=0n&f=JPEG?s=0E4AFF174983F8435E6CC1430300B0F3&sec=1618986440&t=5cb33ea71293cec6daedb890f3716553","今早珠海发生3.5级地震,广州深圳震感明显","https://baijiahao.baidu.com/s?id=1654918097923182834&wfr=spider&for=pc"
"腾讯网","2020年1月5日","据广东省地震台网正式测定,1月5日6时55分,珠海市香洲区海域(北纬22.07°,东经113.85°)发生3.5级地震,震源深度12.0公里。截至8时,发生余震2次,最大震级2.1级。 据了解,珠海、深圳、广州、东莞等地区及香港、澳门特别行政区部...","https://dss1.bdstatic.com/6OF1bjeh1BF3odCf/it/u=4180493120,2797441198&fm=217&app=92&size=f242,162&n=0&g=0n&f=JPEG?s=7422BC1F16F84D88486D84DB0300D032&sec=1618986440&t=923fc03d8ecd228a386bf4e981f87ae5","珠海刚刚3.5级地震,广州人这次真的被震到了!","https://xw.qq.com/cmsid/20200105A07BKD00"
"国际在线","2020年1月5日","据中国地震台网消息,1月5日6时55分,广东省珠海市香洲区海域发生3.5级地震,震源深度12千米,震中位于北纬22.07度,东经113.85度,距海岸线最近约30公里。震中距香港离岛区26公里,距珠海市区36公里,距广州市区132公里。据香港媒体报道,...","https://dss2.bdstatic.com/6Ot1bjeh1BF3odCf/it/u=209714744,3211895026&fm=173&app=49&size=f242,162&n=0&g=0n&f=JPEG?s=A350CB3009CA64495CEE58D20300C0A8&sec=1618986440&t=7df288a0a5d7fa16f280502e76209d71","广东珠海香洲区海域发生3.5级地震 震源深度12千米","https://baijiahao.baidu.com/s?id=1654851001707692751&wfr=spider&for=pc"
"手机凤凰网","2019年12月19日","近日,居住在广州黄埔区的杨先生报料,家中的瓷砖地板无缘无故突然爆裂,当时他以为发生地震了。不仅地板,墙壁上也出现不少裂纹。其怀疑是楼下二十米不到的施工工地导致的,施工方","https://dss0.bdstatic.com/6Ox1bjeh1BF3odCf/it/u=206563422,4227381078&fm=217&app=92&size=f242,162&n=0&g=0n&f=JPG?s=0511559710FA479ED4143C220300E040&sec=1618986440&t=995d1cfd8760e325b41e9a26400d1edc","广州一住宅地板突然爆裂,业主以为地震,证实与地下施工无关","https://news.ifeng.com/c/7sXV5MRd0hb"
"FM974珠江经济台","2019年10月14日","据中国地震台网测定,北京时间2019年10月12日22点55分24秒,在广西玉林市北流市发生5.2级地震,震源深度10千米。震中周边县城包括广东高州市、广东信宜市、广东化州市等,距广东高州市46公里、距广东信宜市49公里、距广东化州市59公里。","https://dss0.bdstatic.com/6Ox1bjeh1BF3odCf/it/u=3567355117,512993649&fm=173&app=49&size=f242,162&n=0&g=0n&f=JPEG?s=AF6AE7164B936C431A4D85DB0300B033&sec=1618986440&t=6d895f33664070167b18e68a2f068dcb","广东:50年来地震5.8万次,八成2级以下,这个地方最易……","https://baijiahao.baidu.com/s?id=1647329643245104035&wfr=spider&for=pc"
"腾讯网","2019年10月13日","据广州市地震监测中心正式测定:2019年10月12日22时55分,广西玉林市北流市(北纬22.20度,东经110.50度)发生5.2级地震,震源深度10千米,震中到广州市最近边界距离约为287千米。 此次地震广西及广东多地震感明显。据报告,我市普遍有感...","NoPicture","广西玉林地震,广州多地有感","https://new.qq.com/omn/20191013/20191013A072HI00.html"
"手机凤凰网","2019年10月13日","玉林5.2级地震,南宁广州等多地有震感 2019-10-13 00:11:3200:315.7万新浪微博 QQ QQ空间 微信展开 下载客户端 4 10351 相关新闻 社会新闻 玉林5.2级地震,南宁广州等多地有震感 太飒了!66岁奶奶白天摆摊炸臭豆腐 夜里在酒吧...","https://dss0.bdstatic.com/6Ox1bjeh1BF3odCf/it/u=2767558583,4269121250&fm=217&app=92&size=f242,162&n=0&g=0n&f=JPEG?s=333278CEC6ADAD4D4838301B030090C1&sec=1618986440&t=a1db37d0b24dea73674e28be23ae9385","玉林5.2级地震,南宁广州等多地有震感","https://news.ifeng.com/c/7qipuKUBkb6"
"澎湃新闻","2019年10月12日","国家地震台网官方微博消息,10月12日22时55分在广西玉林市北流市附近发生5.2级地震。南宁,广州等地网友表示有震感。多地大学生撤离宿舍跑到操场。2019-10-12 23:30 来源:澎湃新闻 502  2902 收藏 跟踪: 玉林5.2级地震 澎湃新闻...","NoPicture","玉林5.2级地震,南宁广州等多地有震感","http://www.thepaper.cn/newsDetail_forward_4658767"
"搜狐网","2019年9月23日","9月21日,有记者从广州市应急管理部门获悉,广州市地震局处置一起动物宏观观测异常报告。 21日8时许,广州市地震局位于广州大学矿泉水厂(广州市天河区龙洞渔沙坦渔东路150号)的地震宏观观测群测群防点报告出现异常,监测人员称水厂区域内部...","https://dss1.bdstatic.com/6OF1bjeh1BF3odCf/it/u=1405396655,169170157&fm=217&app=92&size=f242,162&n=0&g=0n&f=JPEG?s=208B9255050931451EB1D0110300F0C1&sec=1618986440&t=fdb2908c648f3ea2aff68066bd814adf","地震前兆?一地震观测点报告异常,惊现大量蚯蚓聚集","https://www.sohu.com/a/342740081_120207034"
"环京津网","2019年9月22日","21日,记者从广州市应急管理部门获悉,广州市地震局处置一起动物宏观观测异常报告。21日8时许,市地震局位于广州大学矿泉水厂(广州市天河区龙洞渔沙坦渔东路150号)的地震宏观观测群测群防点报告出现异常,监测人员称水厂区域内部分地区的水泥...","https://dss0.bdstatic.com/6Ox1bjeh1BF3odCf/it/u=4088177593,213857214&fm=173&app=49&size=f242,162&n=0&g=0n&f=JPEG?s=11931DD554800557D109E10A030060D1&sec=1618986441&t=28577b448b9d33e4bb595c04c18c3707","广州有地区蚯蚓大量聚集是地震前兆?别慌!天气惹的祸","https://baijiahao.baidu.com/s?id=1645353579642129286&wfr=spider&for=pc"
"广州日报","2019年9月6日","不要小瞧这两个大水箱,它们能够让广州塔扛得住 12 级台风和 8 级地震。太极鱼的学名叫调谐质量阻尼器,是广州塔减振控制系统的重要部分。 它们总重 1500 吨,相当于5架波音747飞机的重量。太极鱼是活的。下面有轨道和滑轮,可沿着...","https://dss0.bdstatic.com/6Ox1bjeh1BF3odCf/it/u=3501941908,2706831894&fm=173&app=49&size=f242,162&n=0&g=0n&f=JPEG?s=96B150844ED15A5F70165CD10300C0A8&sec=1618986441&t=10c6e69ff052055d2f40a5c01e29ad27","每天跟着太阳动、能感知地震……广州塔不为人知的秘密你知道吗?","https://baijiahao.baidu.com/s?id=1643894717589737465&wfr=spider&for=pc"
"搜狐网","2019年8月22日","《东莞市市区震害预测与防御对策系统》预测结果表明,若在市区发生5.5级地震,会造成数百人死亡,几千人重伤,近40%建(构)筑物破坏,经济总损失预计达百亿元。可见,一旦在我市发生中强以上地震,将会造成严重的人员伤亡和重大的经济损失。","https://dss2.bdstatic.com/6Ot1bjeh1BF3odCf/it/u=1505835381,2898145009&fm=217&app=92&size=f242,162&n=0&g=0n&f=JPEG?s=4418CC3A514EF4EC5A5519DB0100D0B2&sec=1618986441&t=b80afb5f183250f360d4986590c7f88d","地震刚过,又来台风!类似天鸽,东莞未来天气...","https://www.sohu.com/a/335629565_526165"
"搜狐网","2019年8月21日","经南都记者核实,没错,确实是地震了。 据广东省地震局测定:2019年8月21日 0时29分53秒,广州市增城区(东经113.662度,北纬23.197度)发生2.5级地震,震源深度12.79千米 。 震中市民介绍,地震时楼晃得比较厉害,但时间非常短暂。 ","https://dss2.bdstatic.com/6Ot1bjeh1BF3odCf/it/u=2474040552,3536040615&fm=217&app=92&size=f242,162&n=0&g=0n&f=JPEG?s=CC12E5130F087D41487C01DB0100C0B3&sec=1618986441&t=5958a07b7b3dddca40de264956929438","今日凌晨,广州迎来今年第五次地震,震源深度12.79千米...","https://www.sohu.com/a/335554550_755034"
"中国经济网","2019年8月21日","羊城晚报讯记者张爱丽报道:据广州市地震台网正式测定,8月21日0时29分,广州市增城区(东经113.666度,北纬23.199度)发生2.5级地震,震源深度5.7千米。这是今年以来广州的“第五震”。据了解,今年4月24日,广州市增城区发生过一次2....","https://cambrian-images.cdn.bcebos.com/c5c1384860afa87429e74c8603a2e053_1568513751477809.jpeg@w_100,h_100","增城 今天凌晨 发生2.5级地震","https://baijiahao.baidu.com/s?id=1642473279860198786&wfr=spider&for=pc"
"搜狐网","2019年8月21日","于是三更半夜朋友圈突然“热闹”起来,很多街坊都在发朋友圈,发信息给亲戚朋友问“增城是不是发生地震了?”。 究竟是不是发生地震呢?广州市地震局迅速发布相关速报信息!原来真的是发生了地震!具体速报情况如下。 ","https://dss2.bdstatic.com/6Ot1bjeh1BF3odCf/it/u=2011511826,3728769631&fm=217&app=92&size=f242,162&n=0&g=0n&f=JPEG?s=7B574C9E30E9090D2887ADCC030030BB&sec=1618986441&t=73c683cd63633e9b02d0763e0fe2a125","增城又发生2.4级地震!一个月内发生2次地震!","https://www.sohu.com/a/335544408_120052476"
"搜狐网","2019年8月21日","据@中国地震台网速报 消息: 中国地震台网正式测定:今日凌晨0时29分52秒,广东省广州市增城区发生了一次地震,计算机自动测定震级为2.8级,由于不到3.0级我们这里就没有自动发布。据网友反馈,此次地震造成当地震感明显。 ","NoPicture","昨晚凌晨,广州又地震了!这是今年第五次","https://www.sohu.com/a/335359154_261545"
"信息时报","2019年8月21日","有嘢到莫乱停,临时泊位停车有规范省内ETC车道年底将超7000条新版国家医保药品目录发布未来几天广州天气炎热据中国地震台网测定,北京时间2019年8月21日0时29分53秒在广东广州市增城区(北纬23.2度,东经113.67度)发生2.4级地震,震源...","https://dss0.bdstatic.com/6Ox1bjeh1BF3odCf/it/u=1294011307,3349991100&fm=173&app=49&size=f242,162&n=0&g=0n&f=JPEG?s=B5726137499348431A5CE4D60300E0B1&sec=1618986441&t=7690207f778f105ed0289e7a63658d00","又震了!广州增城凌晨发生2.4级地震,你感觉到了吗?","https://baijiahao.baidu.com/s?id=1642457268255902911&wfr=spider&for=pc"
"腾讯网","2019年8月21日","南都讯 记者董晓妍 21日凌晨广州增城发生了本月内的第二次地震。早前广州市地震信息网发布速报为2.4级(查看此前报道),后经修正,广东省地震局测定:2019年8月21日0时29分53秒,广州市增城区(东经113.662度,北纬23.197度)发生2.5级...","https://dss0.bdstatic.com/6Ox1bjeh1BF3odCf/it/u=1829711303,2351935562&fm=217&app=92&size=f242,162&n=0&g=0n&f=JPEG?s=A572E137418BD14D1055E4D2030060B3&sec=1618986441&t=a97d290f9d16252f296d9d7decae1dba","广州今年已发生8次地震,5次在增城!地震专家详解四大疑问","https://new.qq.com/omn/20190821/20190821A0AU8D00.html"
"搜狐网","2019年8月21日","广东地震台网测定:2019年8月21日0时29分,广州市增城区(东经113.666度,北纬23.199度)发生2.5级地震,震源深度5.7千米。 本次地震对广州的影响集中在增城区内,现场附近居民报告有轻微震感,百湖村居民反映地震时听到声响,玻璃窗有小幅...","NoPicture","又地震了!广州增城发生2.5级地震 多地震感较明显","https://www.sohu.com/a/335301611_132336"
"中国政府网","2018年9月25日","我国是世界上地震灾害最严重的国家之一,具有地震多、分布广、强度大、灾害重等特点。本世纪以来,全球大陆共发生3次8级以上地震,其中2次发生在我国。未来,一些地区和城市群,仍存在7级以上潜在地震威胁和发生中强地震的可能。 当地震...","https://dss1.bdstatic.com/6OF1bjeh1BF3odCf/it/u=3272398243,2590052937&fm=217&app=92&size=f242,162&n=0&g=0n&f=JPEG?s=5943CC10506070AFC73C14C00300B0A2&sec=1618986442&t=9b59952baab9e9a84c69fef5ff66af9b","以防为主,抵御地震灾害风险","http://www.gov.cn/xinwen/2018-09/25/content_5325043.htm"
"中国政府网","2018年7月21日","为有效防范和妥善应对暴雨洪涝、泥石流等自然灾害次生的突发环境事件,生态环境部近日发函,要求各地进一步强化责任意识和底线思维,把环境安全保障工作摆到突出位置,始终保持高度警觉,加强环境风险管控,强化核与辐射安全监管,严格落实责任措施,...","NoPicture","...进一步加强当前环境安全保障工作 有效防范和妥善应对自然灾害...","http://www.gov.cn/xinwen/2018-07/21/content_5308213.htm"
"中国政府网","2018年7月21日","7月20日,自然资源部召开2018年全国汛期地质灾害防治工作紧急视频会议,传达近期中央关于防汛抢险救灾工作的重要批示,总结上半年地质灾害防治工作情况,对汛期地质灾害工作提出新要求。会议强调,各级自然资源主管部门务必要充分认识当前地质灾害防治...","NoPicture","自然资源部召开全国汛期地质灾害防治紧急视频会议","http://www.gov.cn/xinwen/2018-07/21/content_5308204.htm"
"四川省人民政府","2018年7月19日","其中,将重点排查主汛期以来强降雨地区的地质灾害隐患,不放过一个疑点、不错过一个盲点、不留下一片空白区。这是记者7月18日从省地质灾害应急指挥部获悉的。 省地质灾害应急指挥部相关负责人介绍,这是我省首次在一年汛期内开展两轮大...","NoPicture","7月20日至9月30日全省开展地质灾害隐患再排查","http://www.sc.gov.cn/10462/10464/10797/2018/7/19/10455371.shtml"
"中国气象局","2018年7月17日","台风灾害主要是在台风登陆前和登陆之后引起的。台风引起的直接灾害通常由三方面造成: 一是狂风。台风风速大都在17米/秒以上,甚至在60米/秒以上。据测,当风力达到12级时,垂直于风向平面上每平方米风压可达230公斤。因此台风大风及其引起...","NoPicture","台风会带来哪些灾害?","http://www.cma.gov.cn/2011xzt/kpbd/typhoon/2018050902/201807/t20180717_473583.html"
"中国政府网","2018年7月17日","各省、自治区、直辖市自然资源主管部门,中国地质调查局,部地质灾害应急技术指导中心: 今年入汛以来,湖南、四川、甘肃等地已经历强降雨过程,引发地质灾害,造成人员伤亡。党中央、国务院领导就此作出多次重要批示。当前,正值机构改革关键时期,...","NoPicture","自然资源部关于进一步加强汛期地质灾害防治工作检查与督导的通知","http://www.gov.cn/xinwen/2018-07/17/content_5307065.htm"
"中国政府网","2018年7月8日","要求各级气象部门认真学习领会中央领导同志关于防灾减灾救灾工作的重要指示精神,切实把思想和行动统一到党中央、国务院的部署和要求上来,切实发挥气象工作作为防灾减灾救灾“第一道防线”的重要作用,进一步做好灾害性天气监测预报预警服务工作。","NoPicture","要求进一步做好灾害性天气监测预报预警服务工作","http://www.gov.cn/xinwen/2018-07/08/content_5304641.htm"
"中国气象局","2018年5月19日","自然资源部与中国气象局5月19日18时联合发布地质灾害气象风险预警: 预计,5月19日20时至5月20日20时,湖南西北部、江西东北部等地的局部地区发生地质灾害的气象风险较高。请当地居民注意防范强降水引发的地质灾害,尤其是地质灾害隐患点...","https://dss0.bdstatic.com/6Ox1bjeh1BF3odCf/it/u=3356052654,4084482499&fm=217&app=92&size=f242,162&n=0&g=0n&f=JPEG?s=382E7432597EF4CE52E9D4C2030070B1&sec=1618986442&t=f7a476b4c3a3651f17fb147c1b5550a8","地质灾害气象风险预警","http://www.cma.gov.cn/2011zwxx/2011zyjgl/2011zyjxy/2011zqxyj/201805/t20180519_468751.html"
"中国气象局","2018年8月16日","网友来信:如何获取全国气象灾害数据 请问我如何获取近十年(2007-2017)来的全国气象灾害的统计数据呢? 回复:您好,国家气候中心每年有正式出版《中国气象灾害年鉴》(气象出版社),可联系气象出版社购买,或在相关图书馆查询。","NoPicture","如何获取全国气象灾害数据","http://www.cma.gov.cn/2011wmhd/2011wgzly/cjwt/201805/t20180516_468461.html"
"延安市人民政府","2018年5月16日","干旱灾害分为:轻度干旱(Ⅳ级)、中度干旱(Ⅲ级)、严重干旱(Ⅱ级)和特大干旱(Ⅰ级)四个等级。 (1)全县或区域内大面积连续25天以上无有效降雨;30天降水量比多年平均值减少75%,或者60天降水量比多年平均值减少40%,或者90天降水...","NoPicture","延川县人民政府办公室关于印发《延川县防抗干旱灾害应急预案》的...","http://www.yanan.gov.cn/gk/ggfw/yjgl/yjjg/328948.htm"
"南方新闻网","2019年8月6日","8月6日上午10时49分,广东广州市增城区(北纬23.19度,东经113.66度)发生2.7级地震,震源深度13千米。广州多位市民、网友反映有明显震感,东莞部分镇街也有震感,地震未造成人员伤亡和财产损失。记者从广东省地震局了解到,目前没有证据...","https://dss1.bdstatic.com/6OF1bjeh1BF3odCf/it/u=1469630844,3314989067&fm=173&app=25&size=f242,162&n=0&g=0n&f=JPEG?s=AECCFE1659C3D0471851AC7C03005073&sec=1618986444&t=3a1d101a1783de400448fb972d5ceb82","广州增城时隔3个月再地震,专家权威回应:未来不会发生大地震","https://baijiahao.baidu.com/s?id=1641112444488083882&wfr=spider&for=pc"
"南方新闻网","2019年8月6日","今天上午广州东莞发生地震啦,你感觉到了吗?据中国地震台网消息:08月06日10时49分在广东广州市增城区(北纬23.19度,东经113.66度)发生2.7级地震,震源深度13千米。有广州网友在社交网络留言称,有微弱震感,“刚刚似乎震了一下。”同时...","https://dss0.bdstatic.com/6Ox1bjeh1BF3odCf/it/u=2921176291,4044842148&fm=173&app=49&size=f242,162&n=0&g=0n&f=JPEG?s=01547AD94EE2C04558B47208030070D4&sec=1618986444&t=dad40e9a085a2489f99f0185b24af885","「晚高峰新闻」今天上午广州、东莞发生地震啦,你感觉到了吗?","https://baijiahao.baidu.com/s?id=1641109658825260173&wfr=spider&for=pc"
"佛山电视台","2019年8月6日","网络上,佛山网友也在热议↓↓↓不过更多佛山网友的感觉是佛山的小伙伴:雨你无瓜官方确认,地震发生在广州增城2.7级地震,震源深度13千米继从化之后,这是广州今年迎来第二震,震的强度很小,大部分人都只是抖了一下,这可把网友激动坏了,...","https://dss0.bdstatic.com/6Ox1bjeh1BF3odCf/it/u=2989912,846614974&fm=173&app=49&size=f242,162&n=0&g=0n&f=JPEG?s=E750E53B4F4A6C4910EDCDDC030080B3&sec=1618986444&t=7559fe2d6bc80266e0c285b69c5842e7","增城地震,有佛山人称感觉到了!佛山曾发生过30余次有感地震","https://baijiahao.baidu.com/s?id=1641106669996206543&wfr=spider&for=pc"
