"results_author","results_date","results_des","results_img","results_title","results_url"
"海南省人民政府网","None","根据气象干旱监测,截至4月20日,东方、澄迈为重度气象干旱,屯昌、临高和海口为中旱,昌江和文昌为轻旱,其余市县处于无气象干旱状态。省三防办要求,要加强监测预警预报,气象部门及时发布气象干旱情况,根据实际需要,开展人工增雨作业。水务部...","NoPicture","省三防办要求各市县上报旱情和抗旱信息","http://www.hainan.gov.cn/hainan/tingju/201904/0c1649269fa54f63adcd533877d79e98.shtml"
"中国气象局","2019年4月15日","中国气象报通讯员陈慧华报道 近日,广东省气候中心牵头完成的项目成果“干旱动态监测预警评估关键技术及应用示范”荣获2018年度广东省科学技术进步奖二等奖。 “干旱动态监测预警评估关键技术及应用示范”项目成果是项目首席王春林研究员带领广东...","NoPicture","广东省局干旱研究获省科技进步二等奖","http://www.cma.gov.cn/2011xwzx/2011xqxkj/2011xkjdt/201904/t20190415_520496.html"
"中国气象局","2019年4月9日","南方强对流活跃 北方春雨缓解干旱【字体:大中小】 打印本页 分享: 发布时间:2019年04月09日08:42 来源:中央气象台 昨天夜间到今晨,降水云系发展迅速,自西向东覆盖我国中东部地区。气象监测显示,山西南部、河南中南部、安徽北部、湖北...","https://dss1.bdstatic.com/6OF1bjeh1BF3odCf/it/u=1369198939,2532192858&fm=217&app=92&size=f242,162&n=0&g=0n&f=JPEG?s=EFD0C812195A70CE5AD09D43030060F1&sec=1618986891&t=ce89e0e058d917db0aa5e0e4df67ad2f","南方强对流活跃 北方春雨缓解干旱","http://www.cma.gov.cn/2011xwzx/2011xqxxw/2011xzytq/201904/t20190409_519913.html"
"常德发布","4天前","1959年至1961年,常德地区遭受了严重的自然灾害,三年中,水、旱、虫、风灾相继发生。1959年6月,临澧、石门两县连降暴雨,导致山洪暴发。1961年,全地区蝗虫和螟虫危害面积达122.7万亩。专署一方面发动群众人工治虫,另一方面请求上级派出飞...","https://cambrian-images.cdn.bcebos.com/f4cd36100490c05a3a5a541d90e3a2da_1599491838730970.jpeg@w_100,h_100","【党史上的常德】应对三年自然灾害","https://baijiahao.baidu.com/s?id=1697167716280428506&wfr=spider&for=pc"
"星沙时报","4天前","地质灾害防治是“生命工程”。但由于当前雨水天气增多,降雨集中,因降雨引发的地质灾害风险较大。特别是一些地方切坡建房修路、蓄水造库、城市开发等工程活动更容易诱发地质灾害。 为此,长沙县自然资源局将切实加强领导、全面落实防灾责任,扎...","https://cambrian-images.cdn.bcebos.com/f8de7f5f32453ffd155a4e3a831b4bcd_1629767261579929.jpeg@w_100,h_100","地质灾害猛如虎 预防知识要牢记","https://baijiahao.baidu.com/s?id=1697161662935146806&wfr=spider&for=pc"
"邯郸之窗","4天前","地质灾害治理公司 客土喷播,高速边坡绿化应在考虑气候、土壤、立地类型的基础上,优先选择耐干旱、耐瘠薄、抗污染、观赏性强的树种及草坪地被植物,既能适应当地土地条件,又能满足绿化的要求,达到功能、艺术、科学的统一。边坡绿化工程中应...","https://dss0.bdstatic.com/6Ox1bjeh1BF3odCf/it/u=3604117119,2529230773&fm=217&app=2&size=f242,162&n=0&g=0n&f=JPEG?s=3199C831DD027B4F42B170CA0300D0A5&sec=1618986893&t=10f3eb4b98f0908031d94d63f4272fa4","地质灾害治理公司","http://www.hdzc.net/qyxw/47130647.html"
"腾讯网","4天前","全国自然灾害综合风险普查是一项重大的国情国力调查,是提升自然灾害防治能力的基础性工作。市委、市政府高度重视第一次全国自然灾害综合普查。市委书记刘继标作出了重要批示,市政府常务会议专题听取了普查工作汇报,成立了以市委常委、常务副市长...","NoPicture","周口市自然灾害综合风险普查工作顺利开展","http://new.qq.com/omn/ENT20190/20210416A08CXJ00.html"
"九派云旅","4天前","郊区农业农村局在乡村两级领导干部微信群和农村网格员微信群连续2天多频次发布气象预警和技术指导信息,全局农业技术人员深入乡镇村屯指导农民积极有效应对低温冷害,并提出一系列切实可行的措施,做到早发动、早预防,最大限度地降低雨雪灾害对...","https://cambrian-images.cdn.bcebos.com/32f18f599ffb716bb3a02cb75516f3e7_1692285652438042.jpeg@w_100,h_100","及时发布气象预警大力降低灾害影响","https://baijiahao.baidu.com/s?id=1697160786654536466&wfr=spider&for=pc"
"SZNEWS","4天前","见圳客户端•深圳新闻网2021年4月16日讯(深圳晚报记者 林咪玲)日前,深圳市气象灾害应急指挥部正式印发《深圳市气象灾害应急预案》。记者了解到,该《预案》是在2018年版的《深圳市气象灾害应急预案》进行修改完善的,对各类气象灾害预警...","NoPicture","《深圳市气象灾害应急预案》发布 明确将气象灾害预警信号的预警...","http://www.sznews.com/news/content/mb/2021-04/16/content_24135095.htm"
"网易新闻","4天前","南方+早班车 广东入汛!这些灾害风险要重点防范2021-04-16 08:05 新知资讯 · 广东省防总宣布全省进入汛期 · 广州严惩房地产乱象 · 广佛肇高速广州石井至肇庆大旺段延缓通车 · 新冠肺炎诊疗方案修订 · 渤海部分海域今天起执行军事...","NoPicture","南方+早班车 广东入汛!这些灾害风险要重点防范","http://dy.163.com/article/G7MKA8CH0534J2WY.html"
"东莞阳光网","4天前","4月15日,东莞全市应急管理系统第二季度工作例会召开。记者了解到,第一季度全市安全生产形势保持了总体平稳,没有发生重大以上生产安全事故,三防领域、森林防灭火领域保持零伤亡,危险化学品生产经营领域零事故。第二季度历来是事故灾害多发频...","https://dss2.bdstatic.com/6Ot1bjeh1BF3odCf/it/u=4227600397,2864038153&fm=217&app=2&size=f242,162&n=0&g=0n&f=JPEG?s=C010579C16EB4D0904FA7DE40300703A&sec=1618986893&t=4aa8af3373835d0961f97b7ef49639dc","东莞全力压减一般事故!第二季度历来是事故灾害多发频发期","http://news.sun0769.com/dg/headnews/202104/t20210416_16169797.shtml"
"蚌埠市人民政府","4天前","该活动充分调动了社区居民群众的参与热情,进一步强化了防灾减灾意识,提高了地震灾害的应急能力,有利于居民群众“防范化解灾害风险 筑牢安全发展的基础”,协力打造平安、幸福社区。 扫一扫在手机打开当前页 加入...","NoPicture","固镇县应急局开展“学党史、办实事”防震减灾知识进社区活动_蚌埠...","http://www.bengbu.gov.cn/public/25851/48261171.html"
"网易","5天前","该厅救灾和物资保障处处长张亚龙说:“灾害信息员是灾害预警、信息传递的‘最后一公里’,是确保灾情信息及时准确上报的关键力量。灾害信息员的专业化程度影响着各级政府对灾情掌控的准确性和灾害救助的时效性。”为保证市、县应急管理系统...","NoPicture","近3万名灾害信息员 提升报灾能力 看这里如何打通“最后一公里”","https://www.163.com/dy/article/G7LLO7NR0534J2WR.html"
"蚌埠市人民政府","4天前","该活动充分调动了社区居民群众的参与热情,进一步强化了防灾减灾意识,提高了地震灾害的应急能力,有利于居民群众“防范化解灾害风险 筑牢安全发展的基础”,协力打造平安、幸福社区。 扫一扫在手机打开当前页 加入...","NoPicture","固镇县应急局开展“学党史、办实事”防震减灾知识进社区活动_蚌埠...","http://www.bengbu.gov.cn/public/25851/48261171.html"
"网易","5天前","该厅救灾和物资保障处处长张亚龙说:“灾害信息员是灾害预警、信息传递的‘最后一公里’,是确保灾情信息及时准确上报的关键力量。灾害信息员的专业化程度影响着各级政府对灾情掌控的准确性和灾害救助的时效性。”为保证市、县应急管理系统...","NoPicture","近3万名灾害信息员 提升报灾能力 看这里如何打通“最后一公里”","https://www.163.com/dy/article/G7LLO7NR0534J2WR.html"
"网易","5天前","地质灾害主要指的是自然或者人为因素作用下形成的,对人类生命产生威胁、对环境造成破坏的地质现象。地质灾害在时间和空间上的规律与自然环境和人类活动都有密切相关的联系。一般的地质灾害主要包括崩塌、泥石流、山体滑坡、地面沉降、地面塌陷...","https://dss0.bdstatic.com/6Ox1bjeh1BF3odCf/it/u=3411775840,3702381825&fm=217&app=2&size=f242,162&n=0&g=0n&f=JPEG?s=FBB0B9E000C8374B0A2B5E110300D0DC&sec=1618986895&t=b6278bd1699ed6c563c303023182f8d2","【主播说】如何预防地质灾害","https://www.163.com/dy/article/G7LLMO650524M926.html"
"网易","5天前","如果核废水被排放到海里,在全球水系统都会被核废水影响的情况下,全人类都可以说会一直处于核废水所产生的放射性元素环境里,这会给全人类都带来不可预估的灾害。 换句话说,日本将核废水排放入海里的行为,影响的很可能是全世界。 ","https://dss2.bdstatic.com/6Ot1bjeh1BF3odCf/it/u=2352225250,3574387354&fm=217&app=2&size=f242,162&n=0&g=0n&f=JPEG?s=2594759552312F9C80A0FFA703003011&sec=1618986895&t=48be131add11ed0c5d26c73c4d1a451c","可怕!日本核污水若排入大海,75亿人的灾难将会降临","https://www.163.com/dy/article/G7LL38K00534HFB9.html"
"腾讯网","5天前","热带气旋灾害总体略重于常年。 图片来源:海南省气候中心 首个影响海南省的热带气旋可能出现在4月下旬,较常年(5月上旬)偏早1旬;终台可能出现在12月上旬,较常年(11月下旬)偏晚1旬。首个影响海南岛的热带气旋可能出现在6月中旬,较...","NoPicture","今年汛期或多达10个热带气旋影响海南!可能有2个登岛","http://new.qq.com/omn/ENT20190/20210415A06DY100.html"
"澎湃新闻","5天前","为切实提高海洋灾害防范和应急处置能力,做好2021年海洋防灾减灾各项工作,根据《自然资源部海洋预警监测司关于做好2021年海洋灾害预警报应急演练工作的通知》有关工作要求,国家海洋环境预报中心于2021年4月15日组织联合有关单位开展了一次海洋...","https://dss1.bdstatic.com/6OF1bjeh1BF3odCf/it/u=2543284769,995631746&fm=217&app=2&size=f242,162&n=0&g=0n&f=JPEG?s=C982D71261D9C9E37A7260D3030080EA&sec=1618986895&t=8ff633ce9382dc6469171d2ae92a8a95","2021年海洋灾害预警报应急演练今天顺利完成","http://www.thepaper.cn/newsDetail_forward_12218049"
"趣观历史","5天前","根据现在的效果来看,有的调水工程收效良好,可以达到造福一方的目的,有的却由于在设计建造之初未能考虑周全,发展成为生态灾难。美国、中国和前苏联分别拥有世界上最规模最大的三个调水工程,根据相关资料显示,现在美国和中国的两个大工程...","https://dss2.baidu.com/6ONYsjip0QIZ8tyhnq/it/u=1459910954,140119876&fm=30&app=106&size=f242,162&n=0&g=0n&f=JPEG?s=3484D71402670F0B749075D40300C0A8&sec=1618986895&t=0f701c8ed864f0e0ce2a09d474acd181","世界三大调水工程,我国调水福泽5亿人,邻国调水为何成生态灾难","https://baijiahao.baidu.com/s?id=1697093761105393987&wfr=spider&for=pc"
"网易","5天前","天灾人祸虽可减轻却不可能完全避免,各种自然灾害与突发事故仍然层出不穷,给人民生命财产安全造成巨大威胁,如果没有完善的国家应急管理体系,就可能陷入被动应对,甚至导致损失扩大。因此,“十四五”时期,伴随着全面建设社会主义现代化国家新征程...","NoPicture","大家谈 完善国家应急管理体系难点在哪?从哪儿入手?","https://www.163.com/dy/article/G7L3G3GK0534J2WR.html"
"腾讯网","5天前","今年影响我省的灾害性海浪可能接近常年或偏多,可能出现1—2次较严重的灾害性海浪过程,主要影响时间集中在7—9月份。影响我省的风暴潮过程较常年或偏多,需要重点关注珠江口至粤西岸段。 4月15日早上10时许,清远已下起了大雨。南方日...","https://dss0.bdstatic.com/6Ox1bjeh1BF3odCf/it/u=3308539530,2660563870&fm=217&app=2&size=f242,162&n=0&g=0n&f=JPEG?s=F780F901C4BB022F2028EDE30100E0B2&sec=1618986895&t=d6c75a91e0678dd52dc80f18a923491f","广东进入汛期,这些灾害风险要重点防范!","https://new.qq.com/omn/20210415/20210415A0C67500.html"
"北京交通广播","5天前","4月14日,北京还是风和日丽,蓝天“营业”,最高气温明显回升,午后南郊观象台最高气温达到22.5℃。 但据中国天气网消息,北京市气象局4月15日8时启动重大气象灾害(大风)Ⅳ级应急响应。北京市气象台预计,今天白天多云转沙尘,下午有分散性...","https://dss2.baidu.com/6ONYsjip0QIZ8tyhnq/it/u=1015550025,140120333&fm=30&app=106&size=f242,162&n=0&g=0n&f=JPEG?s=AD0A727DBFA3E37E1C1E7C830300E088&sec=1618986895&t=688be7afd9dc33a4dd6cec0b9e6d692e","注意!北京启动重大气象灾害Ⅳ级响应!今天大风+沙尘将明显影响晚高峰","https://baijiahao.baidu.com/s?id=1697094096241984659&wfr=spider&for=pc"
"气象小秘书","5天前","市气象局集成气象、消防、应急、国土、水文以及水务等多部门数据,自主研发了“包头气象灾害防御联动系统”。该系统以降低全市气象灾害风险,提升气象防灾减灾能力为目标,可满足包头市气象信息化、现代化、智能化、科学化、合理化和经济化的...","https://cambrian-images.cdn.bcebos.com/b604caf6d9c89aba9ecfca597d6f0e25_1666454311203170.jpeg@w_100,h_100","气象灾害防御联动系统研发成功","https://baijiahao.baidu.com/s?id=1697094244626822795&wfr=spider&for=pc"
"网易","5天前","自然灾害、事故灾害和公共卫生事件频发,导致人民群众的生命财产安全和社会经济的有序发展受到严重威胁。科学有效地进行城市灾害风险管理工作,提高城市系统面对不确定性因素的抵抗、响应、适应与恢复能力十分重要。在防灾形势严峻的背景下,亟须...","https://dss2.bdstatic.com/6Ot1bjeh1BF3odCf/it/u=3098397713,4187819481&fm=217&app=2&size=f242,162&n=0&g=0n&f=JPEG?s=0518E03319AFE0CA5AD505DA0100C0B1&sec=1618986898&t=57245f8b5d011804e9ffce9739201bec","期刊精粹 | 人工智能技术在城市灾害风险管理中的应用与探索「2021...","https://www.163.com/dy/article/G7KB7OMG0541FKUM.html"
"地震三点通","5天前","普查强调综合减灾能力评估和综合灾害风险评估区划,充分体现从应对单一灾种向综合减灾转变的思路。普查的重要工作之一是对全国、省、市、县进行不同尺度的风险评估,同时基于风险评估结果开展风险区划和防治区划的制定,这将为从减少灾害损失向...","https://dss0.baidu.com/6ONWsjip0QIZ8tyhnq/it/u=839898444,140099517&fm=30&app=106&size=f242,162&n=0&g=0n&f=JPEG?s=1D90CD17175E45C854C020DA0300D032&sec=1618986898&t=0b674b167366f83f0434df46041c0bf7","城市与减灾 | 第一次全国自然灾害综合风险普查总体技术体系解读","https://baijiahao.baidu.com/s?id=1697071887496093310&wfr=spider&for=pc"
"星沙时报","5天前","星沙时报讯(通讯员 王斯杰 记者 李生辉)4月13日,长沙县召开2021年度地质灾害防治工作部署会议,总结2020年地质灾害防治工作,重点对2021年主汛期地质灾害防治工作进行安排部署。副县长喻名团参加会议。 2020年以来,全县共投入地质灾害应急处置...","https://cambrian-images.cdn.bcebos.com/f8de7f5f32453ffd155a4e3a831b4bcd_1629767261579929.jpeg@w_100,h_100","推进地质灾害防治工作有序开展","https://baijiahao.baidu.com/s?id=1697070996847089203&wfr=spider&for=pc"
"国际在线","5天前","据中国天气网消息,北京市气象局4月15日8时启动重大气象灾害(大风)Ⅳ级应急响应。 预计今天(15日)白天,北京多云转沙尘,下午有分散性小阵雨,局地伴有弱雷电,南风三四级转北风五级左右,阵风八九级,最高气温23℃;夜间沙尘转晴,北风三四...","https://dss2.baidu.com/6ONYsjip0QIZ8tyhnq/it/u=2677184570,140094716&fm=30&app=106&size=f242,162&n=0&g=0n&f=JPEG?s=C090CD3A155865C81A7591DB030090B3&sec=1618986898&t=af4164a419ef8b7bfea0aa3b8676ff43","北京启动重大气象灾害(大风)Ⅳ级应急响应","https://baijiahao.baidu.com/s?id=1697066731991237388&wfr=spider&for=pc"
"温州日报瓯网","5天前","近日,市水利局联合市防汛防台抗旱指挥部办公室印发《关于开展山洪灾害防御示范村创建的通知》,吹响山洪灾害防御示范村创建“号角”。根据各地防御形势,我市决定在鹿城区、龙湾区、瓯海区、乐清市、瑞安市、永嘉县、文成县、平阳县、泰顺...","NoPicture","山洪灾害防御示范村创建启动","http://www.wzrb.com.cn/5/article1067946show.html"
"看看丶中国","5天前","旅行中若有灾难 去一个安全的地方 如遇龙卷风警告,建议您进入建筑物内部底层。如果发生了地震,要躲到坚固的物体内,直到摇晃停止为止。假如是火山爆发,请保持冷静,通过电视、电台或网络听取有关当局的指示。假如你在火山喷发区,但不会...","https://dss1.baidu.com/6ONXsjip0QIZ8tyhnq/it/u=1582775761,140039315&fm=30&app=106&size=f242,162&n=0&g=0n&f=JPEG?s=B91236D0DA897B4F312B19C1030030B8&sec=1618986898&t=ff6eb4006a2e8fad8ec46b32bce7f116","圣文森特的火山爆发:如果您出门在外遭受自然灾害,该怎么办?","https://baijiahao.baidu.com/s?id=1697007257501268979&wfr=spider&for=pc"
"向阳而生的多米","6天前","2021年4月13日,日本政府作出了重要决定:向海洋排放核废水。 这一决定,让世界一片哗然。 十年前,日本遭受了毁灭性的“3.11”地震灾害。这场地震不仅引发了海啸,还导致了福岛第一核电站发生核泄漏。 十年后,在3月11日那天,日本在...","https://dss0.baidu.com/6ONWsjip0QIZ8tyhnq/it/u=2692690049,140183642&fm=30&app=106&size=f242,162&n=0&g=0n&f=JPEG?s=350197575E537DCE5895D8F103006011&sec=1618986898&t=3d23c8a47f2983cae6d39f59c947f863","日本决然向海洋排放核废水:一场巨大的灾难正向我们袭来","https://baijiahao.baidu.com/s?id=1697016532697275810&wfr=spider&for=pc"
"笔尖文化日记","6天前","唐朝统治者高度重视灾前预防及灾后的赈灾等各项事宜,在面对自然灾害之时,他的制度十分健全。据《旧唐书》等史料记载,唐朝统治者的赈灾方式十分多样。 有作物种子赈济、实物赈济和有偿赈贷等。同时还有抚恤、赦免等多种手段。唐朝花大量...","https://dss1.baidu.com/6ONXsjip0QIZ8tyhnq/it/u=3481986464,140048321&fm=30&app=106&size=f242,162&n=0&g=0n&f=JPEG?s=D2983EC55AB2C5CE4239B9290300705B&sec=1618986898&t=0ab50376479207e6ea0029ed21a324f5","唐朝的赈灾措施:自然灾害时有发生,古代政府如何对待?","https://baijiahao.baidu.com/s?id=1696992462501563628&wfr=spider&for=pc"
"气象小秘书","6天前","随后,调研组赴六安市裕安区丁集镇西河村实地查看灾害风险隐患信息报送工作情况,与区、镇、村三级灾害信息员及有关负责同志进行了深入交流,了解工作开展情况,分析存在的问题,听取相关意见建议。 调研组对我省灾害风险隐患信息报送工作给予...","https://cambrian-images.cdn.bcebos.com/b604caf6d9c89aba9ecfca597d6f0e25_1666454311203170.jpeg@w_100,h_100","应急管理部来我省调研灾害风险隐患信息报送工作","https://baijiahao.baidu.com/s?id=1697018350945656252&wfr=spider&for=pc"
"闪电新闻","6天前","齐鲁网·闪电新闻4月14日讯 近日,潍坊市应急管理局、市减灾委员会办公室会同市自然资源和规划局、市交通局、市水利局、市农业农村局、市海渔局、市气象局等部门,对全市2021年二季度自然灾害风险形势进行了会商研判,形成了《2021年二...","https://cambrian-images.cdn.bcebos.com/79e803544cdc399d372e61d3c03795a5_1572613303150243.jpeg@w_100,h_100","潍坊2021年第二季度全市自然灾害风险形势如何 快来看这份分析报告","https://baijiahao.baidu.com/s?id=1697012497496319878&wfr=spider&for=pc"
"网易新闻","6天前","除了肆虐全球的新冠疫情,极端天气导致的各种灾害也给世界造成了巨大损失。澳洲丛林大火、亚非超级蝗灾、南极高温破表、北极甲烷爆发……遗憾的是,在气候危机面前,人类仿佛集体犯了拖延症。 但有一个事实需要明确:仅仅是几摄氏度的气温变化...","https://dss2.bdstatic.com/6Ot1bjeh1BF3odCf/it/u=1839309242,946501494&fm=217&app=2&size=f242,162&n=0&g=0n&f=JPEG?s=D7AEB444CD4155570736EC520300D09F&sec=1618986901&t=3483c3fb4f689cf7c1f70902a4e796a7","比尔·盖茨发出警示:下一次灾难,将是疫情的5倍","https://3g.163.com/dy/article/G7I5V04N05521F9A.html"
"民族时报","6天前","灾害文化是文化的一个重要类型。云南大学西南环境史研究所所长周琼以及她所带领的团队深入田野调查,从灾害文化的视角去重新审视云南世居少数民族与自然互动的关系,深入分析各少数民族传统生产生活方式及其与自然环境之间的相互关联,以进一步探讨...","https://dss2.baidu.com/6ONYsjip0QIZ8tyhnq/it/u=1359528069,140025230&fm=30&app=106&size=f242,162&n=0&g=0n&f=JPEG?s=E584EBB0CA72F7ED96951800030070D0&sec=1618986901&t=191c9f23586c4ff89a44461012635562","解读《云南世居少数民族传统灾害文化纪实丛书》的秘密","https://baijiahao.baidu.com/s?id=1696992129559805062&wfr=spider&for=pc"
"果然悠","6天前","暴雨沙尘齐袭,为何灾难性天气多发?专家:怪全球变暖 再过不到一个星期的时间就是今年的第六个节气,也是春天的最后一个节气——谷雨了,按理当下各地应该是温暖如春的季节,但今年南北方各地灾害性天气齐发,南方多发生暴雨天气,而北方多...","https://dss1.baidu.com/6ONXsjip0QIZ8tyhnq/it/u=3142255186,140023507&fm=30&app=106&size=f242,162&n=0&g=0n&f=JPEG?s=70805732515A77CC14D0857E03006033&sec=1618986901&t=f70006a9d38c4f5ab3196c467875856e","暴雨沙尘等灾害性天气齐袭,主要侵害这些地方,对农业有啥影响?","https://baijiahao.baidu.com/s?id=1696990290006400180&wfr=spider&for=pc"
"潇湘晨报","6天前","面对严峻的灾情,太湖县积极应对洪涝灾害,竭尽全力减轻洪涝损失。 一是坚守岗位,全力夯实防汛救灾责任。严格执行24小时值班制度,保持联络畅通。第一时间处置和上报灾情,会同气象、水利等部门密切关注降水趋势,加密会商频次,向各级防汛责任人...","https://cambrian-images.cdn.bcebos.com/a51d142ac7625feda1002f0c739ae255_1606863438588053.jpeg@w_100,h_100","太湖县夯实责任 强化保障 竭尽全力应对洪涝灾害","https://baijiahao.baidu.com/s?id=1696985099051031763&wfr=spider&for=pc"
"湖南24小时","6天前","祁东县融媒体中心4月12日讯(记者:叶芳、邹忠延)12日,全县防汛和山洪地质灾害防治工作会商会召开。县长彭丽堂出席会议并强调,全县各级各部门要打起十二分精神,全面动员,严防死守,切实做好防汛保安、地质灾害防治工作。 县水利局、县自然...","https://cambrian-images.cdn.bcebos.com/2b8c89bba3e0dcf633035d5892d89cfc_1671002953130924.jpeg@w_100,h_100","彭丽堂:打起十二分精神严防死守,做好防汛和山洪地质灾害防治","https://baijiahao.baidu.com/s?id=1697003769501730710&wfr=spider&for=pc"
"悟空科学","7天前","说起地裂缝灾害,可能不少人都会表现得不以为然,因为,这个词似乎并不那么高频的被提及,而且还具有明显的区域性特征。 但是,毫不夸张地说,地裂缝灾害也会给所在区域的人们带来不小的麻烦,不仅能够毁坏桥梁和道路,还能对地下管线和地表的...","https://dss1.baidu.com/6ONXsjip0QIZ8tyhnq/it/u=1103110964,139973216&fm=30&app=106&size=f242,162&n=0&g=0n&f=JPEG?s=3DAEE5170DAAE4CA0A6C24FD0300C032&sec=1618986901&t=836d8ca98e15732e27997d9542808a14","西安成为我国地裂缝灾害最严重的地区之一,是天灾、还是人祸?","https://baijiahao.baidu.com/s?id=1696936163189473356&wfr=spider&for=pc"
"嗨嗨讷言","7天前","自然灾害包括旱、水、虫、雹、风、疫、饥、冰冻、地震等灾,都对社会产生了不同程度的影响和破坏,尤以水灾和旱灾为最。 中国是“多灾国家”,大灾难频发。学术界一般认为,从上古到清末,中国自然灾害有四大多发、群发期,即夏禹群发期...","https://dss0.baidu.com/6ONWsjip0QIZ8tyhnq/it/u=3706718848,139969694&fm=30&app=106&size=f242,162&n=0&g=0n&f=JPEG?s=DECA722B5AF8E5EB0E3CE5DE0100C0B1&sec=1618986901&t=6ae5f6e9d47476d279e28999c118ff63","盘点湖北史上,自然灾害和疾病灾害的统计!!","https://baijiahao.baidu.com/s?id=1696932114210029683&wfr=spider&for=pc"
"旧时光忆影","7天前","相信大家今天都刷到了头条热点新闻,气愤之余我们最多也只能在网上发泄我们的愤怒但是气大伤身,不如冷静一下看看电影今天推荐大家一部2006年的电影——《日本沉没》 该电影讲述了:日本发生大规模的地质灾害,整个日本陷入一片恐慌。政府对于...","https://dss1.baidu.com/6ONXsjip0QIZ8tyhnq/it/u=3797282076,139966930&fm=30&app=106&size=f242,162&n=0&g=0n&f=JPEG?s=69B072D934D13861528DC9040300E0D1&sec=1618986901&t=1595f2d544798997c114f05526de1094","经典灾难电影推荐——日本沉没","https://baijiahao.baidu.com/s?id=1696929527399394380&wfr=spider&for=pc"
