"results_author","results_date","results_des","results_img","results_title","results_url"
"中国气象局","2013年8月6日","据8月5日气象干旱监测,贵州大部、湖南大部、湖北东南部、浙江中西部、江西西部和东部等地存在中度到重度气象干旱。预计,未来3天,上述大部地区仍维持高温天气,降水偏少,气象干旱将持续或发展。2013...","https://dss2.bdstatic.com/6Ot1bjeh1BF3odCf/it/u=2441369602,1001121411&fm=217&app=92&size=f242,162&n=0&g=0n&f=JPEG?s=38287432115A6FCC40C955E10000E030&sec=1618986914&t=896864dc51ea1e5c7e556229e40acb79","干旱/高温/台风预警","http://www.cma.gov.cn/2011zwxx/2011zyjgl/2011zyjxy/2011zqxyj/201308/t20130806_222091.html"
"中国政府网","2013年8月6日","当前高温干旱防御应对工作的通知 国办发明电〔2013〕21号 上海、江苏、浙江、安徽、福建、江西、河南、湖北、湖南、广东、广西、重庆、四川、贵州等省(自治区、直辖市)人民政府,国务院有关部门: 7月以来,南方地区出现大范围持续性高温...","NoPicture","国务院办公厅关于做好当前高温干旱防御应对工作的通知","http://www.gov.cn/zhengce/content/2013-08/06/content_2725.htm"
"中国气象局","2013年8月5日","中国气象报通讯员侯英雨 韩丽娟报道 8月2-4日,国家气象中心派出工作人员,与浙江省气象局农业气象专家共同组成的调研组来到浙江杭州、衢州、绍兴等地调查高温干旱对经济作物、水稻生长发育的影响情况。据当地气象部门介绍,7月以来浙江持续...","https://dss2.bdstatic.com/6Ot1bjeh1BF3odCf/it/u=1974833270,2247528919&fm=217&app=92&size=f242,162&n=0&g=0n&f=JPEG?s=F18827F1CC23E6DC54A4941903001050&sec=1618986914&t=d8e5a8f99ce8ec424ebbf5ba88845fef","国家气象中心派出人员到高温干旱一线调研","http://www.cma.gov.cn/2011xwzx/2011xqxxw/2011xtpxw/201308/t20130805_222055.html"
"中国气象局","2014年8月24日","干旱指数是表征干旱程度的标准, 也是旱情描述的数值表达。 美国气象学会在总结各种干旱定义的基础上将干旱分为4种类型: 气象干旱、农业干旱、水文干旱和社会经济干旱。  (1)气象干旱也称大气干旱,根据中华人民共和国国家标准, 气象干旱是...","NoPicture","干旱的标准与类型","http://www.cma.gov.cn/kppd/kppdsytj/201308/t20130805_222041.html"
"中国气象局","2013年8月5日","特大干旱(一级红色预警):多个区县发生特大干旱,多个县级城市发生极度干旱。 严重干旱(二级橙色预警):数区县的多个乡镇发生严重干旱,或一个区县发生特大干旱等。 中度干旱(三级黄色预警):多个区县发生较重干旱,或个别区县发生严重干旱...","NoPicture","干旱预警等级和伏旱标准","http://www.cma.gov.cn/kppd/kppdsytj/201308/t20130805_222042.html"
"中国气象局","2013年8月1日","特大干旱(一级红色预警):多个区县发生特大干旱,多个县级城市发生极度干旱。 严重干旱(二级橙色预警):数区县的多个乡镇发生严重干旱,或一个区县发生特大干旱等。 中度干旱(三级黄色预警):多个区县发生较重干旱,或个别区县发生严重干旱...","NoPicture","高温干旱台风预警信号发布标准","http://www.cma.gov.cn/2011xwzx/2011xqxxw/2011xqxyw/201308/t20130801_221595.html"
"中国气象局","2013年8月2日","中国气象网讯 继7月30日中国气象局今年首次启动高温应急响应(Ⅱ级)之后,8月1日8时30分,中国气象局分别启动Ⅲ级和Ⅳ级应急响应,应对干旱和台风。 据最新气象干旱监测,贵州大部、湖南大部、湖北东南部、浙江中部等地存在中度到重度气象...","NoPicture","气象局启动三个应急响应 应对高温干旱台风","http://www.cma.gov.cn/2011xwzx/2011xqxxw/2011xqxyw/201308/t20130801_221575.html"
"中国气象局","2013年8月1日","今年7月1日以来,江南以及贵州、重庆等地降水异常偏少,平均气温显著偏高,导致部分地区出现气象干旱。据7月31日气象干旱监测,贵州大部、湖南大部、重庆东南部、浙江中部等地存在中度到重度气象干旱。预计,未来3天,上述旱区仍维持高温少雨...","https://dss1.bdstatic.com/6OF1bjeh1BF3odCf/it/u=3300027924,3073281240&fm=217&app=92&size=f242,162&n=0&g=0n&f=JPEG?s=9C227432114B654D50C910C10000E0B0&sec=1618986914&t=24a69e5cbfc58e733cf26fa4ef304f8b","气象台发布干旱预警 贵阳气象农委联合调查旱情","http://www.cma.gov.cn/2011xwzx/2011xqxxw/2011xtpxw/201308/t20130801_221566.html"
"中国气象局","2013年7月31日","中国气象网讯 7月31日18时,中央气象台同时发布高温、干旱、台风预警。连日来,我国多地进入“烧烤模式”,江南、贵州、重庆等地降水异常偏少,平均气温显著偏高,导致部分地区出现气象干旱。同时,热带风暴“飞燕”也逐渐向海南东部到广东西部...","https://dss2.bdstatic.com/6Ot1bjeh1BF3odCf/it/u=2085809575,2202901193&fm=217&app=92&size=f242,162&n=0&g=0n&f=JPEG?s=30966832010A70EE04D155E002007031&sec=1618986914&t=de36e1d85f37821b0ef1102db222b601","中央气象台齐发高温干旱台风三预警 注意防范应对","http://www.cma.gov.cn/2011xwzx/2011xqxxw/2011xqxyw/201307/t20130731_221534.html"
"中国水利","2013年7月23日","眼下,高温酷暑、赤地千里、溪河干涸,不由得我想起了2003年的大旱。 2003年,湖南大旱有这么几个特点:一是时间持续长。6月中旬以来,全省降雨极不均匀。7月份,湘东南、湘南降雨量在20毫米以下,郴州、永州、衡阳三市和长沙、湘潭、娄底...","NoPicture","2003年大旱的回顾(图)","http://www.chinawater.com.cn/grzl/wxz/6/201307/t20130723_284286.htm"
"中国气象局","2013年7月1日","旱灾是一种农业气象灾害,是干旱对农业所造成的严重损害。 简介 干旱是一种因长期无雨或少雨,造成空气干燥、土壤缺水的气候现象。在气象上有两种含义:一是干旱气候,即干旱、半干旱地区气候的基本情况;一直气候异常,即半湿润地区在某一时...","NoPicture","干旱-中国气象局政府门户网站","http://www.cma.gov.cn/2011xzt/2014zt/20140408/2014040809/201404/t20140409_242987.html"
"中国气象局","2013年6月3日","芒种时节高温高热天居多,目前正值柑桔第二次生理落果期,持续高温干旱天气会加剧柑桔异常落果,对柑桔生产影响较大。为了防御持续高温干旱天气造成柑桔异常落果,专家建议:一是适时灌溉。当出现持续高温干旱天气时(7天以上),应对桔园灌水,早...","NoPicture","“芒种”时节警惕高温干旱引发柑桔落果","http://www.cma.gov.cn/2011xzt/essjqzt/20130529/2013052903/201306/t20130603_215512.html"
"中国气象局","2013年4月17日","中国气象报记者赖敏 通讯员李祎君报道 记者从中国气象局4月16日发布的全国春耕春播气象服务专报获悉,未来一周,我国江淮、江汉春播区大部天气较好,适宜春播;东北低温多阴雨,西南和西北部分地区干旱不适宜春播;新疆、内蒙古和甘肃局地有大风...","NoPicture","未来一周东北低温多阴雨 西南和西北部分地区干旱不适宜春播","http://www.cma.gov.cn/2011xwzx/2011xqxxw/2011xqxyw/201304/t20130417_211179.html"
"中国气象局","2013年4月3日","本报讯 记者高琳报道 生活在北方的人们享受湿润气候带来的滋味,习惯了潮湿气候的西南地区的人们为干旱而犯愁。记者近日从国家气象中心了解到,自2000年以来,我国北方气候呈湿润化特征,生态恢复;西南地区气象干旱频发,生态质量下滑。 国家...","NoPicture","北方湿润化生态质量渐好西南干旱频植被覆盖变差","http://www.cma.gov.cn/2011xwzx/2011xxxfw/2011xbz/xbzzy/201304/t20130403_209901.html"
"闽南网","2013年3月29日","闽南网3月29日讯 台湾遭遇大旱,日月潭水位逼近封闭码头的警戒线。27日,日月潭风景管理处勘察4个码头,决定能不封码头就不封,把水位降低对观光的影响降到最低。当水位降到743米时,就启动警戒。 ","NoPicture","干旱致水位降低 台湾日月潭或封闭码头","http://www.mnw.cn/news/th/331374.html"
"中国质量新闻网","2013年3月28日","中新网3月28日电据台湾《联合报》报道,台湾遭遇大旱,日月潭水位逼近封闭码头的警戒线,26日晚的及时雨稍让水位回升,但离理想水位有段距离,日月潭风景管理处27日邀相关单位踏勘水社等4个码头,决定先做止滑与延伸水社码头引桥等配套设施,...","https://dss1.bdstatic.com/6OF1bjeh1BF3odCf/it/u=136321869,1736814410&fm=217&app=92&size=f242,162&n=0&g=0n&f=JPEG?s=B7B0EA2301C6ED4B50ED8C5A02009070&sec=1618986915&t=386913a1de5daf7f3f864aad16b7eb29","日月潭因干旱水位降低 码头面临封闭影响观光","http://www.cqn.com.cn/wh/content/2013-03/28/content_1781720.htm"
"中国新闻网","2013年3月28日","日月潭风景区管理处会勘水社等码头,研商水位下降配套作法,将封闭码头的可能性降至最低。 记者黄宏玑/摄影 中新网3月28日电 据台湾《联合报》报道,台湾遭遇大旱,日月潭水位逼近封闭码头的警戒线,26日晚的及时雨稍让水位回升,但离理想...","https://dss2.bdstatic.com/6Ot1bjeh1BF3odCf/it/u=801020732,1893864136&fm=217&app=92&size=f242,162&n=0&g=0n&f=JPEG?s=D9964F914C9A1EC8303C69D6030080B2&sec=1618986915&t=c4e000f40ffdf1a46bd471db0aec6ed8","日月潭因干旱水位降低 码头面临封闭影响观光","https://www.chinanews.com/tw/2013/03-28/4683682.shtml"
"中国网","2013年3月26日","平常只顶端两只露脸,干旱时九蛙全亮相。图片来自台湾媒体 中国台湾网3月25日消息 据台湾媒体报道,干旱让日月潭水位下降4.5米,意外让位于水蛙头步道末端水域著名的景观意象“九蛙叠像”浮出水面。 ","https://dss2.bdstatic.com/6Ot1bjeh1BF3odCf/it/u=3631201505,2033380024&fm=217&app=92&size=f242,162&n=0&g=0n&f=JPEG?s=1E06C20574E1D54B0A093CD00300C0B0&sec=1618986915&t=38afbcf8191735aa8868347ed85ffe59","台湾降水偏少 日月潭水位下降5米","http://www.china.com.cn/v/news/2013-03/26/content_28357054.htm"
"参考消息","2013年3月25日","日月潭“九蛙叠像”重新露脸的另层意义,是代表着干旱已然相当严重。(图片来源:台湾《中国时报》) 中新网3月25日电 据台湾《中国时报》报道,台湾最近苦旱不雨,日月潭水位下降4.5公尺,水蛙头步道末端水域,著名的景观意象“九蛙叠像”...","https://dss2.bdstatic.com/6Ot1bjeh1BF3odCf/it/u=2497290405,1033056231&fm=217&app=92&size=f242,162&n=0&g=0n&f=JPEG?s=9014CB301E695507429578C0030070B1&sec=1618986915&t=fbfcda7c4fbe88d88cdc6ce42cf77b8c","台湾久旱日月潭水位降 九蛙叠像真身全现(图)","http://tw.cankaoxiaoxi.com/2013/0325/183112.shtml"
"大河网","2013年3月24日","据新华社台北3月23日电 今春降雨不足造成台湾地区旱情严峻,当局“水利署”监控的12个水库中有10个蓄水量低于去年同期。其中,旅游胜地日月潭已直逼警戒水位,若旱情持续将被迫封闭码头、停航游船。 近一个半月来,台北降雨仅有30多毫米,...","https://dss2.bdstatic.com/6Ot1bjeh1BF3odCf/it/u=3474153966,268453552&fm=217&app=92&size=f242,162&n=0&g=0n&f=JPEG?s=2228B00BD89633EB6D0104DF0300A0E2&sec=1618986915&t=ee0007ff44e0c35a259845e3d2d60b98","旱情严峻 日月潭游船或停航","http://newpaper.dahe.cn/hnrb/html/2013-03/24/content_867917.htm?div=-1"
"大河网","2013年3月24日","据新华社台北3月23日电 今春降雨不足造成台湾地区旱情严峻,当局“水利署”监控的12个水库中有10个蓄水量低于去年同期。其中,旅游胜地日月潭已直逼警戒水位,若旱情持续将被迫封闭码头、停航游船。 近一个半月来,台北降雨仅有30多毫米,...","https://dss2.bdstatic.com/6Ot1bjeh1BF3odCf/it/u=3474153966,268453552&fm=217&app=92&size=f242,162&n=0&g=0n&f=JPEG?s=2228B00BD89633EB6D0104DF0300A0E2&sec=1618986915&t=ee0007ff44e0c35a259845e3d2d60b98","旱情严峻 日月潭游船或停航","http://newpaper.dahe.cn/hnrb/html/2013-03/24/content_867917.htm?div=-1"
"中国新闻网","2013年3月22日","台湾多地干旱陷缺水荒 中新社北京3月22日电 (石龙洪)综合台北消息,台湾今年春雨稀少,多地陷入缺水荒,开始实施限水措施。 台湾“经济部水利署”22日发布公告称,全台水情吃紧,桃园县、新北市林口区及高雄市目前均已实施第一阶段...","NoPicture","台湾多地干旱陷缺水荒","https://www.chinanews.com/tw/2013/03-22/4669257.shtml"
"中国新闻网","2013年3月22日","日月潭水位直直落,北旦弯潭底充斥废弃物,游客觉得有碍观光,管理处决定趁机展开清除,还日月潭清新面貌。 记者黄宏玑/摄影 中新网3月22日电 据台湾《联合报》报道,干旱不雨,21日,台湾日月潭水位降到744.04米,距封码头警戒线只剩1米...","https://dss1.bdstatic.com/6OF1bjeh1BF3odCf/it/u=1001155799,243413606&fm=217&app=92&size=f242,162&n=0&g=0n&f=JPEG?s=0BF163915C5A66C21E94CD5D030000F3&sec=1618986915&t=f944c3a4b74579d0f1c041201c603590","日月潭水位直降潭底可见 游客直呼竟是这般脏","https://www.chinanews.com/tw/2013/03-22/4666274.shtml"
"参考消息","2013年3月22日","东南网3月22日讯 据台湾媒体报道,久旱不雨,台东纵谷池上、关山地区半个月前已启动抗旱机制,关山大圳已执行第二次断水、池上圳也两天轮灌一次,农民担心,再不降雨,将影响台东水稻品质,是6年来最严重干旱。 ","https://dss0.bdstatic.com/6Ox1bjeh1BF3odCf/it/u=2801205114,2572457953&fm=217&app=92&size=f242,162&n=0&g=0n&f=JPEG?s=5A3B6BC815BB2A2C66F00B14030050DE&sec=1618986915&t=3882c625fd1db376f0f10d4d0cecf98f","全台久旱不雨日月潭水位直降 “勒紧裤带”节水","http://tw.cankaoxiaoxi.com/2013/0322/181716.shtml"
"华夏经纬网","2013年3月20日","云南省持续的干旱对当地重要的咖啡产业产生极大影响。云南省咖啡协会公布的数据显示,由于干旱影响,保山等地3万亩左右的咖啡受灾,可能导致全省咖啡减产5%~10%,预计造成经济损失上千万元。 今年以来,由于降水大幅减少,气温普遍偏高,云南大...","NoPicture","云南干旱祸及万亩咖啡 我国咖啡业艰难突围","http://www.huaxia.com/tslj/rdqy/xb/2013/03/3256848.html"
"张家界政府网","2013年3月11日","[名 称 ]省发改委主任胡衡华解读《衡邵干旱走廊综合治理规划》由省发改委牵头组织编制的《衡邵干旱走廊综合治理规划》(以下简称《规划》),已正式通过湖南省人民政府审批。全省发改系统正紧锣密鼓,抓紧规划的组织实施。春节前,一笔5000...","NoPicture","省发改委主任胡衡华解读《衡邵干旱走廊综合治理规划》","http://www.zjj.gov.cn/c686/20160420/i3345.html"
"中国气象局","2013年3月1日","本报讯 记者刘成成报道 今年2月,云南大部、四川大部、贵州西部等地降水量不足10毫米,比常年同期偏少5成以上,气温较常年同期偏高 2℃至4℃,这导致了云贵川等地气象干旱持续发展。 中国气象局应急减灾与公共服务司司长陈振林介绍,目前...","NoPicture","云贵川等地气象干旱持续发展","http://www.cma.gov.cn/2011xwzx/2011xxxfw/2011xbz/xbzzy/201303/t20130301_206538.html"
"央视网","None","抗旱 抗旱 抗旱 抗旱 抗旱 抗旱 抗旱 抗旱 抗旱 抗旱","https://dss1.bdstatic.com/6OF1bjeh1BF3odCf/it/u=1799395931,1190134646&fm=217&app=92&size=f242,162&n=0&g=0n&f=JPEG?s=CDBA32D45CA94A0924909B740300F077&sec=1618986915&t=be6beab044a44de7cf320302879b5cce","干旱预警分级 - 2009年抗旱专题","http://news.cctv.com/special/kanghan/01/index.shtml"
"中国气象局","2012年12月27日","中国气象报通讯员张学艺 记者柳荐秋报道 近日,由宁夏气象科学研究所主持的科技部社会公益研究专项“气候变化背景下宁夏干旱监测预警系统研究”凭借立项准、创新点多、成果多、成果转化好、推广应用范围广及社会经济效益好等多项优势,获得...","NoPicture","宁夏气候变化背景下宁夏干旱监测预警系统研究获奖","http://www.cma.gov.cn/2011xwzx/2011xqxxw/2011xhydt/201212/t20121227_199662.html"
"中国气象局","2012年12月20日","惊闻我国著名的气象学家、中国共产党优秀党员、中国科学院资深院士、中国现代气象学的主要奠基人陶诗言先生不幸逝世,我本人深表哀悼!在此悲痛之际,特向陶诗言同志家属表示慰问,望节哀! 肃此电达! 中国气象局兰州干旱气象研究所 李耀辉 二...","NoPicture","中国气象局兰州干旱气象研究所 李耀辉","http://www.cma.gov.cn/2011xzt/2012zhuant/20121219/2012121903/201212/t20121220_198848.html"
"中国气象局","2012年12月15日","通常将年降水量小于200(或250)毫米的地区划为干旱区,年降水量200(或250)——500毫米的地区划为半干旱区。用这种降水量指标衡量,干旱是一个世界性的问题。世界大陆干旱和半干旱区的总面积约为4800万平方公里,占大陆面积的三分之一,...","NoPicture","浅谈我国干旱区的分布","http://www.cma.gov.cn/kppd/kppdqxsj/kppdtqqh/201212/t20121215_197083.html"
"中国气象局","2012年12月14日","和1929年(民国十八年)干旱比较,1929年西安1—6月降水104毫米,和今年(114毫米)接近。据旱灾史料记述,1929年的大旱是在1928年的大旱(该年西安年总降水量为239毫米)基础上发生的;1929年“全省91县,受灾88县”,“二麦固无收成,春夏...","NoPicture","今年陕西干旱历史罕见","http://www.cma.gov.cn/kppd/kppdqxsj/kppdtqqh/201212/t20121214_196461.html"
"中国气象局","2012年11月29日","美国国家航空和航天局所属的戈达德研究所的詹姆斯·汉森先生警告说,世界可能受到温室效应的影响,气温升高将导致更多的洪水、干旱和飓风。  美国国家海洋和大气局所属的气候分析中心,刚刚发表了一份去年的气候总结报告。它包括了第二个最...","NoPicture","全球变暖将导致更多的洪水和干旱","http://www.cma.gov.cn/kppd/kppdqxsj/kppdqhbh/201211/t20121129_193062.html"
"中国气象局","2012年9月13日","近来,在热浪一年比一年严酷的环境下,美国新墨西哥州的洛斯阿拉莫斯国家实验室里,一群科学家开始研究起了树木的死法,尤其是被热浪和干旱杀死的树木,目的,是为了找出一些方法,让树木在极端气候中能够尽可能久地存活。 大旱中的应景研究 ...","NoPicture","极端天气频发 科学家研究方法防树木干旱死","http://www.cma.gov.cn/2011xwzx/2011xqhbh/2011xdtxx/201209/t20120913_185167.html"
"中国气象局","2012年8月25日","为此,中国气象报记者采访了武汉区域气候中心主任刘敏,详细解析干旱成因。 记者:前期湖北多地出现的干旱大致是什么情况? 刘敏:据综合气象干旱(ci)指数监测显示:截至8月16日20时,鄂北岗地、江汉平原西部及鄂西南北部、鄂西北局部出现中等...","NoPicture","【访谈】气象专家解析鄂北干旱成因","http://www.cma.gov.cn/2011xwzx/2011xqxxw/2011xqxyw/201208/t20120825_183122.html"
"中国气象局","2012年7月18日","中国气象报记者王芳报道 今年雨季结束以来,福建省在副热带高压的紧紧控制之下,出现了持续性高温少雨晴热天气,导致全省有37个县市出现气象干旱。 据统计,6月26日至7月12日福建省大部分县市降水量较常年同期偏少9成以上,其中古田、...","NoPicture","福建持续晴热少雨 37县市出现干旱","http://www.cma.gov.cn/2011xwzx/2011xqxxw/2011xzytq/201207/t20120718_178875.html"
"中国气象局","2012年7月2日","气象部门建议,7月北方大田作物进入旺盛生长阶段,江南、华南大部早稻进入产量形成关键时期,需重点防御干旱、高温热害、暴雨洪涝等灾害对农业生产的不利影响。 据悉,6月,主要农业气象灾害为江南、华南和西南地区暴雨洪涝,华北南部、黄淮、...","NoPicture","6月南方暴雨夏播区干旱 7月需防洪涝和高温伏旱","http://www.cma.gov.cn/2011xwzx/2011xqxxw/2011xqxyw/201207/t20120702_177332.html"
"中国气象局","2012年3月12日","干旱的澳大利亚首都布里斯班水坝【字体:大中小】 打印本页 分享:发布时间:2012年03月12日17:06 来源:中国气象报社 全球气候变化造成了澳大利亚十年之久的干旱,图为澳大利亚首都布里斯班水坝的干旱情况。 (来源:互联网)...","https://dss1.bdstatic.com/6OF1bjeh1BF3odCf/it/u=1765220618,489533498&fm=217&app=92&size=f242,162&n=0&g=0n&f=JPEG?s=74B31FD5181B36C046981D2403008070&sec=1618986916&t=c98010ad2fa9d5d5a5f702ec70282fb0","干旱的澳大利亚首都布里斯班水坝","http://www.cma.gov.cn/2011xzt/2012zhuant/20120302/2012030206/201203020603/201203/t20120312_164483.html"
"中国气象局","2012年3月6日","持续3年的干旱让云南大地备受煎熬,人们在埋怨老天为何总是不降雨的同时,应该深深思考一下,人类不合理的活动也会对局地气候造成不良影响,这种影响是缓慢和间接性的。 2012年2月20日,云南“三年连旱”已造成昭通、曲靖、昆明、楚雄等地...","https://dss1.bdstatic.com/6OF1bjeh1BF3odCf/it/u=297898379,1829727501&fm=217&app=92&size=f242,162&n=0&g=0n&f=JPEG?s=66A29C434EBA83CC4E6D3D360300E040&sec=1618986916&t=03960324d468449d7ded4b32ae0255a8","深入分析云南干旱原因","http://www.cma.gov.cn/kppd/kppdkpdt/201301/t20130108_200679.html"
"中国气象局","2012年2月29日","中国气象报记者冯颖 通讯员戴丛蕊报道 云南干旱已经成为全社会关注的焦点,近日,云南省气候中心主任朱勇接受记者采访,就云南当地的具体情况和气象干旱及影响向公众进行解读。 干旱与气象干旱 朱勇介绍,干旱问题十分复杂,涉及面广,可分为气象...","NoPicture","云南111个站点出现气象干旱 专家详解干旱及影响","http://www.cma.gov.cn/2011xwzx/2011xqxxw/2011xqxyw/201202/t20120229_162965.html"
"中国气象局","2012年2月29日","江淮及其以南持续阴雨 旱区干旱将持续【字体:大中小】 打印本页 分享: 发布时间:2012年02月29日07:21 来源:中央气象台 中国气象网讯 29日～3月2日,西南地区东部、江淮及以南地区将维持阴雨天气,量级以小到中雨为主,其中,江南中...","https://dss1.bdstatic.com/6OF1bjeh1BF3odCf/it/u=1545327499,3445019561&fm=217&app=92&size=f242,162&n=0&g=0n&f=JPEG?s=B5187832491AF4CE5AF05C43030060F1&sec=1618986917&t=55becb9497e1ab73c744d67528c41630","江淮及其以南持续阴雨 旱区干旱将持续","http://www.cma.gov.cn/2011xwzx/2011xqxxw/2011xqxyw/201202/t20120229_162899.html"
"中国气象局","2011年12月14日","中国气象报通讯员张彩云 何晨报道 日前,内蒙古自治区鄂尔多斯市气象局顺利完成《全市干旱预报预警系统》建设,并投入使用。 据了解,该系统选用近53年3-9月的地面观测资料,对鄂尔多斯市发生的干旱情况进行统计和分析,揭示干旱发生的气候特点...","NoPicture","鄂尔多斯市干旱预报预警系统建成","http://www.cma.gov.cn/jblm/2011xxdqxywtx/2011xybycxt/201112/t20111214_156555.html"
"中国气象局","2011年10月26日","预计未来一周综合气象干旱指数达到重旱(气象干旱为25～50年一遇),或者某一县(区)有40%以上的农作物受旱。 1、有关部门和单位按照职责做好防御干旱的应急工作; 2、有关部门启用应急备用水源,调度辖区内一切可用水源,优先保障城乡居民...","https://dss2.bdstatic.com/6Ot1bjeh1BF3odCf/it/u=1733810168,4047228817&fm=217&app=92&size=f242,162&n=0&g=0n&f=JPEG?s=29A28E1ACAD558C84A973D610300F038&sec=1618986917&t=c71f7f83b4b3cfa7988cf3b0206d31c8","干旱预警信号分二级,分别以橙色、红色表示。干旱指标等级划分,以...","http://www.cma.gov.cn/2011qxfw/2011qyjxx/2011qyjxh/201110/t20111026_119430.html"
"中国政府网","2011年9月2日","村干部说,这场大旱旱在了季节上,而且是大季,影响很大,乡亲们已经做好了改种蔬菜、冬洋芋的准备。镇里面也从安徽等地购买了“白花前胡”的种子,准备发展2000多亩中药材。 栗战书对大家的做法表示肯定。他说,抗旱要讲科学,有水源的...","NoPicture","栗战书深入一线考察贵州省旱情和抗旱工作纪实","http://www.gov.cn/gzdt/2011-09/02/content_1938840.htm"
"中国新闻网","2011年7月8日","中新网7月8日电 据香港《文汇报》8日报道,联合国难民事务高级专员公署(UNHCR)6日发布人道救援警报,指非洲东部多国正面临60年来最严重旱灾,出现粮食危机,估计有1200万人饱受饥荒之苦。高级专员古特雷斯称这是全球最悲惨的人道危机之...","https://dss2.bdstatic.com/6Ot1bjeh1BF3odCf/it/u=3155598564,549139306&fm=217&app=92&size=f242,162&n=0&g=0n&f=JPEG?s=B9916C95040046FE489528AC03007062&sec=1618986917&t=9c3891e17f4119897c7526177ad096ea","东非遭遇60年最严重旱灾 1200万人闹饥荒(图)","https://www.chinanews.com/gj/2011/07-08/3167084.shtml"
"搜狐网","None","长江中下游遭遇50年来最严重干旱,谁是这次大旱“罪魁祸首”?舆论聚焦到了长江上游的“解渴之水”三峡水库。信息掌握不充分的前提下,公众对三峡工程的期望值过高,以及对于政府言论的不信任,是“一切错在三峡”这种心态产生的原因。【...","NoPicture","南方大旱三峡无罪-搜狐评论","http://star.news.sohu.com/s2011/threegorgesdam/"
