"results_author","results_date","results_des","results_img","results_title","results_url"
"中国政府网","2020年8月6日","应急管理部8月6日12时发布未来三日全国自然灾害综合风险预警提示:预计8月6-8日,我国北方地区可能出现今年入汛以来最大范围强降雨过程,局地极端性强,强对流天气活跃,甘肃、陕西、山西、河北、河南、山东等地存在中小河流洪水、山洪、地质...","NoPicture","应急管理部发布全国自然灾害综合风险预警提示","http://www.gov.cn/xinwen/2020-08/06/content_5532900.htm"
"中国政府网","2020年8月4日","近日,应急管理部会同自然资源部、水利部、农业农村部、气象局等部门对7月份全国自然灾害情况进行了会商分析。7月份,全国自然灾害以洪涝和地质灾害为主,风雹、地震、干旱、森林火灾等灾害也有不同程度发生。在以习近平同志为核心的党中央...","NoPicture","应急管理部发布2020年7月全国自然灾害情况","http://www.gov.cn/xinwen/2020-08/04/content_5532414.htm"
"中国政府网","2020年7月22日","7月22日,应急管理部发布未来三日全国自然灾害综合风险预警提示:预计23-25日,西北地区东部、四川盆地至江淮、江南北部将出现强降水。淮河干支流需继续加强流域性洪水应对,河南、山东、苏皖中北部需防范城乡内涝和中小河流洪水。长江中下游、...","NoPicture","应急管理部发布全国自然灾害综合风险预警提示","http://www.gov.cn/xinwen/2020-07/22/content_5529233.htm"
"中国政府网","2020年7月19日","记者19日从应急管理部获悉,7月以来,洪涝灾害造成江西、安徽、湖北、湖南、重庆、贵州等24省(区、市)2385.7万人次受灾,31人死亡失踪,203.9万人次紧急转移安置。,2020-07-19-20:07:00","NoPicture","应急管理部:7月以来洪涝灾害已致2385.7万人次受灾","http://www.gov.cn/xinwen/2020-07/19/content_5528245.htm"
"中国政府网","2020年7月19日","为加强洪涝地质灾害的应急应对,支持受灾地区做好灾后重建和恢复生产,切实保障人民群众利益,现就有关事项通知如下: 一、切实提高对加强防灾减灾工作的认识。受灾地区银保监局要高度重视当前洪涝地质灾害对经济金融运行和群众生产生活的影响,...","NoPicture","中国银保监会办公厅关于做好洪涝地质灾害应急应对及灾后重建金融...","http://www.gov.cn/zhengce/zhengceku/2020-07/19/content_5528215.htm"
"中国政府网","2020年7月17日","记者16日获悉,据应急管理部统计,7月份以来洪涝灾害造成江西、安徽、湖北、湖南、重庆、贵州等24省(区、市)2027.2万人次受灾,23人死亡失踪,176.4万人次紧急转移安置;1.2万间房屋倒塌,8.9万间不同程度损坏;农作物受灾面积2207.5千...","NoPicture","应急管理部:7月以来洪涝灾害已致2027.2万人次受灾","http://www.gov.cn/xinwen/2020-07/17/content_5527598.htm"
"中国政府网","2020年7月16日","发生洪涝灾害时,大量畜禽因灾死亡,尸体腐烂,病原容易感染扩散,土壤中的大量病原微生物暴露,易污染水源等环境;畜禽抵抗力下降,容易受到疫病侵袭,造成非洲猪瘟、口蹄疫、高致病性猪蓝耳病,高致病性禽流感等重大动物疫病,以及血吸虫病、炭疽...","NoPicture","洪涝灾害动物疫病防控技术指南","http://www.gov.cn/xinwen/2020-07/16/content_5527342.htm"
"中国政府网","2020年7月19日","记者19日从应急管理部获悉,7月以来,洪涝灾害造成江西、安徽、湖北、湖南、重庆、贵州等24省(区、市)2385.7万人次受灾,31人死亡失踪,203.9万人次紧急转移安置。,2020-07-19-20:07:00","NoPicture","应急管理部:7月以来洪涝灾害已致2385.7万人次受灾","http://www.gov.cn/xinwen/2020-07/19/content_5528245.htm"
"中国政府网","2020年7月19日","为加强洪涝地质灾害的应急应对,支持受灾地区做好灾后重建和恢复生产,切实保障人民群众利益,现就有关事项通知如下: 一、切实提高对加强防灾减灾工作的认识。受灾地区银保监局要高度重视当前洪涝地质灾害对经济金融运行和群众生产生活的影响,...","NoPicture","中国银保监会办公厅关于做好洪涝地质灾害应急应对及灾后重建金融...","http://www.gov.cn/zhengce/zhengceku/2020-07/19/content_5528215.htm"
"中国政府网","2020年7月17日","记者16日获悉,据应急管理部统计,7月份以来洪涝灾害造成江西、安徽、湖北、湖南、重庆、贵州等24省(区、市)2027.2万人次受灾,23人死亡失踪,176.4万人次紧急转移安置;1.2万间房屋倒塌,8.9万间不同程度损坏;农作物受灾面积2207.5千...","NoPicture","应急管理部:7月以来洪涝灾害已致2027.2万人次受灾","http://www.gov.cn/xinwen/2020-07/17/content_5527598.htm"
"中国政府网","2020年7月16日","发生洪涝灾害时,大量畜禽因灾死亡,尸体腐烂,病原容易感染扩散,土壤中的大量病原微生物暴露,易污染水源等环境;畜禽抵抗力下降,容易受到疫病侵袭,造成非洲猪瘟、口蹄疫、高致病性猪蓝耳病,高致病性禽流感等重大动物疫病,以及血吸虫病、炭疽...","NoPicture","洪涝灾害动物疫病防控技术指南","http://www.gov.cn/xinwen/2020-07/16/content_5527342.htm"
"中国政府网","2020年7月13日","依托“三大运营商”开展面向社会公众的预警服务,提醒公众自觉远离山洪灾害高风险地区。指导基层地方政府建立完善网格化群测群防体系并落实相关措施。七要强化责任落实。各级水利部门要切实履职尽责,立足监测预报预警、水工程调度、抢险技术支撑...","NoPicture","...贯彻落实习近平总书记重要指示精神有针对性落实当前水旱灾害...","http://www.gov.cn/xinwen/2020-07/13/content_5526393.htm"
"中国政府网","2020年7月9日","入梅以来,湖北先后遭遇7轮强降雨,引发严重洪涝灾害。8日11时,湖北省减灾委、省应急管理厅将省级自然灾害救助应急响应由Ⅳ级提升为Ⅲ级。 人民至上,生命至上。面对暴雨引发的灾情,湖北各地统筹部署、紧急应对,全力以赴抢险救灾,切实保障...","https://dss0.bdstatic.com/6Ox1bjeh1BF3odCf/it/u=3817026861,2705852122&fm=217&app=92&size=f242,162&n=0&g=0n&f=JPEG?s=00A242B14C1286C40234BCAC0300E01A&sec=1618987967&t=71bdcb8816cd56d4b755eb66374d2281","抢险!群众的安全高于一切——湖北统筹部署紧急应对洪涝灾害","http://www.gov.cn/xinwen/2020-07/09/content_5525190.htm"
"央视网","2020年7月7日","来源: 央视网 2020年07月07日 20:38 内容简介 洪涝灾害暴雨强降雨 52 新闻栏目推荐  新闻联播  焦点访谈  新闻直播间  新闻1+1  朝闻天下  广告 广告CCTV-1综合 CCTV-2财经 CCTV-3综艺 CCTV-4中文国际 CCTV-5体育 CCTV-5+...","https://dss1.bdstatic.com/6OF1bjeh1BF3odCf/it/u=2633136175,1022404340&fm=217&app=92&size=f242,162&n=0&g=0n&f=JPEG?s=91C3E4A68A748CCE041A8203030070DB&sec=1618987967&t=ad393bdd571068f339b49c5345b7cf86","[东方新闻]今年以来洪涝灾害 已致全国26省(区、市)1938万人次受灾...","http://news.cctv.com/2020/07/07/VIDEn3Rd4LKTXhoLZSemVXEn200707.shtml"
"中国新闻网","2020年7月6日","经核定,上半年,全国自然灾害以洪涝、风雹、地质灾害为主,森林火灾、地震、干旱、低温冷冻和雪灾等也有不同程度发生。各种自然灾害共造成4960.9万人次受灾,271人死亡失踪,91.3万人次紧急转移安置;1.9万间房屋倒塌,78.5万间房屋不同...","https://dss1.bdstatic.com/6OF1bjeh1BF3odCf/it/u=2674115662,4132407246&fm=217&app=92&size=f242,162&n=0&g=0n&f=JPEG?s=519633D10012F7D81515155D03009063&sec=1618987967&t=2ff88532a517a8a46caee47cd278948c","应急管理部:上半年全国自然灾害造成271人死亡失踪","https://www.chinanews.com/gn/2020/07-06/9230406.shtml"
"央视网","2020年7月5日","央视网消息:受强降雨天气影响,日本九州地区的熊本县自4号凌晨起发生河水泛滥和山体滑坡、泥石流等次生灾害。目前已造成16人死亡、16人心肺功能停止,另有14人失踪。 编辑:甄涛关于护理 世卫组织驻华代表曾希望传递这样一个信息 国家...","https://dss0.bdstatic.com/6Ox1bjeh1BF3odCf/it/u=1913524167,2084362525&fm=217&app=92&size=f242,162&n=0&g=0n&f=JPEG?s=F19719D49AAB250F2A83DD000300E0D8&sec=1618987967&t=f8681ab7b2bd1a7ef4af548ccf379edc","强降雨致日本九州发生严重次生灾害 已造成16人死亡","http://news.cctv.com/2020/07/05/ARTIi7KuS6X4wlSsjE5RJXQY200705.shtml"
"要塞阵地","4月6日","虽说现在世界局势大体上是和平的,没有国家轻易发动战争,但还是有部分地区常年爆发战争,就比如中东地区,有不少国家为了争夺利益而发起战乱,那么出现了哪些征兆就说明战争即将爆发了呢?历史经验已给出答案,以下四个征兆就能提前预知。 第一...","https://dss1.baidu.com/6ONXsjip0QIZ8tyhnq/it/u=3154710784,139363439&fm=30&app=106&size=f242,162&n=0&g=0n&f=JPEG?s=88A24F95248BBEE152A1582603008070&sec=1618987969&t=ea4b8e316b7ff52fdd2aafec0acd574d","若有这4大“预兆”出现,或即将爆发战争?历史经验已给出答案","https://baijiahao.baidu.com/s?id=1696281545959064587&wfr=spider&for=pc"
"东北行营","4月6日","直到1995年7月27日,美国在华盛顿建成了一个朝鲜战争纪念公园,在公园内地上碑石刻的伤亡人数为:阵亡人数中,美国为54246人,其他联军加韩军为628833人;受伤人数中,美国为103284人,其他联军加韩军1064453人;失踪人数中, 美国为8177人,其...","https://dss1.baidu.com/6ONXsjip0QIZ8tyhnq/it/u=4010789594,139362520&fm=30&app=106&size=f242,162&n=0&g=0n&f=JPEG?s=22EADE055E4114571830753D0300C041&sec=1618987969&t=d68e19e14ae7d598d76cc1ec757c0ccb","抗美援朝三年战争中美军到底伤亡多少人?美韩其实交出一笔糊涂账","https://baijiahao.baidu.com/s?id=1696280565821900420&wfr=spider&for=pc"
"腾讯网","4月6日","只要想起这场伟大的战争,很多人耳畔都会想起“雄赳赳、气昂昂”的战歌。年仅一岁的新中国,与世界上最强大的国家打了一仗,不仅打出我军的赫赫军威,还一雪自鸦片战争以来,西方列强加诸于我们身上的耻辱。 抗美援朝的胜利证明,我们的军队...","https://dss0.bdstatic.com/6Ox1bjeh1BF3odCf/it/u=2926310386,3849281440&fm=217&app=2&size=f242,162&n=0&g=0n&f=JPEG?s=9CC272234C1372D41CB8D49B0100C081&sec=1618987969&t=5598e07478e5b62f3aa5d517d9af2760","志愿军巧设坑道阵,两战歼敌16万,彭德怀:取消第六次战役","http://new.qq.com/omn/ENT20190/20210406A01W1W00.html"
"史料横生","4月6日","当年在土地革命战争时,蒋介石得知了毛主席不再进行指挥的消息之后,那真的是无比的兴奋啊,因为在他看来,如果毛泽东失去了指挥权的话,那对于国民党来说无疑是消灭共产党最好的时机;而后来在遵义会议之后,毛主席再度掌权,蒋介石得知后那也...","https://dss1.baidu.com/6ONXsjip0QIZ8tyhnq/it/u=2172270467,139347889&fm=30&app=106&size=f242,162&n=0&g=0n&f=JPEG?s=C8E23A668C0ED65F4E9DE49F01008091&sec=1618987969&t=9041ae00851250b1e902352f4afd122b","毛主席指挥的哪场战役,被蒋介石认为是国军的“奇耻大辱”?","https://baijiahao.baidu.com/s?id=1696243933681739764&wfr=spider&for=pc"
"温乎","4月6日","于是,麦克阿瑟定下“圣诞回家”的方案,也就是集中兵力快速向北推进,争取在圣诞节以前结束战争,回到美国和家人团圆。 麦克阿瑟的方案分为两步: 西线主力是美国第八集团军,越过清川江向北进攻,直扑中朝边境的鸭绿江。东线主力是美军第十集...","https://dss2.baidu.com/6ONYsjip0QIZ8tyhnq/it/u=264431952,139339667&fm=30&app=106&size=f242,162&n=0&g=0n&f=JPEG?s=A5DA7396452CCDEF4ACD747403008074&sec=1618987969&t=6f4fc0f55a0f69964775abb9be048819","新中国最重要的一场战役,15万军人准备牺牲","https://baijiahao.baidu.com/s?id=1696255854843926240&wfr=spider&for=pc"
"大国文史记","4月5日","虽然最后的结果是我军获得了胜利,但也付出了很大的代价。 虽然与抗日战争相比,28天并不算什么,但同样也考验了我军的作战实力。在这其中有很多非常经典的战役,其中的高平战役被称为是硬仗中的硬仗。在这其中进行了非常庞大的坦克和反...","https://dss1.baidu.com/6ONXsjip0QIZ8tyhnq/it/u=4289922193,139296264&fm=30&app=106&size=f242,162&n=0&g=0n&f=JPEG?s=32BB5C835E1330C25C29FC070300E0C1&sec=1618987969&t=5ab45b4bfa368e0ce79045dd39831612","对越战中最难的战斗,高平战役我军付出惨痛代价,与三大原因有关","https://baijiahao.baidu.com/s?id=1696209403990005560&wfr=spider&for=pc"
"像素说","4月5日","可是这并不是古代的冷兵器战争,坚守城郭并没有什么用,而且这也给了日寇机会。随即,趁着守军据守城郭,日本鬼子也完成了对南京的严密包围,导致守军的防御线被缩成一团。 从当时的战局来看,十万守军唯一能免遭覆灭厄运的可能便是改变死...","https://dss1.baidu.com/6ONXsjip0QIZ8tyhnq/it/u=1027211957,139296133&fm=30&app=106&size=f242,162&n=0&g=0n&f=JPEG?s=8FAAE1054A5162CC0E305D17010010E3&sec=1618987969&t=1078f5b970fa7cafa3294d42c5270472","南京保卫战为什么会输?这是一场没有赢的希望,又不得不打的战争","https://baijiahao.baidu.com/s?id=1696207070621857130&wfr=spider&for=pc"
"烽火亮剑","4月5日","而中国之所以会把更多的精力放在军事实力的提升上,是因为曾经的一场战争给我们带来了极大的震撼。 很多人第一时间想到的是海湾战争,这场战争给我国带来的触动不小,但其实最先震撼到中国的,是美国对中东利比亚这场11分半的打击:黄金...","https://dss2.baidu.com/6ONYsjip0QIZ8tyhnq/it/u=2516349560,139676000&fm=30&app=106&size=f242,162&n=0&g=0n&f=JPEG?s=BFB65984062106A40DA9D53403001060&sec=1618987969&t=0cab56897d62062d79acaf79ffdd6ab0","最先震撼到中国的,不是海湾战争,而是美国这场11分半的打击","https://baijiahao.baidu.com/s?id=1696206372119836118&wfr=spider&for=pc"
"xiaozi124","4月5日","萨尔贡统一战争、图特摩斯东征、希波战争、伯罗奔尼撒战争 亚历山大东征、继业者战争、摩羯陀扩张战争、布匿战争 秦朝统一战争、汉匈战争、罗马一帕提亚战争、五胡乱华战争 罗马一日耳曼战争、匈人西征、查士丁尼西征、拜占庭一萨珊波斯战争 阿拉...","https://dss1.baidu.com/6ONXsjip0QIZ8tyhnq/it/u=1843534641,139291171&fm=30&app=106&size=f242,162&n=0&g=0n&f=JPEG?s=EA8B25C7E2805B4D228D8C7903008053&sec=1618987969&t=71ffcbc57f5ad7638c3d423787f65887","世界战争史","https://baijiahao.baidu.com/s?id=1696203830171438298&wfr=spider&for=pc"
"寻历史真相","4月5日","人们很诧异,抗日战争期间八路军和新四军普遍小米加步枪,可是来到解放战争却鸟枪换大炮,这中间到底发生了什么?在全国解放军序列当中,东北野战军可算得上下山猛虎,人员规模大,装备齐全,这支强悍的部队一入关就直接从长白山打到了海南岛。 除...","https://dss0.baidu.com/6ONWsjip0QIZ8tyhnq/it/u=4158455777,139355119&fm=30&app=106&size=f242,162&n=0&g=0n&f=JPEG?s=96BC7984108923E71009E08603006093&sec=1618987969&t=b4daaf9a324dd89aa5f44c699fc3ad12","解放战争时期,这个国家曾支援2000多个火车皮的物资和各种枪炮","https://baijiahao.baidu.com/s?id=1696199076913291651&wfr=spider&for=pc"
"百家号","4月5日","两伊战争的胜利者并不在中东,而是在世界各处,两伊战争是1980年到1988年进行的,由伊拉克率先入侵伊朗而导致的两国之间的战争,在当时双方的投入兵力总计已经超过百万之众,而且双方的作战十分激烈,虽然伊拉克来势凶猛,并且攻入伊朗腹地,但是随...","https://dss2.baidu.com/6ONYsjip0QIZ8tyhnq/it/u=32563400,139250314&fm=30&app=106&size=f242,162&n=0&g=0n&f=JPEG?s=818023F9C4A388F308B1381F03001042&sec=1618987970&t=6214faa60f7be58ab865a19d6f5741c1","两伊战争谁胜了?战后的战争:胜利者都没直接参战?","https://baijiahao.baidu.com/s?id=1696160078266619884&wfr=spider&for=pc"
"澎湃新闻","4月4日","1931年爆发的九一八事变,标志着日本妄图变中国为其独占殖民地的侵略战争已经开始。中国人民反对日本侵略的抗日民族解放战争也从此开始。但由于日本实行不宣而战的逐步推进的战争策略,及国民党政府执行不敢宣战的有限的抵抗政策,使全国性的抗战...","https://dss2.bdstatic.com/6Ot1bjeh1BF3odCf/it/u=3850762598,2366880920&fm=217&app=2&size=f242,162&n=0&g=0n&f=JPEG?s=119AA37D0BA7C94D5AA1D86A0300E072&sec=1618987970&t=3223dfe2cc6f215a671c312647828a59","每日一答:为什么中国人民的抗日战争在1937年七七事变前会形成局部...","http://www.thepaper.cn/newsDetail_forward_12051456"
"澎湃新闻","4月4日","1967年6月阿以战争中,以色列再次进攻埃及后,埃及封锁了两个入口,并在运河中击沉船只、埋设水雷,致使运河又被封锁了八年——在1973年的阿以战争使得埃及在1975年6月恢复了对运河的全面控制之后,埃及-以色列和平进程得以展开,运河才重新...","https://dss1.bdstatic.com/6OF1bjeh1BF3odCf/it/u=3483607221,2179893085&fm=217&app=2&size=f242,162&n=0&g=0n&f=JPEG?s=C7B01AC5FA1557CE96ACAC56030010B1&sec=1618987970&t=c7f83099995370faee002ad8a1030690","从帝国霸权到全球资本主义,围绕苏伊士运河的战争","http://www.thepaper.cn/newsDetail_forward_12043156"
"澎湃新闻","4月4日","穿过宛平城东城门,向西几百米处,就是中国人民抗日战争纪念馆的大门。而宛平城墙上,至今还保留着1937年7月,七七事变爆发时日军炮击宛平城的弹痕。 除了周一闭馆日,位于卢沟桥畔的中国人民抗日战争纪念馆每天迎来的参观群众穿梭不停。来自江...","https://dss2.bdstatic.com/6Ot1bjeh1BF3odCf/it/u=3864891439,227693153&fm=217&app=2&size=f242,162&n=0&g=0n&f=JPEG?s=3422DF103E5A63C21B284DC10300A0B9&sec=1618987970&t=1b18f7051564ed46be6e3d69d689a0be","百名女大学生讲述100个党史故事〡中国人民抗日战争:铭刻史册的...","http://www.thepaper.cn/newsDetail_forward_12048832"
"澎湃新闻","4月4日","任山河,是一幅人民解放战争悲壮的历史画卷。 清明时节,细雨寄哀思,人们接踵来到任山河烈士陵园祭扫,缅怀革命先烈。 1949年,解放全中国的革命洪流席卷大江南北。蒋介石不甘心失败,妄图依靠盘踞在陕青宁的胡宗南、马步芳、马鸿逵集团固守西北,...","https://dss2.bdstatic.com/6Ot1bjeh1BF3odCf/it/u=3756489962,3237534040&fm=217&app=2&size=f242,162&n=0&g=0n&f=JPEG?s=4A02ED0BCCB9588C3BB820E10300E0B2&sec=1618987970&t=f7ed774510e228eda6070457fd74d280","任山河战斗:打响解放宁夏第一仗","http://www.thepaper.cn/newsDetail_forward_12047937"
"腾讯网","4月4日","种种迹象表明,一场战争正在酝酿中。 也别太紧张,我说的不是台海,不是半岛,也不是印巴,尽管这些问题,迟早也会解决,解决得不好,也不排除地动山摇。美国人不是说了嘛,台海,很可能六年内就会摊牌。 ","https://dss0.bdstatic.com/6Ox1bjeh1BF3odCf/it/u=2175301548,2240957169&fm=217&app=2&size=f242,162&n=0&g=0n&f=PNG?s=470A2FE152020AEECE308131030010E3&sec=1618987970&t=2dacbf62e51b1cb1db896408c6c1518b","坦克源源不断运往前线,一场战争正在酝酿中!","https://new.qq.com/rain/a/20210404A01ZO200"
"中华儿女","3月23日","海军的大部分兵力投入战争 而志愿军没有海军参战 战争后期只有少量空军 掩护后方运输 中国人民志愿军战士在前线就着雪吃炒面 就是在这样极不对称 极为艰难的条件下 1950年10月25日 至1951年6月10日 中国人民志愿军同 朝鲜人民军密切...","https://dss2.baidu.com/6ONYsjip0QIZ8tyhnq/it/u=1156697077,138125837&fm=30&app=106&size=f242,162&n=0&g=0n&f=JPEG?s=56D718D684C29FE92E2B7EBF0300901E&sec=1618987970&t=236f7d4d2ca2487ceff476fde929c628","那场战争治好了“恐美症”,中国人从来都不吃这一套!","https://baijiahao.baidu.com/s?id=1694952519220729783&wfr=spider&for=pc"
"潇湘晨报","3月13日","希腊大约从30年前开始要求归还文物,而英国政府一直坚持拒绝并称,帕特农神庙雕塑并非战争掠夺,而是合法途径获得。 2020年6月20日,是雅典卫城博物馆建成11周年,当天,希腊政府再次敦促英国归还帕特农神庙雕塑。希腊文化部长门佐尼表示,希腊当局...","https://dss0.baidu.com/6ONWsjip0QIZ8tyhnq/it/u=3000649032,1436483900&fm=173&app=49&size=f242,162&n=0&g=0n&f=JPEG?s=6950AB46860B215D81F50C9203004093&sec=1618987970&t=5939193b440b38da1b3b1d8820a33d15","英国拒将帕特农神庙雕塑归还希腊:并非战争掠夺,是合法途径获得","https://baijiahao.baidu.com/s?id=1694133870938615724&wfr=spider&for=pc"
"观察者网","2月22日","但是,战争并非不可避免。两国仍有可能采取防止灾难发生的措施:在我看来,建立一个“有管控的战略竞争”的联合框架,将降低竞争升级为公开冲突的风险。 中共越来越有信心,10年之内,按市场汇率计算,中国的GDP将最终超过美国,成为世界上最...","https://cambrian-images.cdn.bcebos.com/a54e350552a4cc52324007fb2a34b1b2_1546608532556400.jpeg@w_100,h_100","陆克文:战争是中美竞争的失败,那么成功的标志是什么?","https://baijiahao.baidu.com/s?id=1692350022329594470&wfr=spider&for=pc"
"AI科技报","2月13日","来到了新的一年,在新的一年当中,有许多厂商都在筹备着自己的新机,比如IQOO。在前段时间推出了IQOO7系列手机之后,还有IQOO的neo系列一直没有更新。而最近关于最新的IQOO neo5手机也有了最新的消息。 根据国内某数码博主的爆料称,IQOO neo...","https://dss0.baidu.com/6ONWsjip0QIZ8tyhnq/it/u=2518567308,3990731612&fm=173&app=49&size=f242,162&n=0&g=0n&f=JPEG?s=ADE3F804BB67AA4D0A41C4910300E080&sec=1618987970&t=2eb03ef6bf7b32bcf39653b17348f863","次旗舰战争,IQOOneo5和红米k40或同时开售,到底该怎么选?","https://baijiahao.baidu.com/s?id=1691547082035285410&wfr=spider&for=pc"
"潇湘晨报","3月13日","希腊大约从30年前开始要求归还文物,而英国政府一直坚持拒绝并称,帕特农神庙雕塑并非战争掠夺,而是合法途径获得。 2020年6月20日,是雅典卫城博物馆建成11周年,当天,希腊政府再次敦促英国归还帕特农神庙雕塑。希腊文化部长门佐尼表示,希腊当局...","https://dss0.baidu.com/6ONWsjip0QIZ8tyhnq/it/u=3000649032,1436483900&fm=173&app=49&size=f242,162&n=0&g=0n&f=JPEG?s=6950AB46860B215D81F50C9203004093&sec=1618987971&t=702acce5b355cb7199697b46f55380e7","英国拒将帕特农神庙雕塑归还希腊:并非战争掠夺,是合法途径获得","https://baijiahao.baidu.com/s?id=1694133870938615724&wfr=spider&for=pc"
"观察者网","2月22日","但是,战争并非不可避免。两国仍有可能采取防止灾难发生的措施:在我看来,建立一个“有管控的战略竞争”的联合框架,将降低竞争升级为公开冲突的风险。 中共越来越有信心,10年之内,按市场汇率计算,中国的GDP将最终超过美国,成为世界上最...","https://cambrian-images.cdn.bcebos.com/a54e350552a4cc52324007fb2a34b1b2_1546608532556400.jpeg@w_100,h_100","陆克文:战争是中美竞争的失败,那么成功的标志是什么?","https://baijiahao.baidu.com/s?id=1692350022329594470&wfr=spider&for=pc"
"AI科技报","2月13日","来到了新的一年,在新的一年当中,有许多厂商都在筹备着自己的新机,比如IQOO。在前段时间推出了IQOO7系列手机之后,还有IQOO的neo系列一直没有更新。而最近关于最新的IQOO neo5手机也有了最新的消息。 根据国内某数码博主的爆料称,IQOO neo...","https://dss0.baidu.com/6ONWsjip0QIZ8tyhnq/it/u=2518567308,3990731612&fm=173&app=49&size=f242,162&n=0&g=0n&f=JPEG?s=ADE3F804BB67AA4D0A41C4910300E080&sec=1618987971&t=16cf1890fc697e051f96c63a484d721b","次旗舰战争,IQOOneo5和红米k40或同时开售,到底该怎么选?","https://baijiahao.baidu.com/s?id=1691547082035285410&wfr=spider&for=pc"
"森林狼","2月13日","早在上世纪所爆发的海湾战争,就成功将信息化作战技术的优势,宣扬整个世界。纵使海湾战争向全世界证明了信息化作战的强大,但要说成功让世界战争形势下定决心转型的,却是那一场美国对战利比亚的“11分钟战争”。那次战争,利比亚如同待宰羔...","https://cambrian-images.cdn.bcebos.com/b1393647e01abe055be6218277247bbc_1549589701646038.jpeg@w_100,h_100","11分钟就大获全胜!比海湾战争更早的信息化战争,惊醒了世界各国","https://baijiahao.baidu.com/s?id=1691514000849289373&wfr=spider&for=pc"
"春秋点将堂","2月12日","所有的战争都是残酷的,尤其是对实力弱小的国家来说,战争代表的只有杀戮和死亡,战争结束后,国家经济倒退,人民生活民不聊生。那么,哪场战争是最先唤醒中国、打醒世界的呢?很多人都认为是上世纪90年代由美国发起的海湾战争,因为这场战争...","https://cambrian-images.cdn.bcebos.com/7b32ab75490acc9bf5cadb2d0b46e711_1562651735753379.jpeg@w_100,h_100","哪场战争唤醒了我们?并非海湾战争,而是这场18分就结束的战斗","https://baijiahao.baidu.com/s?id=1691493173737501839&wfr=spider&for=pc"
